review_id,restaurant_id,restaurant_name,review_text,review_text_cleaned,rating,review_date,review_source,word_count,sentiment_score,sentiment_subjectivity,sentiment_category,area,cuisine_primary,price_category
rev_00001,src3_113,Laduree,[liked it] i went to this restaurant ladore in Beirut. it had a very good food and nice service. it was french-Italian restaurant. i recommend it if you are staying more than 4 days as the Lebanese restaurant has the priority for me,liked it: i went to this restaurant ladore in Beirut. it had a very good food and nice service. it was french-Italian restaurant. i recommend it if you are staying more than 4 days as the Lebanese restaurant has the priority for me,5.0,,TripAdvisor,43,0.6525,0.77,Positive,0 ABC Ashrafieh,Unknown,Unknown
rev_00002,src3_066,Dunya Beirut,"[Racist to Khaleejis - never coming back]  i booked for adam’s night on june 29 /2018 
And i booked it 2 weeks in advance .. when we came, the restaurant was full of empty tables and we were the second group to arrive.. UNFORTUNATELY they gave us the LAST and worst table ! He looked at us and had to think a little and decided at the moment !!! When we asked why? He told us our reservation was late ??? When i checked the list my name was on top of it !! 

Never going back - not worth the money ! ","Racist to Khaleejis - never coming back: i booked for adam’s night on june 29 /2018 And i booked it 2 weeks in advance .. when we came, the restaurant was full of empty tables and we were the second group to arrive.. UNFORTUNATELY they gave us the LAST and worst table ! He looked at us and had to think a little and decided at the moment !!! When we asked why? He told us our reservation was late ??? When i checked the list my name was on top of it !! Never going back - not worth the money !",1.0,,TripAdvisor,103,-0.11020507812500001,0.40138888888888885,Negative,Damascus,Unknown,Unknown
rev_00003,src3_066,Dunya Beirut,"[Excellent experience] Very cozy place
Great band specially a lady sings old Egyptian songs
Good amount and quality food (appetizers)+main dish
Excellent service with very friendly staff",Excellent experience: Very cozy place Great band specially a lady sings old Egyptian songs Good amount and quality food (appetizers)+main dish Excellent service with very friendly staff,5.0,,TripAdvisor,27,0.5230803571428572,0.7183035714285715,Positive,Damascus,Unknown,Unknown
rev_00004,src3_066,Dunya Beirut,"[Dinner and show] If you are a turist in Beirut its a nice place. A lot of food, not the best but good. It is not a la cart though. The show is very nice. Takes an hour or so. 115.000 lyras/person. Kind of pricy but worthed for the whole pacage. ","Dinner and show: If you are a turist in Beirut its a nice place. A lot of food, not the best but good. It is not a la cart though. The show is very nice. Takes an hour or so. 115.000 lyras/person. Kind of pricy but worthed for the whole pacage.",4.0,,TripAdvisor,51,0.6466666666666667,0.7000000000000001,Positive,Damascus,Unknown,Unknown
rev_00005,src3_066,Dunya Beirut,"[Very Very Nice Atmosphere, show and food] Probably one of the BEST places to go for an evening in Beirut.  
Amazing dtsff ...especially Ali and Hassan.
Great artists and dancers.
Superb and generous food portions.","Very Very Nice Atmosphere, show and food: Probably one of the BEST places to go for an evening in Beirut. Amazing dtsff ...especially Ali and Hassan. Great artists and dancers. Superb and generous food portions.",5.0,,TripAdvisor,35,0.836,0.79,Positive,Damascus,Unknown,Unknown
rev_00006,src3_066,Dunya Beirut,"[Disappointing food for the value] 1- First of all the good stuff... I must say i loved the atmosphere!! There were 2 belly dancers, and 2 singers who performed 👍🏻

2- However the food was very disappointing for the value we paid $75 per person. The food was basically only appetizers!! And we got some fruit, chocolate bar, meghli, and chocolate rolls and rice pudding at the end!! 

3-All lebanese mezzes usually come with a main course either bbq (meat/fish) i was very disappointed will not come back again!! I felt we were ripped off!!! 

3- Seems they are focusing more on the performances going on than the food itself! 

4- The restaurant is kind of small and not sure if they have a ventilation system because the restaurant was filled with white smoke from hooka and cigs. 

I wouldn’t recommend this place to anyone. All restaurants in lebanon have performances with better fixed menus! Which includes a main course!! ","Disappointing food for the value: 1- First of all the good stuff... I must say i loved the atmosphere!! There were 2 belly dancers, and 2 singers who performed 👍🏻 2- However the food was very disappointing for the value we paid $75 per person. The food was basically only appetizers!! And we got some fruit, chocolate bar, meghli, and chocolate rolls and rice pudding at the end!! 3-All lebanese mezzes usually come with a main course either bbq (meat/fish) i was very disappointed will not come back again!! I felt we were ripped off!!! 3- Seems they are focusing more on the performances going on than the food itself! 4- The restaurant is kind of small and not sure if they have a ventilation system because the restaurant was filled with white smoke from hooka and cigs. I wouldn’t recommend this place to anyone. All restaurants in lebanon have performances with better fixed menus! Which includes a main course!!",2.0,,TripAdvisor,160,0.080109649122807,0.553888888888889,Neutral,Damascus,Unknown,Unknown
rev_00007,src3_082,Gia La Cucina D'amore,"[Fav place] A seven stars restaurant in the middle of achrafiyeh 😍 my fav place so far .italian food to die for, kind staff and good music ❤️❤️❤️","Fav place: A seven stars restaurant in the middle of achrafiyeh 😍 my fav place so far .italian food to die for, kind staff and good music ❤️❤️❤️",5.0,,TripAdvisor,28,0.35,0.625,Positive,Monot,Unknown,Unknown
rev_00008,src3_082,Gia La Cucina D'amore,[Great experience.] amazing restaurant with great vibes  and great food. Food was amazing and will definitely try it again. ,Great experience.: amazing restaurant with great vibes and great food. Food was amazing and will definitely try it again.,5.0,,TripAdvisor,19,0.6,0.7583333333333333,Positive,Monot,Unknown,Unknown
rev_00009,src3_082,Gia La Cucina D'amore,"[The best italian restaurant in lebanon, amazing team , positive vibes, beautiful place , the food is to die for, love] I'm in love with everything in this restaurant,  from food to service, most authentic real Italian restaurant in lebanon","The best italian restaurant in lebanon, amazing team , positive vibes, beautiful place , the food is to die for, love: I'm in love with everything in this restaurant, from food to service, most authentic real Italian restaurant in lebanon",5.0,,TripAdvisor,40,0.46772727272727277,0.5195454545454545,Positive,Monot,Unknown,Unknown
rev_00010,src3_082,Gia La Cucina D'amore,"[Great food] Nice spot and most importantly great food. The Pizza is AMAZING, staff is very friendly as well . Highly recommended .","Great food: Nice spot and most importantly great food. The Pizza is AMAZING, staff is very friendly as well . Highly recommended .",5.0,,TripAdvisor,23,0.5639285714285716,0.7271428571428571,Positive,Monot,Unknown,Unknown
rev_00011,src3_082,Gia La Cucina D'amore,"[Beautiful Italian Restaurant in Achrafieh] Gia la Cucina d'Amore is a hidden gem in the heart of the city. The moment you step inside, you're transported to a charming indoor garden with lush greenery and a relaxing atmosphere. The space is beautifully decorated and makes for a perfect backdrop for a romantic dinner or a night out with friends.

The food is just as impressive as the setting. The menu offers a variety of classic Italian dishes made with fresh, high-quality ingredients. We highly recommend the lasagna and tiramisu - they were both incredibly flavorful and satisfying.

The staff at Gia la Cucina d'Amore are knowledgeable and attentive, making our dining experience all the more enjoyable. Whether you're looking for a special night out or a casual dinner with friends, this restaurant is a must-visit. We can't wait to come back and enjoy the indoor garden atmosphere again!","Beautiful Italian Restaurant in Achrafieh: Gia la Cucina d'Amore is a hidden gem in the heart of the city. The moment you step inside, you're transported to a charming indoor garden with lush greenery and a relaxing atmosphere. The space is beautifully decorated and makes for a perfect backdrop for a romantic dinner or a night out with friends. The food is just as impressive as the setting. The menu offers a variety of classic Italian dishes made with fresh, high-quality ingredients. We highly recommend the lasagna and tiramisu - they were both incredibly flavorful and satisfying. The staff at Gia la Cucina d'Amore are knowledgeable and attentive, making our dining experience all the more enjoyable. Whether you're looking for a special night out or a casual dinner with friends, this restaurant is a must-visit. We can't wait to come back and enjoy the indoor garden atmosphere again!",5.0,,TripAdvisor,148,0.3572670807453417,0.57296066252588,Positive,Monot,Unknown,Unknown
rev_00012,src3_220,Zuruni Cafe Beirut,[A perfect visit] The restaurant is located direct at the sea with a very nice ambience. Get your Shisha an some delicious food and relax. You will love it.,A perfect visit: The restaurant is located direct at the sea with a very nice ambience. Get your Shisha an some delicious food and relax. You will love it.,4.0,,TripAdvisor,29,0.6759999999999999,0.8,Positive,Choucri Ghanem Street,Unknown,Unknown
rev_00013,src3_220,Zuruni Cafe Beirut,"[Review] A very good restaurant. The food is absolutely delicious, delightful and fresh , the staff is highly professional and friendly and the ambience is nice as well.  The service is prompt and punctual and the hygiene is optimal too.","Review: A very good restaurant. The food is absolutely delicious, delightful and fresh , the staff is highly professional and friendly and the ambience is nice as well. The service is prompt and punctual and the hygiene is optimal too.",4.0,,TripAdvisor,40,0.6121428571428572,0.6971428571428573,Positive,Choucri Ghanem Street,Unknown,Unknown
rev_00014,src3_201,The Original Falafel M Sahyoun,[Would fly the world for this !] I would travel the world for THIS falafel!! And I’m not even a fan of falafel! Totally converted. Yum!! So good. And so clean!,Would fly the world for this !: I would travel the world for THIS falafel!! And I’m not even a fan of falafel! Totally converted. Yum!! So good. And so clean!,5.0,,TripAdvisor,31,0.5395833333333333,0.7375,Positive,Damascus Road Ras El-Nabeh,Unknown,Unknown
rev_00015,src3_201,The Original Falafel M Sahyoun,[Live the falafel - go there] One of the best falafel sandwich I tried - marvelous and mouth watering - must try if you come to Beirut. Do not miss it please,Live the falafel - go there: One of the best falafel sandwich I tried - marvelous and mouth watering - must try if you come to Beirut. Do not miss it please,5.0,,TripAdvisor,32,0.712121212121212,0.6,Positive,Damascus Road Ras El-Nabeh,Unknown,Unknown
rev_00016,src3_201,The Original Falafel M Sahyoun,"[Top 2 in Beirut] Loved the portion size, not huge, but manageable.  Enjoyed the yogurt drink (ayran) and the calmness of the late the lunch, since there were no crowds.  The staff also helped me get a reasonable local van taxi, after noticing how we were swindled by the taxi driver that brought us there.  They were shocked how much we paid for the local taxi.  To be fair, it was my first full day, and the jet-lag and confusion about the currency, made it easy to be cheated.  One is cheated and learns a lesson to hopefully not be repeated :)","Top 2 in Beirut: Loved the portion size, not huge, but manageable. Enjoyed the yogurt drink (ayran) and the calmness of the late the lunch, since there were no crowds. The staff also helped me get a reasonable local van taxi, after noticing how we were swindled by the taxi driver that brought us there. They were shocked how much we paid for the local taxi. To be fair, it was my first full day, and the jet-lag and confusion about the currency, made it easy to be cheated. One is cheated and learns a lesson to hopefully not be repeated :)",5.0,,TripAdvisor,102,0.20888888888888885,0.5811111111111111,Positive,Damascus Road Ras El-Nabeh,Unknown,Unknown
rev_00017,src3_201,The Original Falafel M Sahyoun,[Great Falafel] Our tour guide said they made the best falafel in Beirut and possibly the world.  No arguments from me.  ,Great Falafel: Our tour guide said they made the best falafel in Beirut and possibly the world. No arguments from me.,5.0,,TripAdvisor,21,0.6,0.6833333333333332,Positive,Damascus Road Ras El-Nabeh,Unknown,Unknown
rev_00018,src3_201,The Original Falafel M Sahyoun,"[Delicious falafel in downtown Beirut] Great spot for a takeaway falafel (the shop has literally 2 chairs inside, so there is not too much of a space to sit).

The owner and the staff were polite and welcoming, they spoke English and the falafel sandwiches we got were absolutely delicious. Highly recommended!","Delicious falafel in downtown Beirut: Great spot for a takeaway falafel (the shop has literally 2 chairs inside, so there is not too much of a space to sit). The owner and the staff were polite and welcoming, they spoke English and the falafel sandwiches we got were absolutely delicious. Highly recommended!",4.0,,TripAdvisor,52,0.5333333333333333,0.5816666666666667,Positive,Damascus Road Ras El-Nabeh,Unknown,Unknown
rev_00019,src3_095,Jars & Co,"[Lunch at jars & Co] Such a nice discovery the Jars and Co in Monot street Beirut.
I had lunch there with my colleagues and I loved the idea of salads and deserts in mini jars.
The hot meals ( my favorite between what i have eaten were the noodles but i would have preferred to have more meat in them. And more dressing on the side.
Regarding the deserts thumbs up for the cheese cake and fruit salad! Picture below!
The ladies owning/serving are just adorable and smiling!",Lunch at jars & Co: Such a nice discovery the Jars and Co in Monot street Beirut. I had lunch there with my colleagues and I loved the idea of salads and deserts in mini jars. The hot meals ( my favorite between what i have eaten were the noodles but i would have preferred to have more meat in them. And more dressing on the side. Regarding the deserts thumbs up for the cheese cake and fruit salad! Picture below! The ladies owning/serving are just adorable and smiling!,3.0,,TripAdvisor,89,0.49453125,0.76875,Positive,Clemenceau,Unknown,Unknown
rev_00020,src3_095,Jars & Co,"[Delivery order] I loved the idea, it is new and the jars can be re used or recycled which is very practical. I have ordered a delivery of salads in a jar and they tasted quite well. The only problem I faced is that the delivery took so much time to arrive (an hour). I am curious to try other things and to eat in sometimes.","Delivery order: I loved the idea, it is new and the jars can be re used or recycled which is very practical. I have ordered a delivery of salads in a jar and they tasted quite well. The only problem I faced is that the delivery took so much time to arrive (an hour). I am curious to try other things and to eat in sometimes.",3.0,,TripAdvisor,66,0.14448051948051946,0.589935064935065,Positive,Clemenceau,Unknown,Unknown
rev_00021,src3_095,Jars & Co,"[A must try] Such a lovely discovery which I made!! I was looking for a place to order lunch and I noted the Jars & Co. The menu was interesting and the concept was new. I decided to give it a try. The place's name describes what they do... food in jars. Cute and lovely. I called them and I was received by a very nice and lovely voice that giggled politely to my jokes and took my order. I went for a healthy salad ""HAPPY"". The name was happy and thats how I felt after eating it. Loved it!! and I do recommend you try it. ","A must try: Such a lovely discovery which I made!! I was looking for a place to order lunch and I noted the Jars & Co. The menu was interesting and the concept was new. I decided to give it a try. The place's name describes what they do... food in jars. Cute and lovely. I called them and I was received by a very nice and lovely voice that giggled politely to my jokes and took my order. I went for a healthy salad ""HAPPY"". The name was happy and thats how I felt after eating it. Loved it!! and I do recommend you try it.",4.0,,TripAdvisor,107,0.566467803030303,0.750378787878788,Positive,Clemenceau,Unknown,Unknown
rev_00022,src3_146,Naranj Cafe,"[Truly exceptional experience!] As soon as we stepped inside, the atmosphere was welcoming, and beautifully designed and set the tone to a memorable meal.
The perfect balance between cozy and elegant. The lighting, music, and decor all contributed to a relaxed, enjoyable environment that made us feel right at home.

The food was equally impressive. Every dish was fresh, flavorful, and perfectly cooked. You can really taste the care and quality in each bite. The quinoa and  shrimp was a standout, rich, and beautifully presented and the hummos with herbs was also very delicious.
In the other side, it was my first time tasting the fattet fawaregh, and I was honestly blown away. From the very first bite, the flavors were rich, perfectly balanced, and unexpectedly satisfying. The texture, the seasoning, the aroma, everything came together in the best way. I didn’t expect to love it this much, but it quickly became a new favorite. It was one of those meals you remember long after the last bite.

The staff were friendly and attentive without being intrusive. Overall, a fantastic dining experience. Highly recommended for anyone who appreciates great food in a great setting!","Truly exceptional experience!: As soon as we stepped inside, the atmosphere was welcoming, and beautifully designed and set the tone to a memorable meal. The perfect balance between cozy and elegant. The lighting, music, and decor all contributed to a relaxed, enjoyable environment that made us feel right at home. The food was equally impressive. Every dish was fresh, flavorful, and perfectly cooked. You can really taste the care and quality in each bite. The quinoa and shrimp was a standout, rich, and beautifully presented and the hummos with herbs was also very delicious. In the other side, it was my first time tasting the fattet fawaregh, and I was honestly blown away. From the very first bite, the flavors were rich, perfectly balanced, and unexpectedly satisfying. The texture, the seasoning, the aroma, everything came together in the best way. I didn’t expect to love it this much, but it quickly became a new favorite. It was one of those meals you remember long after the last bite. The staff were friendly and attentive without being intrusive. Overall, a fantastic dining experience. Highly recommended for anyone who appreciates great food in a great setting!",5.0,,TripAdvisor,194,0.4776687726687726,0.6753673803673802,Positive,Roucheid El Dahdah,Unknown,Unknown
rev_00023,src3_073,Em Sherif Restaurant,"[Reservation impossible for ""only"" 2 people? Seriously?] I am not judging the quality of the food, as I did not have the opportunity to eat there.

However, my experience with this restaurant was extremely disappointing. Their website claims to offer a high-end service, but the reservation form does not work. I tried contacting them via Instagram, email, and WhatsApp, but never received a response.

I then went to the restaurant in person to make a reservation, and a staff member refused to take my booking for two people, claiming there was a minimum of four guests, information that is nowhere indicated. Even worse, the person spoke down to me, suggesting that the $75 menu was probably “a bit expensive” for me.

Verdict: a huge lack of respect and an extremely disappointing service.","Reservation impossible for ""only"" 2 people? Seriously?: I am not judging the quality of the food, as I did not have the opportunity to eat there. However, my experience with this restaurant was extremely disappointing. Their website claims to offer a high-end service, but the reservation form does not work. I tried contacting them via Instagram, email, and WhatsApp, but never received a response. I then went to the restaurant in person to make a reservation, and a staff member refused to take my booking for two people, claiming there was a minimum of four guests, information that is nowhere indicated. Even worse, the person spoke down to me, suggesting that the $75 menu was probably “a bit expensive” for me. Verdict: a huge lack of respect and an extremely disappointing service.",1.0,,TripAdvisor,132,-0.2617283950617284,0.7283950617283952,Negative,Rue Victor Hugo Ashrafieh,Unknown,Unknown
rev_00024,src3_073,Em Sherif Restaurant,"[Best Lebanese food ever] The food is superbly cooked . It is worth the trip to Harrods. 
The labneh, the tabbouleh, were one of the best we have eaten in our life.","Best Lebanese food ever: The food is superbly cooked . It is worth the trip to Harrods. The labneh, the tabbouleh, were one of the best we have eaten in our life.",5.0,,TripAdvisor,32,0.825,0.42500000000000004,Positive,Rue Victor Hugo Ashrafieh,Unknown,Unknown
rev_00025,src3_073,Em Sherif Restaurant,"[0👎🏻👎🏻👎🏻👎🏻👎🏻👎🏻👎🏻] 👎🏻👎🏻👎🏻👎🏻👎🏻👎🏻👎🏻000000
Hello,
I just wanted to share some feedback regarding our recent experience at your restaurant.

We called ahead and were clearly told that the ordering would be à la carte. But when we arrived, we were surprised to hear it was actually $38 per person — something we were not informed about over the phone.

Still, we decided to go ahead and enjoy our evening. We ordered juice, and they brought out cake. But then, without us asking for the bill or even saying we were ready, they suddenly brought it to the table.

Unfortunately, the way we were treated was very disappointing. The staff were cold and unwelcoming, and the whole experience felt uncomfortable.

We expected a much higher level of hospitality and left feeling quite let down. I just wanted to share this feedback in the hope it can help improve future guest experiences.","0👎🏻👎🏻👎🏻👎🏻👎🏻👎🏻👎🏻: 👎🏻👎🏻👎🏻👎🏻👎🏻👎🏻👎🏻000000 Hello, I just wanted to share some feedback regarding our recent experience at your restaurant. We called ahead and were clearly told that the ordering would be à la carte. But when we arrived, we were surprised to hear it was actually $38 per person — something we were not informed about over the phone. Still, we decided to go ahead and enjoy our evening. We ordered juice, and they brought out cake. But then, without us asking for the bill or even saying we were ready, they suddenly brought it to the table. Unfortunately, the way we were treated was very disappointing. The staff were cold and unwelcoming, and the whole experience felt uncomfortable. We expected a much higher level of hospitality and left feeling quite let down. I just wanted to share this feedback in the hope it can help improve future guest experiences.",1.0,,TripAdvisor,148,-0.08150326797385622,0.5151307189542484,Neutral,Rue Victor Hugo Ashrafieh,Unknown,Unknown
rev_00026,src3_073,Em Sherif Restaurant,"[Bad Experience] Unfortunately the service we received at Em Sherif Achrafieh was unacceptable. No one reached for me after my initial complain about the way that the waiter was serving or the way he treats “your” customers!
Despite my efforts to bring this to your attention, i haven’t received any response yet! This lack of response is not only unprofessional but also reflects poorly on the reputation of your restaurant. Customer service should be a top priority for any reputable establishment and the lack of attention to my complaints is simply unacceptable. It might be trivial to you that it is not a big issue, but it is important for me now even if the issue is not a big deal to Em Sherif’s! It is a shame that customer satisfaction is no longer a priority for your restaurant and has lost sight of the importance of providing a positive and enjoyable experience! I expected better from a restaurant of your reputation!","Bad Experience: Unfortunately the service we received at Em Sherif Achrafieh was unacceptable. No one reached for me after my initial complain about the way that the waiter was serving or the way he treats “your” customers! Despite my efforts to bring this to your attention, i haven’t received any response yet! This lack of response is not only unprofessional but also reflects poorly on the reputation of your restaurant. Customer service should be a top priority for any reputable establishment and the lack of attention to my complaints is simply unacceptable. It might be trivial to you that it is not a big issue, but it is important for me now even if the issue is not a big deal to Em Sherif’s! It is a shame that customer satisfaction is no longer a priority for your restaurant and has lost sight of the importance of providing a positive and enjoyable experience! I expected better from a restaurant of your reputation!",1.0,,TripAdvisor,162,0.07848484848484852,0.5446176046176046,Neutral,Rue Victor Hugo Ashrafieh,Unknown,Unknown
