review_id,restaurant_id,restaurant_name,review_text,review_text_cleaned,rating,review_date,review_source,word_count,sentiment_score,sentiment_subjectivity,sentiment_category,area,cuisine_primary,price_category
rev_00421,src3_114,Lakkis Farm Restaurant - Batroun,"[Bad] Slow service 
Weird staff
The patisserie chef was looking at us in an awkward way .
Tnxu
Good food,nice atmosphere.great location","Bad: Slow service Weird staff The patisserie chef was looking at us in an awkward way . Tnxu Good food,nice atmosphere.great location",1.0,,TripAdvisor,22,-0.28,0.7333333333333333,Negative,Sea Side Rd,Unknown,Unknown
rev_00422,src3_114,Lakkis Farm Restaurant - Batroun,"[Horrible food experience] This was one of the worst food experiences. Fattush had a weird taste & they brought us a raw pink chicken, and when we told them, they brought us another one with a horrible smell, we couldn't touch and we paid for it. Horrible place and never going there. This is the second terrible experience at this place. Overhyped and terrible.","Horrible food experience: This was one of the worst food experiences. Fattush had a weird taste & they brought us a raw pink chicken, and when we told them, they brought us another one with a horrible smell, we couldn't touch and we paid for it. Horrible place and never going there. This is the second terrible experience at this place. Overhyped and terrible.",1.0,,TripAdvisor,64,-0.6755244755244756,0.791958041958042,Negative,Sea Side Rd,Unknown,Unknown
rev_00423,src3_114,Lakkis Farm Restaurant - Batroun,"[High Investment, Lower Service Quality] We ordered coffee more than four times, but the waiters and their communication were not up to standard. Lakkis has invested a lot, but they need to improve the performance of their frontliners, or they will risk losing more customers.

We went to buy meat on a Sunday morning and I asked for the meat to be skewered. The butcher told me they didn’t have time because they were too busy. However, this is unacceptable since we are paying a higher price for the meat compared to other high-quality butchers like Bakkar in Tripoli.

If Lakkis continues with the same level of service, they will lose many customers.","High Investment, Lower Service Quality: We ordered coffee more than four times, but the waiters and their communication were not up to standard. Lakkis has invested a lot, but they need to improve the performance of their frontliners, or they will risk losing more customers. We went to buy meat on a Sunday morning and I asked for the meat to be skewered. The butcher told me they didn’t have time because they were too busy. However, this is unacceptable since we are paying a higher price for the meat compared to other high-quality butchers like Bakkar in Tripoli. If Lakkis continues with the same level of service, they will lose many customers.",2.0,,TripAdvisor,113,0.20944444444444446,0.3711111111111111,Positive,Sea Side Rd,Unknown,Unknown
rev_00424,src3_114,Lakkis Farm Restaurant - Batroun,[Excellent] Very good service the food was amazing and the place was amazing the desserts was so tasty  the atmosphere was good and we had a nice experience.,Excellent: Very good service the food was amazing and the place was amazing the desserts was so tasty the atmosphere was good and we had a nice experience.,5.0,,TripAdvisor,28,0.7349999999999999,0.8633333333333333,Positive,Sea Side Rd,Unknown,Unknown
rev_00425,src3_114,Lakkis Farm Restaurant - Batroun,"[Bad] Worst taste of food ever 
Worst service 
Food is not tasty at all
We asked for water more than 6 times 
Terrible experience not recommended at all",Bad: Worst taste of food ever Worst service Food is not tasty at all We asked for water more than 6 times Terrible experience not recommended at all,1.0,,TripAdvisor,28,-0.6399999999999999,0.8333333333333333,Negative,Sea Side Rd,Unknown,Unknown
rev_00426,src3_029,Barakit Asmat Cafe Bistro,[Must visit] Amazing and very clean guesthouse and cafe with delicious vegan food.. friendly staff and you feel relaxed  with the calm vibes.. i will definitely visit it again💫💚,Must visit: Amazing and very clean guesthouse and cafe with delicious vegan food.. friendly staff and you feel relaxed with the calm vibes.. i will definitely visit it again💫💚,5.0,,TripAdvisor,29,0.45861111111111114,0.7600000000000001,Positive,149 Street 12,Unknown,Unknown
rev_00427,src3_029,Barakit Asmat Cafe Bistro,[Great food at the café] the cafe serves the most tasteful healthy fresh food for affordable prices in Batroun. the hot chocolate is to die for and the hospitality is heartwarming.,Great food at the café: the cafe serves the most tasteful healthy fresh food for affordable prices in Batroun. the hot chocolate is to die for and the hospitality is heartwarming.,5.0,,TripAdvisor,31,0.47000000000000003,0.62,Positive,149 Street 12,Unknown,Unknown
rev_00428,src3_029,Barakit Asmat Cafe Bistro,"[Coffee Hotspot!] I love this place. Feels like I’m visiting a mate’s house rather than a cafe. Bring your family and pets, sit in the garden and dig into some delicious avocado toast with a fresh juice and an amazing French press coffee. Very friendly staff and host, cozy laid-back atmosphere, great music and relaxed vibe. A regular visit at least once a week!","Coffee Hotspot!: I love this place. Feels like I’m visiting a mate’s house rather than a cafe. Bring your family and pets, sit in the garden and dig into some delicious avocado toast with a fresh juice and an amazing French press coffee. Very friendly staff and host, cozy laid-back atmosphere, great music and relaxed vibe. A regular visit at least once a week!",4.0,,TripAdvisor,64,0.31124999999999997,0.5626923076923077,Positive,149 Street 12,Unknown,Unknown
rev_00429,src3_029,Barakit Asmat Cafe Bistro,[Barakit asmat] This place is elegant with an awesome vibe. the food was amazing. My favorite is goat labneh and kaakeh kashkawen The team was friendly.,Barakit asmat: This place is elegant with an awesome vibe. the food was amazing. My favorite is goat labneh and kaakeh kashkawen The team was friendly.,5.0,,TripAdvisor,26,0.595,0.8800000000000001,Positive,149 Street 12,Unknown,Unknown
rev_00430,src3_029,Barakit Asmat Cafe Bistro,"[Café in Batroun] A lovely place located in the heart of Batroun, where we had coffee and food. They have a variety of food selection! We had the Vegan avo and Goat Labneh toast! A must try.
You can check their menu on instagram: Barakit Asmat.
It's a really calm and cozy place where you can relax, take a break during your tour in Batroun.
They also have Orso Bianco's ice cream🤩","Café in Batroun: A lovely place located in the heart of Batroun, where we had coffee and food. They have a variety of food selection! We had the Vegan avo and Goat Labneh toast! A must try. You can check their menu on instagram: Barakit Asmat. It's a really calm and cozy place where you can relax, take a break during your tour in Batroun. They also have Orso Bianco's ice cream🤩",5.0,,TripAdvisor,72,0.29375,0.75,Positive,149 Street 12,Unknown,Unknown
rev_00431,src3_124,Lemonade Chahine,"[Best lemonade in town] Best refreshing batroun lemonade.
The real star of the show was the lemonade. It was simply delicious, so fresh and perfectly sweet, with just the right amount of tartness.
Highly recommended","Best lemonade in town: Best refreshing batroun lemonade. The real star of the show was the lemonade. It was simply delicious, so fresh and perfectly sweet, with just the right amount of tartness. Highly recommended",5.0,,TripAdvisor,35,0.5328571428571428,0.5695238095238095,Positive,Centre Saint Rock,Unknown,Unknown
rev_00432,src3_124,Lemonade Chahine,"[Best Lemonade in Batroun!!] So many places that sell Lemonade in Batroun, tried them all. However Lemonade Chahein was the best I’ve ever tasted. Natural ingredients, nothing artificial and definitely worth trying!!😋","Best Lemonade in Batroun!!: So many places that sell Lemonade in Batroun, tried them all. However Lemonade Chahein was the best I’ve ever tasted. Natural ingredients, nothing artificial and definitely worth trying!!😋",5.0,,TripAdvisor,32,0.3833333333333333,0.43333333333333335,Positive,Centre Saint Rock,Unknown,Unknown
rev_00433,src3_124,Lemonade Chahine,"[Overrated and expensive- not worth it] Just a name, no longer the better lemonade. Many nearby stores taste better or the same and are offering at  half price. 

Chahine is offering the largest size at 100,000 LL at the time i bought it, which is ridiculous","Overrated and expensive- not worth it: Just a name, no longer the better lemonade. Many nearby stores taste better or the same and are offering at half price. Chahine is offering the largest size at 100,000 LL at the time i bought it, which is ridiculous",2.0,,TripAdvisor,46,0.043750000000000004,0.4489583333333333,Neutral,Centre Saint Rock,Unknown,Unknown
rev_00434,src3_159,Patisserie RIM,[Best lemonade in Batroun] Absolutely delicious and what a wonderful warm  store owner. Has been there  for 60 years.  Delicious coffee and sweets and lemonade! A must !!!,Best lemonade in Batroun: Absolutely delicious and what a wonderful warm store owner. Has been there for 60 years. Delicious coffee and sweets and lemonade! A must !!!,5.0,,TripAdvisor,28,0.9199999999999999,0.78,Positive,Main Street,Unknown,Unknown
rev_00435,src3_159,Patisserie RIM,"[Lemonade at Rim's] This place makes the best lemonade!!
Very friendly and welcoming staff.
Great prices.
Totally recommend it!!!",Lemonade at Rim's: This place makes the best lemonade!! Very friendly and welcoming staff. Great prices. Totally recommend it!!!,5.0,,TripAdvisor,19,0.571875,0.6125,Positive,Main Street,Unknown,Unknown
rev_00436,src3_159,Patisserie RIM,[Refreshing Lemonade] The lemonade is perfect balanced and not too sweet. This is the best lemonade I have tasted. It’s perfect for this sunny and hot day. So refreshing. Service was excellent and welcoming.,Refreshing Lemonade: The lemonade is perfect balanced and not too sweet. This is the best lemonade I have tasted. It’s perfect for this sunny and hot day. So refreshing. Service was excellent and welcoming.,5.0,,TripAdvisor,34,0.7,0.85,Positive,Main Street,Unknown,Unknown
rev_00437,src3_159,Patisserie RIM,"[Delicious] Best homemade like lemonade,delicious natural ice cream and wonderful friendly service…A MUST try when you’re in Batroun Lebanon","Delicious: Best homemade like lemonade,delicious natural ice cream and wonderful friendly service…A MUST try when you’re in Batroun Lebanon",5.0,,TripAdvisor,19,0.6950000000000001,0.64,Positive,Main Street,Unknown,Unknown
rev_00438,src3_089,Hometown,"[Dinner with friends] Best sushi place 
Everything is so fresh and delicious 
Service is more than excellent and the ambiance is perfect",Dinner with friends: Best sushi place Everything is so fresh and delicious Service is more than excellent and the ambiance is perfect,5.0,,TripAdvisor,22,0.7999999999999999,0.7166666666666667,Positive,Main Street Old Souk Street a1,Unknown,Unknown
rev_00439,src3_089,Hometown,"[Sushi in my hometown] It’s always as good as the first visit.
Whether in the restaurant or by home delivery, the food is fresh and delicious.","Sushi in my hometown: It’s always as good as the first visit. Whether in the restaurant or by home delivery, the food is fresh and delicious.",5.0,,TripAdvisor,26,0.5625,0.6083333333333334,Positive,Main Street Old Souk Street a1,Unknown,Unknown
rev_00440,src3_089,Hometown,"[Best sushi pub in the area] Without doubt, the best sushi pub in the area. A must try. 
Cocktails, sushi, ambiance, service. I strongly recommend. ","Best sushi pub in the area: Without doubt, the best sushi pub in the area. A must try. Cocktails, sushi, ambiance, service. I strongly recommend.",5.0,,TripAdvisor,25,0.8111111111111112,0.4444444444444445,Positive,Main Street Old Souk Street a1,Unknown,Unknown
rev_00441,src3_089,Hometown,"[Great sushi! Excellent place] What a great sushi experience! We had an excellent surprise in this place. The dishes are delicious and it is a  very nice place to hang out.

Highly recommended",Great sushi! Excellent place: What a great sushi experience! We had an excellent surprise in this place. The dishes are delicious and it is a very nice place to hang out. Highly recommended,5.0,,TripAdvisor,33,0.8485714285714286,0.8628571428571429,Positive,Main Street Old Souk Street a1,Unknown,Unknown
rev_00442,src3_089,Hometown,[Fantastic food with great staff. Would always come back. you need to make a reservation on weekends.] Try also the fantastic drinks at the professional bar. I had a blue wine and some great mojitos. We love that place in Lebanon.,Fantastic food with great staff. Would always come back. you need to make a reservation on weekends.: Try also the fantastic drinks at the professional bar. I had a blue wine and some great mojitos. We love that place in Lebanon.,5.0,,TripAdvisor,41,0.375,0.5125,Positive,Main Street Old Souk Street a1,Unknown,Unknown
rev_00443,src3_081,Georges Maalouf Seafood & Snack,[Amazing new location] Amazing new location for George Mallouf in front of his old corner one location.spacious more food on the menu and the food never tasted better . With fresh grilled fish the place is now complete. Yummy and very good value for money,Amazing new location: Amazing new location for George Mallouf in front of his old corner one location.spacious more food on the menu and the food never tasted better . With fresh grilled fish the place is now complete. Yummy and very good value for money,5.0,,TripAdvisor,45,0.38827272727272727,0.558909090909091,Positive,118 Street,Unknown,Unknown
rev_00444,src3_081,Georges Maalouf Seafood & Snack,"[Tasty tasty tasty] It's an amazing fast food restaurant. Sandwiches are so tasty. I tried octopus and raw fish. Be careful raw fish is a little bit spicy I love it.
",Tasty tasty tasty: It's an amazing fast food restaurant. Sandwiches are so tasty. I tried octopus and raw fish. Be careful raw fish is a little bit spicy I love it.,5.0,,TripAdvisor,31,0.07870879120879122,0.6461538461538462,Neutral,118 Street,Unknown,Unknown
rev_00445,src3_081,Georges Maalouf Seafood & Snack,[Try the octopus and remember this is paradise city] Lovely atmosphere by the Phoenician Walls. The menu has everything you need. They serve the dishes in shells try to get a table upstairs if it's not so hot and you will have a meal with the most magical view.  ,Try the octopus and remember this is paradise city: Lovely atmosphere by the Phoenician Walls. The menu has everything you need. They serve the dishes in shells try to get a table upstairs if it's not so hot and you will have a meal with the most magical view.,5.0,,TripAdvisor,49,0.4375,0.775,Positive,118 Street,Unknown,Unknown
rev_00446,src3_081,Georges Maalouf Seafood & Snack,[Such good food - and so fresh!] An unassuming street café serving seafood wraps - you could walk straight past it and not know what you'd missed - but oh! The food! So fresh its almost swimming off your plate - tasty and excellently cooked - just perfect. You could pay ten times this price in a posh seafood restaurant and not have a tenth of the pleasure at the taste. Thanks all at the café - such nice food (and local craft beer available as well!),Such good food - and so fresh!: An unassuming street café serving seafood wraps - you could walk straight past it and not know what you'd missed - but oh! The food! So fresh its almost swimming off your plate - tasty and excellently cooked - just perfect. You could pay ten times this price in a posh seafood restaurant and not have a tenth of the pleasure at the taste. Thanks all at the café - such nice food (and local craft beer available as well!),5.0,,TripAdvisor,87,0.3203125,0.4892857142857143,Positive,118 Street,Unknown,Unknown
rev_00447,src3_081,Georges Maalouf Seafood & Snack,"[Delicious food] I visited this small fish sandwich shop with a couple of friends and all three of us ordered a second sandwich immediately after we finished the first ones. All ingredients are fresh, super tasty, the place is clean and the owner is very friendly. It’s located in old souk that is very beautiful itself, close to the beach. I’ll definitely be back every time I visit Batroun.","Delicious food: I visited this small fish sandwich shop with a couple of friends and all three of us ordered a second sandwich immediately after we finished the first ones. All ingredients are fresh, super tasty, the place is clean and the owner is very friendly. It’s located in old souk that is very beautiful itself, close to the beach. I’ll definitely be back every time I visit Batroun.",5.0,,TripAdvisor,69,0.3261363636363636,0.4954545454545455,Positive,118 Street,Unknown,Unknown
rev_00448,src3_198,Teta's Mezza House,"[Feels like home] Staff Expertise: 9/10, Very polite and helpful, they will definitely make some helpful suggestions regarding the food. Especially considering we had dietary requirements. 

• Atmosphere: 10/10, The atmosphere was amazing especially the upstairs and outside area. Felt like we were in Italy and the seats are comfortable. Also the background music is very well selected.

• Food & Drinks: 10/10, The food here is amazing honestly, menu item portion size was perfect (not small servings like other Lebanese restaurants) the food quality is very satisfying.

• Cleanliness: 10/10, Tables and dining areas are clean, as well as the  bathroom, had a lovely scent.","Feels like home: Staff Expertise: 9/10, Very polite and helpful, they will definitely make some helpful suggestions regarding the food. Especially considering we had dietary requirements. • Atmosphere: 10/10, The atmosphere was amazing especially the upstairs and outside area. Felt like we were in Italy and the seats are comfortable. Also the background music is very well selected. • Food & Drinks: 10/10, The food here is amazing honestly, menu item portion size was perfect (not small servings like other Lebanese restaurants) the food quality is very satisfying. • Cleanliness: 10/10, Tables and dining areas are clean, as well as the bathroom, had a lovely scent.",5.0,,TripAdvisor,106,0.3197916666666667,0.6796875,Positive,Unknown,Unknown,Unknown
rev_00449,src3_042,Bistr'eau,[One of the best restaurants in Batroun] Excellent food one of the best i have every time that i am in Batroun. Plus it has different kind of dishes not the one u find in every restaurant and they are all yummy.,One of the best restaurants in Batroun: Excellent food one of the best i have every time that i am in Batroun. Plus it has different kind of dishes not the one u find in every restaurant and they are all yummy.,5.0,,TripAdvisor,42,0.72,0.62,Positive,Mina street,Unknown,Unknown
rev_00450,src3_042,Bistr'eau,"[Amazing Food] We had a really great experience here. The staff were fantastic. The food was delicious. We had linguini and risotto, which were both fantastic. Accompanied by a fantastic bottle of Lebanese wine.","Amazing Food: We had a really great experience here. The staff were fantastic. The food was delicious. We had linguini and risotto, which were both fantastic. Accompanied by a fantastic bottle of Lebanese wine.",5.0,,TripAdvisor,34,0.6,0.8916666666666667,Positive,Mina street,Unknown,Unknown
rev_00451,src3_042,Bistr'eau,"[BEST SEAFOOD IN BATROUN!] This seafood restaurant stood out as a culinary revelation that defied our expectations. Despite initially being overshadowed by a couple of other higher-ranked seafood restaurants in the area, we decided to give Bistr’eau a try as our first meal, upon arriving in Batroun. Little did we know, it would turn out to be the culinary highlight of our stay, ultimately the place we selected as our last meal and the grand finale of our time in Batroun.

Situated beneath a series of picturesque succession of ornate arches along the waterfront, within one of Batroun's historical buildings at the port of the Batroûn Old Souk, this restaurant stood out as a true outlier. What made this dining experience truly exceptional was the symphony of flavors orchestrated by the fusion of cuisines, the inventive pairing of traditional and rarely-used ingredients, and the meticulous execution of each dish. Between our two visits, we embarked on a culinary journey through almost the entire menu, relishing every morsel.

The appetizers alone were a testament to the culinary prowess at play – from the refreshing Fattouch to the innovative Hummus with shrimp, the smoky allure of the aubergine with sundried tomato tarator, and fresh zaatar. The culinary exploration continued with Grilled Calamari, Sicilian octopus, shrimp fokhara with tomato sauce, and perfectly roasted Patatas Bravas. All this food only served to pave the way for the triumphant main courses—seafood risotto and the pièce de résistance, a perfectly seasoned deep-fried whole fish. The culinary symphony reached its crescendo with the Pain Perdu à la mode, offering the perfect sweet note to conclude our culinary odyssey.","BEST SEAFOOD IN BATROUN!: This seafood restaurant stood out as a culinary revelation that defied our expectations. Despite initially being overshadowed by a couple of other higher-ranked seafood restaurants in the area, we decided to give Bistr’eau a try as our first meal, upon arriving in Batroun. Little did we know, it would turn out to be the culinary highlight of our stay, ultimately the place we selected as our last meal and the grand finale of our time in Batroun. Situated beneath a series of picturesque succession of ornate arches along the waterfront, within one of Batroun's historical buildings at the port of the Batroûn Old Souk, this restaurant stood out as a true outlier. What made this dining experience truly exceptional was the symphony of flavors orchestrated by the fusion of cuisines, the inventive pairing of traditional and rarely-used ingredients, and the meticulous execution of each dish. Between our two visits, we embarked on a culinary journey through almost the entire menu, relishing every morsel. The appetizers alone were a testament to the culinary prowess at play – from the refreshing Fattouch to the innovative Hummus with shrimp, the smoky allure of the aubergine with sundried tomato tarator, and fresh zaatar. The culinary exploration continued with Grilled Calamari, Sicilian octopus, shrimp fokhara with tomato sauce, and perfectly roasted Patatas Bravas. All this food only served to pave the way for the triumphant main courses—seafood risotto and the pièce de résistance, a perfectly seasoned deep-fried whole fish. The culinary symphony reached its crescendo with the Pain Perdu à la mode, offering the perfect sweet note to conclude our culinary odyssey.",5.0,,TripAdvisor,271,0.22877604166666668,0.46666666666666673,Positive,Mina street,Unknown,Unknown
rev_00452,src3_042,Bistr'eau,"[Out of this world] Amazing food, amazing place, amazing service. Batroon is out of this world. The restaurant is out of this world. I loved it and i highly recommend ","Out of this world: Amazing food, amazing place, amazing service. Batroon is out of this world. The restaurant is out of this world. I loved it and i highly recommend",5.0,,TripAdvisor,30,0.532,0.808,Positive,Mina street,Unknown,Unknown
rev_00453,src3_042,Bistr'eau,"[Amazing and super yummy] Excellent food, service and place. Food was amazing, diversified and amazing. We ordered lots of plates and we shared, it was amazing.","Amazing and super yummy: Excellent food, service and place. Food was amazing, diversified and amazing. We ordered lots of plates and we shared, it was amazing.",5.0,,TripAdvisor,26,0.6222222222222222,0.8777777777777778,Positive,Mina street,Unknown,Unknown
rev_00454,src3_167,Roadster Diner,"[Roadster diner Batroun: A Lunch Disaster] 
I had a disappointing experience at Roadsterdiner Batroun. The food took an hour to arrive, and we had to wait for forks, knives, and drinks. Even after asking for the check, we waited 15 minutes. It was a terrible lunch experience.","Roadster diner Batroun: A Lunch Disaster: I had a disappointing experience at Roadsterdiner Batroun. The food took an hour to arrive, and we had to wait for forks, knives, and drinks. Even after asking for the check, we waited 15 minutes. It was a terrible lunch experience.",1.0,,TripAdvisor,47,-0.8,0.85,Negative,Sea Side Road,Unknown,Unknown
rev_00455,src3_167,Roadster Diner,"[Bad] 3 bad experiences in a raw then i decided to write this review maybe they wake up 
Zero custemor service uppon delivery order the food was crap (kale salad)",Bad: 3 bad experiences in a raw then i decided to write this review maybe they wake up Zero custemor service uppon delivery order the food was crap (kale salad),1.0,,TripAdvisor,30,-0.3861538461538461,0.7189743589743589,Negative,Sea Side Road,Unknown,Unknown
