restaurant_id,name,cuisine_primary,cuisine_tags,address_full,area,city,country,phone,rating_overall,rating_google,rating_tripadvisor,review_count_total,review_count_google,review_count_tripadvisor,star_5_count,star_4_count,star_3_count,star_2_count,star_1_count,star_5_percent,star_4_percent,star_3_percent,star_2_percent,star_1_percent,price_category,hours_monday,hours_tuesday,hours_wednesday,hours_thursday,hours_friday,hours_saturday,hours_sunday,delivery_available,outdoor_seating,reservation_required,description,menu_items,menu_link,why_to_go,reviews_summary,tips,website,data_source,source_url,scraped_date,last_updated
src1_035,Indigo on the Roof,Unknown,Unknown,"Le Gray Hotel Martyrs Square, Beirut, Lebanon",Le Gray Hotel Martyrs Square,Beirut,Lebanon,+9611972000,4.3,4.3,4.3,156,78,78,45,23,6,0,4,57.7,29.5,7.7,0.0,5.1,High-End,Unknown,Unknown,Unknown,Unknown,Unknown,Unknown,Unknown,Unknown,Unknown,Unknown,"About Indigo on the Roof, perched atop the luxurious Le Gray Hotel in Beirut, is a dining gem that promises an unforgettable experience. This sophisticated restaurant offers two delightful settings: dine indoors with ample sunlight and stunning views or bask in the fresh air on the outdoor terrace while soaking up breathtaking cityscapes. Whether you're indulging in breakfast, enjoying a leisurely Sunday brunch, or savoring dinner under the stars, Indigo on the Roof caters to all occasions.",,,Why you should go 1 Experience consistent 5-star treatment 2 Enjoy calm and beautiful rooftop ambiance 3 Try delicious dishes like homemade chips with labne dip and crispy duck salad,"Indigo on the Roof at Le Gray Hotel in Beirut offers a consistent 5-star treatment with calm and beautiful rooftop ambiance. Reviewers appreciate the versatile menu, attentive service, and delicious dishes like homemade chips with labne dip, salmon tiradito, and crispy duck salad. The setting under the stars creates a cozy and romantic atmosphere for an enjoyable dining experience.","For a more intimate experience, visit during weekdays or early evenings to avoid crowds | Try replacing avocado with artichokes in the salmon tiradito for a unique twist on flavors | Don't miss out on trying the Crispy Duck Salad as it's described as a pleasant surprise by reviewers | Consider ordering cocktails from the bar next door if you prefer them over wine from their list",https://www.campbellgrayhotels.com/le-gray-beirut/restaurant-bar-post/indigo-on-the-roof/,source1,https://www.google.com/maps/search/?api=1&query=Indigo+on+the+Roof%2C+Le+Gray+Hotel+Martyrs+Square%2C+Beirut%2C+Lebanon&query_place_id=ChIJj6eAWCEXHxURj4gfx-tkRmY,2026-04-07,2026-04-07
src1_036,مطعم مزيان - Mezyan,Lebanese,"Lebanese,Armenian,Fusion","Rasamny building, Street, Lebanon",Rasamny building,Street,Lebanon,+96171293015,4.4,4.4,4.4,2566,1283,1283,793,319,107,25,39,61.8,24.9,8.3,1.9,3.0,Mid-Range,Unknown,Unknown,Unknown,Unknown,Unknown,Unknown,Unknown,Unknown,Unknown,Unknown,"About Mezyan, located in the vibrant district of Hamra, is a hidden gem offering a delightful culinary experience. The warm and inviting ambiance sets the stage for an authentic Lebanese dining journey with a modern twist. Tucked away in the Rasamany Building, this magical cafe serves up small plates of Lebanese, Syrian, and Armenian mezze. From traditional classics to innovative fusions, Mezyan's menu caters to all palates.","Batata harra,Fattoush,Couscous,Hummus,Kibbeh",https://facebook.com/pg/MezyanPub/menu/,Why you should go 1 Experience authentic Lebanese and Moroccan cuisine 2 Enjoy live music nights with entertaining bands 3 Delight in perfectly cooked dishes like the fish fillet and mixed grill,"Mezyan Restaurant in Beirut offers a delightful dining experience with delicious Lebanese and Moroccan cuisine. Reviewers praise the perfectly cooked fish fillet, crispy fries, and refreshing salads. The restaurant provides excellent value for money with reasonable prices and smooth ordering processes. Guests enjoy live music nights, friendly staff, and a cozy atmosphere. The mixed grill is highly recommended for its well-cooked meat, flavorful hummus, garlic sauce, and pickles.","Visit Mezyan for Friday or Saturday night parties to enjoy the vibrant atmosphere with live music performances. | For a quieter dining experience, consider visiting during off-peak hours or weekdays. | If you prefer less sweetness in your dish, be cautious when trying the Cherry Kebab. | When ordering takeout from Mezyan Restaurant, expect generous portions suitable for sharing or satisfying hearty appetites.",https://www.facebook.com/MezyanPub/timeline,source1,https://www.google.com/maps/search/?api=1&query=%D9%85%D8%B7%D8%B9%D9%85+%D9%85%D8%B2%D9%8A%D8%A7%D9%86+-+Mezyan%2C+Rasamny+building%2C+Street%2C+Lebanon&query_place_id=ChIJbUA2jykXHxUR839cNRlf5oE,2026-04-07,2026-04-07
src1_037,Tabliyit Massaad,Lebanese,"Lebanese,Fusion","Gouraud Street, Beirut, Lebanon",Gouraud Street,Beirut,Lebanon,+9611445370,4.2,4.2,4.2,1396,698,698,342,206,99,24,27,49.0,29.5,14.2,3.4,3.9,Mid-Range,12PM-12AM,12PM-12AM,12PM-12AM,12PM-12AM,12PM-12AM,12PM-12AM,12PM-12AM,Unknown,Unknown,Unknown,"About Tabliyit Massaad, also known as Massaad Express, may seem like a typical fast food joint at first glance, but it offers much more. The chain is known for its vibrant atmosphere and affordable prices. What sets it apart are the exceptional sandwiches served on wooden boards called Tabliye. These sandwiches come with unexpected touches like toasted sesame seeds and generous portions that leave you satisfied.","Tuna salad,French fries",,Why you should go 1 Indulge in scrumptious normal Lebanese food at affordable prices 2 Try unique fusion twists on traditional Lebanese dishes 3 Enjoy friendly service in a cozy atmosphere,"Tabliyit Massaad is a popular Lebanese restaurant known for its delicious and simple food, particularly praised for their tawook sandwiches. Reviewers highlight the friendly service, quick delivery, cozy atmosphere, and affordable prices. The menu offers a fusion twist on traditional Lebanese cuisine with options like potato, hummus, cauliflower sandwiches, saje burgers, chicken wings with pomegranate sauce, and more. While some dishes like grilled potatoes received mixed reviews, the overall experience is highly recommended by visitors who appreciate the excellent service and tasty food.","Visit during off-peak hours to avoid crowds as it can get busy | Try the tawook sandwich which is highly recommended by many reviewers | Consider ordering the chicken wings with pomegranate sauce for a flavorful starter | If you're vegan, explore options like potato, hummus, or cauliflower sandwiches available on the menu",https://www.facebook.com/tabliyitmassaad/,source1,https://www.google.com/maps/search/?api=1&query=Tabliyit+Massaad%2C+Gouraud+Street%2C+Beirut%2C+Lebanon&query_place_id=ChIJcTuO4voWHxURY_geEiq83H8,2026-04-07,2026-04-07
src1_038,Osaka Sushi Lounge,Japanese,"Japanese,Seafood","Beirut, Lebanon",Beirut,Beirut,Lebanon,+9611360630,4.4,4.4,4.4,692,346,346,230,65,29,3,19,66.5,18.8,8.4,0.9,5.5,High-End,12-11:30PM,12-11:30PM,12-11:30PM,12-11:30PM,12-11:30PM,12-11:30PM,12-11:30PM,Unknown,Unknown,Unknown,"About Osaka Sushi Lounge in Beirut offers a top-notch Japanese dining experience with a focus on carefully crafted dishes made from freshly imported ingredients. The restaurant provides a fine dining atmosphere, professional service, and spacious tables for an enjoyable meal. Guests can expect high-quality seafood and innovative cuisine, such as crispy salmon salad and fresh sashimi pieces. The menu features unique twists on traditional sushi, making it one of the best spots to enjoy exceptional flavors in Beirut.","Tempura,Sushi,Sashimi",http://google.com/,Why you should go 1 Experience delicious high-quality sushi made with fresh ingredients 2 Enjoy an elegant ambiance and top-tier service 3 Try a diverse menu including unique dishes like tom yum soup and flavorful sushi rolls,"Osaka Sushi Lounge in Beirut is highly praised for its delicious high-quality sushi, attentive service, and elegant ambiance. Reviewers highlight the harmonious blend of flavors in dishes like soft shell crab, squid tempura, spicy salmon, and beef teriyaki. The restaurant offers a diverse menu with options like tom yum soup, salmon salad, and flavorful sushi rolls. Guests appreciate the top-tier service and premium dining experience at Osaka Sushi Lounge.","Consider visiting during lunch to enjoy the generous business menu with various tasty options at a reasonable price | If you're a fan of tom yum soup or salmon salad, Osaka Sushi Lounge offers rich and delicious versions worth trying | While slightly expensive, the quality of ingredients justifies the price ensuring food safety and satisfaction | For those not craving sushi specifically, explore other options such as poke bowls or chicken teriyaki for a satisfying meal",http://www.osakasushilounge.com/,source1,https://www.google.com/maps/search/?api=1&query=Osaka+Sushi+Lounge%2C+Beirut%2C+Lebanon&query_place_id=ChIJ3wDD6t4WHxURX8akwaJ9o8Q,2026-04-07,2026-04-07
src1_039,Salon Beyrouth,Fusion,Fusion,"Mohammad Abdul Baki, Beirut, Lebanon",Mohammad Abdul Baki,Beirut,Lebanon,+9613133317,4.5,4.5,4.5,1194,597,597,381,161,32,9,14,63.8,27.0,5.4,1.5,2.3,Mid-Range,"12-1AM, 9:30-1AM","12-1AM, 9:30-1AM","12-1AM, 9:30-1AM","12-1AM, 9:30-1AM","12-1AM, 9:30-1AM","12-1AM, 9:30-1AM","9:30-1AM, 12-1AM",Unknown,Unknown,Unknown,"About Salon Beyrouth, located in the heart of Hamra, is a stylish retro-bar that has been serving as a hub for Beirut's thriving jazz community for almost a decade. The venue offers an extensive selection of over 120 whiskies from around the world and craft classic cocktails with homemade bitters and infusions. Its elegant art-deco-inspired interior and covered alfresco garden area provide the perfect setting for intimate gatherings or lively evenings of live music.",,https://salonbeyrouth.com/wp-content/uploads/Salon-Menu.pdf,"Why you should go 1 Experience flawless execution of food with standout dishes like fish and chips, mushroom risotto, prawn risotto, burger, Japanese cheesecake, and pain perdu 2 Enjoy a gorgeously designed ambiance with friendly staff creating a cozy atmosphere perfect for friends or romantic dates 3 Transport yourself to a chill vibe during jazz nights at this chic retro-bar dedicated to whisky and jazz","Salon Beyrouth is a beloved spot in Lebanon, known for its flawless execution of food with standout dishes like fish and chips, mushroom risotto, prawn risotto, burger, Japanese cheesecake, and pain perdu. The ambiance is described as gorgeously designed with friendly staff creating a cozy atmosphere perfect for friends or romantic dates. Visitors enjoy the adult-oriented setting starting in the afternoon and jazz nights that transport them to a chill vibe. Despite some pricey items on the menu, patrons appreciate the top-notch quality of food and drinks at this peaceful haven in busy Hamra.","Visit Salon Beyrouth during their jazz nights for an unforgettable experience | Try unique cocktails crafted with homemade bitters and infusions that pack an extra punch of flavor | For beer enthusiasts looking for imported options from Germany, England, Lebanon, Belgium among others; Salon Beyrouth offers over 14 types to choose from",http://www.salonbeyrouth.com/,source1,https://www.google.com/maps/search/?api=1&query=Salon+Beyrouth%2C+Mohammad+Abdul+Baki%2C+Beirut%2C+Lebanon&query_place_id=ChIJi4OK0dcWHxURpL1m2vKU2s8,2026-04-07,2026-04-07
src1_040,Albergo,Lebanese,"Lebanese,French","VGQ6+53W, Beirut, Lebanon",VGQ6+53W,Beirut,Lebanon,+9611339797,4.5,4.5,4.5,730,365,365,260,65,20,7,12,71.4,17.9,5.5,1.9,3.3,High-End,Unknown,Unknown,Unknown,Unknown,Unknown,Unknown,Unknown,TRUE,Unknown,TRUE,"About Albergo is a grand all-suite hotel located in the Achrafieh neighborhood of Beirut. Housed in a 1930s mansion, this luxurious hotel is part of the prestigious Relais and Chateaux series. The ochre-colored ancient villa with a large gilded cast iron gate draped in greenery sets the scene for an elegant stay. The hotel's interior combines French glamour with unique Lebanese touches, creating a characterful and romantic ambiance.",,,Why you should go 1 Experience exceptional service from attentive staff members like Mr. Elie Jabbour who elevate your stay 2 Enjoy comfortable beds and delicious food at the rooftop restaurant with stunning city views 3 Indulge in high-quality dishes at Albergo Restaurant amidst warm decor,"Albergo in Beirut is a renowned and elegant hotel known for its beautifully curated spaces, impeccable service, and exceptional staff members like Mr. Elie Jabbour who go above and beyond to ensure guests have a magical experience. Guests praise the comfortable beds, outstanding service, delicious food at the rooftop restaurant, warm ambiance of Albergo Restaurant, and the blend of classic and oriental styles in the beautifully designed rooms. Despite some mixed experiences with room amenities for families with babies, overall, Albergo is described as luxurious, charming, and a must-visit spot for a refined stay in the heart of the city.","Make reservations before dining at either breakfast or dinner restaurants to secure your spot | If traveling with accessibility needs or young children requiring specific amenities like cribs or high chairs, communicate these requirements clearly prior to arrival | Consider visiting during off-peak seasons to avoid crowds while still enjoying top-notch service | For families with infants or toddlers needing specific equipment such as clean high chairs or baby cribs, double-check their cleanliness upon delivery",http://www.albergobeirut.com/,source1,https://www.google.com/maps/search/?api=1&query=Albergo%2C+VGQ6%2B53W%2C+Beirut%2C+Lebanon&query_place_id=ChIJ935TowIXHxUREYZ2o_VyKec,2026-04-07,2026-04-07
src1_041,Seray,Lebanese,Lebanese,"Palladium Building, Beirut, Lebanon",Palladium Building,Beirut,Lebanon,+9611995511,4.4,4.4,4.4,1084,542,542,349,118,40,16,19,64.4,21.8,7.4,3.0,3.5,Mid-Range,12PM-12AM,12PM-12AM,12PM-12AM,12PM-12AM,12PM-12AM,12PM-12AM,12PM-12AM,Unknown,Unknown,Unknown,"About Nestled in the vibrant heart of Beirut, Seray offers a contemporary twist on traditional Lebanese cuisine that is sure to delight your senses. Each dish is a visual feast, making it hard to decide whether to admire or indulge! The restaurant boasts an inviting atmosphere filled with families who frequent this gem, highlighting its popularity among locals. During my visit for a company Iftar, I was impressed by the high hygiene standards and remarkable service.",Hummus,,"Why you should go 1 Enjoy authentic Lebanese cuisine with delicious mezza, BBQ, and fish dishes 2 Luxurious dining experience with indoor and outdoor seatings 3 Impeccable service from welcoming staff","Seray is a Lebanese restaurant known for its authentic dishes, friendly staff, and good service. Reviewers praise the delicious food, especially mezza, BBQ, and fish dishes. The indoor and outdoor seating areas provide a luxurious dining experience with fast service. However, some negative reviews mention inconsistencies in quality and poor experiences like uncooked food or food poisoning incidents.",Visit during less busy times to ensure better consistency in food quality | Consider trying popular menu items like kibbeh Naye and Habra for tasty options | Be cautious about ordering certain dishes based on mixed reviews to avoid disappointment,,source1,https://www.google.com/maps/search/?api=1&query=Seray%2C+Palladium+Building%2C+Beirut%2C+Lebanon&query_place_id=ChIJidO1eecWHxURfEEy5pFsusE,2026-04-07,2026-04-07
src1_042,Amelia,Lebanese,Lebanese,"Beirut, Lebanon",Beirut,Beirut,Lebanon,+96170666426,4.4,4.4,4.4,846,423,423,279,86,23,9,26,66.0,20.3,5.4,2.1,6.1,Mid-Range,Closed,Closed,Closed,7PM-2AM,"12-2AM, 7PM-2AM","12-2AM, 7PM-2AM",Closed,Unknown,Unknown,TRUE,"About Amelia Beirut is a high-end and selective restaurant located in Mar Mikhael, offering a delightful cuisine and a unique ambiance. The interior design combines Lebanese traditions with modern style, creating an exquisite atmosphere for gathering with friends. Reservation is highly recommended due to its popularity. The menu features must-try items such as shrimp halloumi rolls, truffle pizza, and shrimp barrel. The staff are known for their professionalism and friendliness, providing 5-star service to the guests.",,,Why you should go 1 Experience authentic Peruvian cuisine in Lebanon 2 Enjoy a warm and inviting ambiance with unique architecture 3 Delight in a menu crafted with fresh ingredients and bold flavors,"Amelia, located in Mar Mikhael, Lebanon, offers an authentic Peruvian dining experience with a warm and inviting ambiance. Guests praise the delightful menu crafted with fresh ingredients and bold flavors, impeccable service from knowledgeable staff, impressive cocktail selection, and unique architecture that fits the street's authenticity. While some reviewers highlight the delicious food like shrimp halloumi rolls and truffle pizza along with friendly staff and amazing music, others criticize it for low quality in various aspects such as food, drinks, music quality, and service. Despite mixed reviews on pricing and music quality needing improvement at times, most visitors find Amelia to be a charming place boasting amazing decor with soaring high ceilings creating a captivating atmosphere where guests can relax and savor both visual delights and mouthwatering cuisine.",Make reservations in advance as the place is popular; reservation is a must! | Try recommended dishes like shrimp halloumi rolls or truffle pizza | Be prepared for potentially higher prices compared to other places | Check if there are any minimum charges or rules before visiting to avoid surprises,https://www.instagram.com/ameliabeirut/,source1,https://www.google.com/maps/search/?api=1&query=Amelia%2C+Beirut%2C+Lebanon&query_place_id=ChIJb7fI4KAXHxUR0Hdrw3rD5nQ,2026-04-07,2026-04-07
src1_043,Ritage Garden,Lebanese,Lebanese,"Lebanon, Street 61, Beirut, Lebanon",Street 61,Beirut,Lebanon,+96171030100,4.5,4.5,4.5,868,434,434,281,108,26,9,10,64.7,24.9,6.0,2.1,2.3,Mid-Range,12:30PM-12AM,12:30PM-12AM,12:30PM-12AM,12:30PM-12AM,12:30PM-12AM,12:30PM-12AM,Closed,Unknown,Unknown,TRUE,"About Nestled in the heart of Beirut on Lebanon Street, Ritage Garden is a culinary gem that has been delighting diners with authentic Lebanese cuisine since 2015. This charming restaurant offers an extensive menu filled with starters, mezze, main courses, and desserts crafted from fresh, locally-sourced ingredients. The inviting ambiance makes it an ideal setting for special occasions like proposals or leisurely afternoons spent with loved ones.","Steak,Pizza,Spaghetti,Sirloin steak",https://www.ritagegarden.com/Library/Assets/Ritage%20Menu%20-%20updated%20v3.2%20-%20Aug%202025-124828.pdf,"Why you should go 1 Experience impeccable service and knowledgeable staff in a sophisticated ambiance 2 Enjoy fresh, well-prepared dishes bursting with exquisite flavors 3 Savor culinary masterpieces with balanced textures and refined tastes","Ritage Garden offers a sophisticated ambiance with impeccable service and knowledgeable staff. The food is described as fresh, well-prepared, and bursting with exquisite flavors. Dishes are culinary masterpieces with a nice balance of textures and refined flavors. The outdoor space is praised for its great atmosphere, while the desserts like chocolate fondant are highlighted for being delicious. Ritage by Maroun Chedid stands out as one of Lebanon's most refined dining experiences, combining world-class international cuisine with unmatched elegance in an iconic setting at Tabet Palace.","Visit during off-peak hours to avoid crowds and enjoy a more intimate dining experience | Try unique dishes that span Italian, Japanese, Lebanese, Armenian cuisines for a diverse culinary experience | Make reservations in advance to secure a table at this popular spot | Explore the cocktail list for perfectly complementing drinks like the bell pepper smash or Moscow mule",http://www.ritagegarden.com/,source1,https://www.google.com/maps/search/?api=1&query=Ritage+Garden%2C+Lebanon%2C+Street+61%2C+Beirut%2C+Lebanon&query_place_id=ChIJV01GJOMWHxURjCYMsO5a11M,2026-04-07,2026-04-07
src1_044,The Barn,Unknown,Unknown,"the alleyway, Gouraud, Beirut, Lebanon",Gouraud,Beirut,Lebanon,+9611449902,4.5,4.5,4.5,860,430,430,298,88,23,10,9,69.6,20.6,5.4,2.3,2.1,Mid-Range,8AM-10:30PM,8AM-10:30PM,8AM-10:30PM,8AM-10:30PM,8AM-10:30PM,8AM-10:30PM,8AM-10:30PM,Unknown,TRUE,Unknown,"About The Barn in Gemmayze is a cozy spot known for its bold and smooth espresso and artisanal open-face toasts featuring a variety of unique toppings like almond zaatar cheese, farmhouse feta with rose petals, and stone-ground almond butter with sun-dried figs. This organic food restaurant offers a menu that includes both vegan and non-vegan options, making it a great choice for those seeking delicious and fresh meals.","Oatmeal,Chicken sandwich,Sandwich,Juice,Parfait,Avocado toast,Bruschetta,Espresso,Salad,Granola",https://cdn.qr-code-generator.com/account15102067/53141416_1.pdf?Expires=1750929352&Signature=Xpf1lEhaHdfet2tpZXaGY5fz7lLdQTLQbEs4GK-7P98uLlY6jVfjCUpEr-QSH616DuIcuyddyyY7uh5LL0q0-DlYq1FVfyhfaZwc6gjnlzg~rppNwQnDCnG24MYo7~j~3VFYR0qtXrdCzxl-upi4lA82VM81r5sWIvsIsOtnC~ZWdWb0vviosMbuMVIHf-XoWtJKc0THlPB5fxGoOAYhVtRAXhapPkw2PiW-uQ02hbLZ7dLV2OlFDtmLvW5VQUVPlET4WFauk-q7cvtsZxj0CZ2TrXD2CJMRWW9sUAC5pp3kxCXz6en3~hZECZ4WCLLEtALiL1QEtsMlHwaJX5ooug__&Key-Pair-Id=KKMPOJU8AYATR,Why you should go 1 Indulge in generous platters with tasty mixes 2 Enjoy healthy breakfast options like chocolate-mango oatmeal and tomato feta bread 3 Experience a cozy atmosphere with abundant greenery,"The Barn in Gemayzeh is a charming and welcoming restaurant known for its generous platters, tasty mixes, and fresh ingredients. Reviewers praise the healthy food options like chocolate-mango oatmeal and tomato feta bread, as well as the cozy atmosphere with abundant greenery. However, there were some concerns raised about cleanliness issues and food quality inconsistency.",Try to avoid ordering steak due to reported food poisoning incidents | Visit during breakfast or brunch hours for the best experience | Consider sitting indoors for a more enjoyable dining experience compared to outdoor seating on the road,http://www.thebarnbeirut.com/,source1,https://www.google.com/maps/search/?api=1&query=The+Barn%2C+the+alleyway%2C+Gouraud%2C+Beirut%2C+Lebanon&query_place_id=ChIJsY4B4_gWHxURXIy_qlHQ3Eo,2026-04-07,2026-04-07
src1_045,Internazionale,American,American,"VGWG+Q4F, Alexander Fleming, Beirut, Lebanon",Alexander Fleming,Beirut,Lebanon,+96170060861,4.3,4.3,4.3,516,258,258,139,75,25,13,5,54.1,29.2,9.7,5.1,1.9,Mid-Range,9-12AM,9-12AM,9-12AM,9-12AM,9-12AM,9-12AM,9-12AM,Unknown,Unknown,Unknown,"About Internazionale is a stylish gem nestled in the vibrant Mar Mikhael neighborhood, effortlessly blending a chic 1950s American aesthetic with a modern twist. With its dark wood decor and striking photographs of fashion-forward individuals adorning the walls, this bar offers an inviting atmosphere that attracts the trendiest crowd. As you stroll along Alexander Fleming Street, you'll find Internazionale buzzing with well-dressed thirtysomethings enjoying cocktails and conversation outside.",,"https://www.google.com/maps/place/@33.896943,35.525205,3a,86.4y,90t/data=!3m8!1e2!3m6!1sAF1QipOWh115wgaJpzIv13x5mmak9Q0C5wk1ZUlfBkvE!2e10!3e12!6s!7i3024!8i4032!4m9!3m8!1s0x151f165918e34357:0x831d9bf3cbc42e33!8m2!3d33.896943!4d35.525205!10e5!14m1!1BCgIYIQ!16s%2Fg%2F1q69q851x?entry=ttu",Why you should go 1 Experience the vintage vibe and international clientele 2 Enjoy reasonably priced drinks like Aperol spritz and flat whites 3 Interact with friendly staff creating unique and fun experiences,"Internazionale is a charming and vibrant spot in Mar Mikhael, Lebanon, known for its international clientele, vintage vibe, unpretentious atmosphere, great drinks like Aperol spritz and flat whites at reasonable prices. Visitors praise the friendly staff creating unique and enjoyable experiences with over-the-top drinks. The bar offers a suave 1950s American chic ambiance attracting cool crowds of thirtysomethings. It's described as a hidden gem with lovely welcoming staff that takes you to the roots of Lebanese life.","Visit during brunchtime for a relaxed coffee experience or in the evening for vibrant beer vibes | Try asking the barmen for their best shot to enjoy special drink recommendations | Take time to unwind and pause in this cozy spot amidst Mar Mikhael's bustling nightlife scene | Meet Mark, one of the amazing staff members who adds an energetic touch to your visit",https://www.instagram.com/internazionale_beirut/?hl=en,source1,https://www.google.com/maps/search/?api=1&query=Internazionale%2C+VGWG%2BQ4F%2C+Alexander+Fleming%2C+Beirut%2C+Lebanon&query_place_id=ChIJV0PjGFkWHxURMy7Ey_ObHYM,2026-04-07,2026-04-07
