name,rating,cuisines,price_range,location,features,contact_info,all_reviews,url
HALLAB 1881 قصر الحلو - Karout,1.8,Lebanese,2,"Camil Chamoun Road, New Karout Mall, Gallery semaan, Hazmiyeh, Mount Lebanon Governorate, Lebanon","Features, Сredit cards accepted, Delivery, Takeaway, Wheelchair accessible",+9616444445,"[1.0] [2 months ago on Google]: I visited Hallab today to purchase knefe. First, there was no kaak available, so I politely asked whether the price would be adjusted or if an alternative would be offered. Instead of a professional response, the staff member replied in Arabic in a rude and dismissive way: “Shou ba3melak?” On top of that, while I was waiting to order my knefe, several other customers were allowed to go ahead of me, despite the fact that I was clearly there first. This is completely unprofessional and shows a total lack of respect for customers. The tone, attitude, and behavior were humiliating. I genuinely felt like I was being treated as if I were asking for charity rather than paying for a product. Being busy or having a lot of customers — even during New Year’s — is not an excuse for disrespect or poor organization. I later raised this issue with the person at the cashier, and all I received was a simple “sorry,” with no real concern or effort to address what happened. This experience ruined my evening and left me extremely upset. An establishment with Hallab’s reputation should be ashamed of this level of service. Management seriously needs to review staff behavior, customer handling, and basic etiquette. I will never return, and I do not recommend this place to anyone who expects respect and professionalism. || [1.0] [4 months ago on Google]: The kunafah was awful.. not tasty at all and the bread wasn’t fresh. || [5.0] [7 months ago on Google]: Top! Thank you Laya for your perfect and professional service! Your smile is the cherry on the top of knefé. I advice everyone to go to Hallabقصر الحلو Batroun || [4.0] [10 months ago on Google]: Al hallab, is the most famous Sweets and Pastries shop in Libanon. Many parkings available in street sides The sweets are very delicious. They offer some options for travellers like Maamoul Mad with Ashta, sfeeha Meat and Knafieh. They also offer dine in options to have sweets and coffee. The prices are very high || [2.0] [10 months ago on Google]: No cuttleries Very late order No trust with call centre Not enough debes || [5.0] [11 months ago on Google]: Halewet al jeben is a must-have dessert in Lebanon. This store is highly recommended to taste this delicious dessert. || [1.0] [a year ago on Google]: Visited al hallab karout mall a week after eating tripoli branch. The taste the cleanless and the service is totally different. In karout mall branch its a very low level Food: 1 Service: 1 Atmosphere: 1 || [1.0] [a year ago on Google]: Visited Hallab 09/15/2024 (Karout Mall). Ordered lahm b aajin. Since I know the taste, I can say that it was not lahm b ajin from Hallab. It's just a caricature. The dough is not filo, thick, raw, not crispy. It's a pity, but we will not visit this place again. Disappointment. Service: Dine in || [1.0] [a year ago on Google]: Employees are really aggressive and not nice... Although they are really expensive... You get bad food!! The sweets are burned out! Really unprofessional!! Every visit they ran out of goods with the argument that they can't keep it from day to day. Food: 1 Service: 1 Atmosphere: 1 || [5.0] [2 years ago on Google]: Great products and service. Food: 5 Service: 5 Service: Delivery || [1.0] [2 years ago on Google]: Good food bad work atmosphere. Food: 5 Service: 1 Atmosphere: 1 || [3.0] [2 years ago on Google]: As a resident of Tripoli, Hallab(قصر الحلو) holds a special place in my heart, but I was disappointed by the service at this particular branch. It's crucial for the shop to maintain the same level of excellence as its original branch, and I hope to see improvements in the future.. || [4.0] [3 years ago on Google]: One of the best places I go to for Lebanese sweets. Baklava, maamoul, halawet el jibn, kashta and knafeh are few of what I like there. Added to my favourites list. || [1.0] [3 years ago on Google]: The worst place to order from Service 0 Food 0 Delivery after 2 hours Nothing as u ordered || [5.0] [3 years ago on Google]: Amazing highly recommend trying it out || [4.0] [3 years ago on Google]: Tasty and helpful team || [4.0] [4 years ago on Google]: Great Halwa Jobn delicious ice cream and very neat packaging with good prices. || [4.0] [4 years ago on Google]: My moms friend got us from Lebanon a small box of mamoul covered with chocolate, it was heavenly definitely recommended! || [1.0] [4 years ago on Google]: A very serious incident took place on 2 March 2022. My fiancé and I had a Knefe bjeben, from this Branch, and we both got food poisoning! We are sure it is from the knefe, as first the knefe was not fresh, the employee used a microwave to reheat it !! and second, we didn’t have anything else that day. We both got all the symptoms of food poisoning and almost had to be hospitalized. I have always eaten at various branches, but this is the worst experience I had, in addition to the food incident, the staff was very slow, took them like 10 minutes to make our 2 kaakes, even though the shop was empty. Not trying to get any compensation or apology in return, i just want this to be fixed, as Hallab is part of our culture, and no one should experience what we did. || [2.0] [4 years ago on Google]: Scoring an epic selfie on the edge of a cliff overlooking a marvelous seaview is one of the common top 10 things on any tourist's bucket list. High on that list for me, however, sits a Kaaket Knéféh Chmeliyyé with extra syrup: my most spiritually rewarding, overly delicious, 700-calorie temporary mistress my hands get to hold on a cold, rainy day at 8:00am in downtown Beirut. Chmeliyyé means northern, meaning the version done with ashta (clotted cream), as opposed to the Beirut-style, gooey cheese version. Enter Hallab in Hadat: think gloomy & sad without saying gloomy & sad. The last time I stepped into one, Fairuz was happy. A melange of fragrances, rose water, fresh coffee, pistachio paste and orange blossom once greeted your senses before the humans uttered anything. But today, the shrunken Borma portions and the absent Maamoul Madd trays spelled this branch's condolences to bucket lists like mine. No fault of the masters, folks. The country is in turmoil- and it is no time for bashing. But the utter, inexcusable, horrific injury to the once-upon-a-time soft, chewable semolina heritage: Microwaved Knefeh !! What ?! Foreign tourists: On behalf of the orthodox creameries and margarine-producing ancestors of this nation who are spinning in their graves, please accept our sincere condolences for a hallmark brand that just spelled its own demise. Please do not tell Rifaat. He competes, but he won't take this lightly, nor will Fouad El Jerr. Enough madness ! 1881 should be a UN resolution to rescind this branch's access to any form of sugar syrup. But wait, the kaaké survives. It's soft, the best at what it does yet lonely. Get your act together guys: don't mess with the knéféh. The microwave does not belong in shops like yours. || [4.0] [4 years ago on Google]: Very Tasty Sweets! And professional staff. Highly recommended Halawat El Jebn is very delicious! || [4.0] [4 years ago on Google]: Nice levanese sweets. Recommend kinase and halawet aljibin || [4.0] [4 years ago on Zomato]: Loved the Lahm Bil Ajeen! My only comment would be is that I wish they were a little more crispy and a little less soggy - which I think is due to packaging/delivery. I also wish there were more nuts on top. Still good nonetheless. I heated the second one in a pan the next day and it became super crunchy and delicious! || [1.0] [4 years ago on Zomato]: No syrup? Really how do you eat mafrouke without syrup wow || [2.0] [4 years ago on Zomato]: Their Ashta knefe is not one of the best. The bread is very thin and the cheese is not that tasty || [1.0] [4 years ago on Zomato]: No one answers the phone! We tried calling for several hours on all the branches numbers but no one answered so we went to the store to place an order and they told us we need to call beforehand for them to prepare them and now we're trying to call to place an order yet no one is answering! Very bad service! || [1.0] [4 years ago on Zomato]: I received my order after two hours and 15 mins! Delay to accept the order. Delay in delivering the order. (But the problem is not from the driver) || [3.0] [4 years ago on Zomato]: it took 2 hours to arrive to my place... but thank God it tasted good or i would have put 1 star horrible... || [5.0] [4 years ago on Zomato]: Amazingggggg lahm b ajine yum yum yum !! I am addicted to ittt with reb remen yum yum?? || [4.0] [4 years ago on Zomato]: I asked for extra قطر i did not get the extra taste of it but other than that cheese was divine.",https://t.restaurantguru.com/Abdul-Rahman-Hallab-and-Sons-Beirut
Abdul Rahman Hallab & Sons,N/A,N/A,1,"Riad El Soleh St, Bourj Hammoud, Mount Lebanon Governorate, Lebanon",N/A,+9616444445,N/A,https://t.restaurantguru.com/Abdul-Rahman-Hallab-and-Sons-Beirut-2
Abdul Rahman Hallab & Sons,N/A,N/A,1,"Karout Mall, Hazmiyeh, Mount Lebanon Governorate, Lebanon","Features, Сredit cards accepted, No outdoor seating",N/A,N/A,https://t.restaurantguru.com/Abdul-Rahman-Hallab-and-Sons-Hazmiyeh
Abdul Rahman Hallab & Sons,N/A,N/A,1,"Duty Free Area, Khalde, Mount Lebanon Governorate, Lebanon","Features, Сredit cards accepted, No outdoor seating",N/A,N/A,https://t.restaurantguru.com/Abdul-Rahman-Hallab-and-Sons-Khalde
N/A,N/A,N/A,N/A,N/A,N/A,N/A,N/A,https://t.restaurantguru.com/Abdulwahab-Beirut-4
Abed El Settar Al Tom & Sons Sweets,N/A,Dessert,1,"Istiklal Street, Zahriye, Tripoli, North Governorate, Lebanon","Features, Cash only, Delivery, Takeaway",+9616625935,"[4.0] [6 years ago on Zomato]: I absolutely love Al Tom sweets! Theyre not overly sweet like most lebanese sweets places are, and not to mention the delicioust, traditional and affordable prices! Their mafroukeh is a MUST TRY! Out of this world!!! Im obsessed! Al Tom Sweets should always be a stop on the way when in Tripoli. || [4.0] [6 years ago on Zomato]: You can not leave tripoli without getting some dessert from Altom Located in OLD market , weverything is tasty from knefh to 7alewt jebn and many other options Price are fair and taste is good || [4.0] [6 years ago on Zomato]: The place is packed on a Sunday, the staff are friendly and the products are definitely fresh: - The halawet el riz was amazing, light, perfect amount of sugar, melts in the mouth, left me SPEECHLESS. Recommended ???????? || [4.0] [6 years ago on Zomato]: Very traditional and very well known in Tripoli. People come all over lebanon to taste the sweets of TOM. ✅ The place is very small and always very crowded. You can enjoy your plate dine in or take away. ✅ The staff are always smiling. ✅ Very affordable prices ???????? No parking available || [2.0] [7 years ago on Zomato]: We were spending the day at Tripoli and we asked where can we find the best halawet el je en in town so many people guided us to Tom. The staff is very friendly and welcoming but unfortunately the place didn't look very fresh and clean. We had a variety of many Lebanese sweets and we were kind of disappointed. It wasn't that bad but certainly not the best. Just average or a bit below that to be honest. We preferred halawit el riz, halawit el jeben which is their specialty wasn't that rich in taste. || [4.0] [7 years ago on Zomato]: One of the oldest sweet shop in Tripoli. The sweets are delicious and at good prices. The service is good and fast. It's good for take away. It's recommended. || [4.0] [8 years ago on Zomato]: halawet el jeben and knefeh b ashta w pistachio are the best to try! a plate of Mafroukeh ""Have there"" in place is yummy as well... in the heart of tripoli,,, zahriyeh! its so clean and the prices are very good! || [4.0] [8 years ago on Zomato]: Their halewet el jeben is one of the best in tripoli!!! Id suggest you guys to try it when u go to tripoli. It was recommended by the citizen of tripoli to us when we first visited this amazing city",https://t.restaurantguru.com/Abed-El-Settar-Al-Tom-and-Sons-Sweets-Tripoli-North
Abla,N/A,N/A,N/A,"Amchit, Byblos, Mount Lebanon Governorate, Lebanon",N/A,+96176577170,"[5.0] [7 years ago on Facebook]: delicious meals, perfect cuisine, tasty dishes ,",https://t.restaurantguru.com/Abla-Lebanon
N/A,N/A,N/A,N/A,N/A,N/A,+9613755793,"[4.0] [6 months ago on Google]: I took my parents and friends to this restaurant for seafood, and overall it was a very good experience. The building itself is impressive, and the concept is great—you select your fish and choose how you’d like it cooked, and the staff prepare and serve it accordingly. The food was very good , and the staff were friendly and attentive. However, one major drawback was the indoor smoking (both cigarettes and narghile), which significantly impacted the dining experience. This is an issue across Lebanon, but it was especially noticeable here. Despite that, I would still recommend this restaurant for its quality food and service. Service: Dine in Meal type: Lunch Food: 4 Service: 5 Atmosphere: 3 || [1.0] [a year ago on Google]: To expensive Food: 1 Service: 1 Atmosphere: 1 || [5.0] [a year ago on Google]: amazing experiance, plenty of delicious food for reasonable price Food: 5 Service: 5 Atmosphere: 4 || [5.0] [a year ago on Google]: The restaurant is very nice with A/C and comfortable seating. We had the oven fish with fatoush, batata hara, hummus and tajine. All was very good. Batata hara was super fresh and fatoush was well seasoned. The fish was also very good and tasty. While prices are fine, there is no set menu so make sure you know the price of what you are ordering before you do. Service: Dine in Meal type: Dinner Food: 5 Service: 5 Atmosphere: 5 Recommended dishes: Mixed Grilled Fish Platter, Fresh Fish to Choose, Fattoush Salad, Grilling Fish, Fried Fish Platter || [5.0] [a year ago on Google]: Food: 5 Service: 5 Atmosphere: 4 || [5.0] [2 years ago on Google]: The food and atmosphere were amazing, the price cheap also as well, just the stuff service was very slow, they need just to improve welcoming habits of their stuff. I highly recommend this restaurant Food: 5 Service: 1 Atmosphere: 4 || [4.0] [2 years ago on Google]: The atmosphere was very good, food also very good quality, also cheap as well compared with Beirut restaurants.. The only issue was the service, the stuff delay and looks like doesn’t care. I recommend this restaurant, may they improve their stuff skills. Food: 4 Service: 2 Atmosphere: 3 || [5.0] [2 years ago on Google]: Great food and good service Grilled fish are amayzing same as the fatoush Service: Dine in Meal type: Lunch Food: 5 Service: 4 Atmosphere: 4 || [1.0] [2 years ago on Google]: Fried sardines were overdone. Disappointing cooking quality. Service: Take out Meal type: Lunch || [5.0] [2 years ago on Google]: Great restaurant, very affordable price and exceptional food....thanks for the welcome Food: 5 Service: 5 Atmosphere: 5 || [5.0] [2 years ago on Google]: Cheap and delicious Service: Dine in Meal type: Lunch Food: 5 Service: 5 Atmosphere: 4 Recommended dishes: Mixed Grilled Fish Platter || [1.0] [2 years ago on Google]: Food: 1 Service: 1 Atmosphere: 1 || [4.0] [2 years ago on Google]: Food: 5 Service: 4 Atmosphere: 1 || [4.0] [2 years ago on Google]: Food: 5 Service: 4 Atmosphere: 5 || [5.0] [2 years ago on Google]: Service: Dine in Meal type: Breakfast || [1.0] [2 years ago on Google]: Food: 5 Service: 1 Atmosphere: 3 || [5.0] [2 years ago on Google]: Very cheap, good food, fresh fish, nice and sweet seating, and very good service || [5.0] [2 years ago on Google]: Clean and delicious Food: 5 Service: 5 Atmosphere: 3 || [4.0] [2 years ago on Google]: A sidewalk restaurant with grilled fish according to your choice with good service Service: Dine in Meal type: Lunch Recommended dishes: Mixed Grilled Fish Platter || [5.0] [3 years ago on Google]: If you're looking for an authentic Lebanese breakfast, this is the place to come to! They serve a delicious range of hummus and foul and other Lebanese staple breakfast items. Cheap prices with a beautiful view over the sea and Saida Castle. Service: Dine in Meal type: Breakfast Food: 5 Service: 5 Atmosphere: 5 || [1.0] [3 years ago on Google]: Not advised at all. The prices are crazy expensive if they know you are not local. They get very angry when you tell them that prices are crazy. They faked the bill when I wanted a written bill as it was different to what they said at the beginning and kept debating. Go somewhere else for a better atmosphere and more relaxed people. Food: 2 Service: 1 Atmosphere: 1 || [4.0] [3 years ago on Google]: Affordable price for nice food. Service: Dine in Meal type: Dinner || [1.0] [3 years ago on Google]: Service: Dine in Meal type: Lunch || [2.0] [3 years ago on Google]: Bad service, no menu, rude staff! Food is basic! Could've been better Service: Dine in Meal type: Lunch || [4.0] [3 years ago on Google]: If you're in Saida and looking for an inexpensive outdoor popular café with the sea and Saida castle view this would be your destination. Breakfast is good, try the ""Mchawachi"" (chickpeas grains, tahina and garlic with olive oil on top, called Msabbaha in other lebanese regions). The old souk is just next to the café. The café is very popular with a high footfall so you might find the chairs a little bit dirty. Since the pandemic they serve with single-use tableware and cups. || [3.0] [3 years ago on Google]: Noisy as it is on the main street but a good place for those looking for authenticity. Service: Dine in Meal type: Lunch || [N/A] [4 years ago on Foursquare]: Very good seafood - the fried fish is the best || [3.0] [4 years ago on Google]: Good fish and good shisha, fair seating place || [1.0] [4 years ago on Google]: Very overrated low quality food || [5.0] [4 years ago on Google]: 5/5, top! Everything I‘d ask for. The place is crowded, tourists and locals alike, which is already a good sign. You go in, choose your fish/seafood and how it should be prepared: boiled, fried, grilled (my recommendation). They have a wide variety of fish, shrimp and so on. Don‘t forget to order fries, fattoush and a variety of muqabbalat (mutabbal was very good, hummus rather average). We had a feast and everyone loved it. Tasted great and very reasonable prices, including tips we payed 600.000LL for everything (October 2021). Perfect place to finish a great day in Saida.",https://t.restaurantguru.com/Abo-Abed-Sidon
Abo Adam Cafe,N/A,N/A,N/A,"VGP3+646, Beirut, Beirut Governorate, Lebanon","Features, Cash only",N/A,[5.0] [a year ago on Google]: Great place to eat with amazing prices and tastefull shisha || [1.0] [8 years ago on Google]: تم اغلاق االمقهى,https://t.restaurantguru.com/Abo-Adam-Cafe-Beirut
Abo Al Kher Fresh Chicken,N/A,N/A,N/A,"QFQH+PJ9, Khalde, Mount Lebanon Governorate, Lebanon","Features, Cash only, Takeaway",+96170197788,[5.0] [7 years ago on Google]: Tasty lovely and clean || [5.0] [9 years ago on Google]: All food is fresh with excellent test || [5.0] [7 years ago on Google]: ممتاز || [5.0] [8 years ago on Google]: طعام طازج ونظافه المكان جيدة جدا,https://t.restaurantguru.com/Abo-Al-Kher-Fresh-Chicken-Khalde
N/A,N/A,N/A,N/A,N/A,N/A,+96171230733,"[5.0] [10 months ago on Google]: The best kaak in lebanon, the price is good and the taste is perfect! Highly recommended Service: Dine in Meal type: Breakfast Food: 5 Service: 4 Atmosphere: 3 || [5.0] [11 months ago on Google]: The texture of the bread is amazing. It is prepared fresh in front of us with the filling we asked for. Delicious. Service: Dine in Meal type: Breakfast Food: 5 Service: 5 Atmosphere: 3 || [5.0] [2 years ago on Google]: Service: Take out Meal type: Breakfast Food: 5 Service: 5 || [5.0] [2 years ago on Google]: Something more luxurious than anything else || [5.0] [3 years ago on Google]: Your cakes are good and delicious, but they are a little expensive || [5.0] [3 years ago on Google]: As usual, the best of the best bread , tasty fillings || [5.0] [3 years ago on Google]: The sweetest and most delicious cake || [4.0] [3 years ago on Google]: Very Good quality and taste, variety of choices, acceptable prices, very good and fast service. || [5.0] [4 years ago on Google]: Beautiful place where you can eat breakfast and be satisfied with it's fast service || [5.0] [4 years ago on Google]: I swear Abu Arab shop is one of the best elite in Sidon || [5.0] [4 years ago on Google]: The freshest, most delicious Kaiek in the whole world! || [5.0] [4 years ago on Google]: Good service, good food, good prices, way to go || [3.0] [4 years ago on Google]: Good breakfast restaurant and good price || [5.0] [4 years ago on Google]: Delicious and delicious cheesecakes and good service || [5.0] [4 years ago on Google]: Same same be janen || [5.0] [4 years ago on Google]: Delicious kaak very fresh and tasty || [5.0] [4 years ago on Google]: Well known series of bakery distributed around Lebanon, having the great taste of Kaeke,Some of the ingredients won't be found during this economic crisis but they said will be included during the summer.The location of this place is strategic .Highly recommended || [3.0] [2 years ago on Google]: Food: 3 Service: 2 || [5.0] [3 years ago on Google]: Very well || [5.0] [3 years ago on Google]: Cakes Cakes Fresh Cakes || [3.0] [3 years ago on Google]: Simple place || [5.0] [4 years ago on Google]: Very, very good || [5.0] [4 years ago on Google]: Nice place || [5.0] [4 years ago on Google]: very good || [3.0] [4 years ago on Google]: Good || [3.0] [4 years ago on Google]: Very tasty",https://t.restaurantguru.com/Abo-Arab-Sidon
Abo Bahijj,N/A,Middle Eastern,2,"Saida, Sidon, South Governorate, Lebanon",N/A,N/A,[N/A] [6 years ago on Foursquare]: Best chicken shawarma in the world || [N/A] [11 years ago on Foursquare]: Greatest Shawarma and a nice memory,https://t.restaurantguru.com/Abo-Bahijj-Sidon-2
