name,rating,cuisines,price_range,location,features,contact_info,all_reviews,url
19 Nineteen Restaurant,4.9,"American, ,, Japanese, ,, Lebanese, ,, Mediterranean, ,, Sushi",2,"Centre 19, Khalde, Mount Lebanon Governorate, Lebanon","Features, Сredit cards accepted, Delivery, Outdoor seating, Wi-Fi, Takeaway",+9615807800,"[5.0] [4 years ago on Zomato]: In the current situation in Lebanon, it has been quite challenging to find a good quality restaurant with acceptable price to quality offering. On Saturday, my kids were enjoying some time at 19 Center playing at Fiesta Forest. We decided to have some lunch at the 19 restaurant on the ground floor. We were greeted by a lady and a gentleman at the door with extremely friendly attitude. They seated us and offered us the menus. It is a very diverse one with lebanese, Japanese, international and even shisha! We chose 1. Curly fries 2. Tabooleh 3. Fried shrimp platter 4. Pasta Alfredo 5. Four portions of sushi 6. Chicken liver 7. Spring rolls (were a bit late) They offered us some lentil soup prior to the food on the house! It tasted good. Everything was very well prepared and the service was great. The food all tasted amazing and even the sushi! We enjoyed our meal and were also offered coffee on the house too. I recommend anyone who is in the area to try it. It is certainly not “cheap” but the value and the overall quality is more than acceptable. Thank you! || [5.0] [6 years ago on Zomato]: The restaurant is very well decorated, creating a fine dining atmosphere from the intrance tell the meal arrives, the pumpkin soup they offered was heavenly and everything else was equaly great.. || [5.0] [6 years ago on Zomato]: The working crew is wonderful and delightful, very nice atmosphere that made me feel very comfortable as I had my fresh juicy steakl. The young college student Mohammad that served us had a very contagious smile and it made the whole experience that much more pleasant. The only downside is that the prices are on the the high end of the spectrum so I wish they could shave off a couple of $ and everything would be perfect. || [3.0] [6 years ago on Zomato]: A nice play with a heart shape as signature (check  the bread’s pic). They served us a lentil soup at first (for free). We ordered the nachos and chicken platters. The dessert ‘fondant au chocolat’ is very delicious. Waiter was friendly and service is good. Good ambiance overall! || [1.0] [6 years ago on Facebook]: Worst service and worst management ever! They withdrew 740$ instead of 74$ from my bank card and now they can't do anything about it till next week. It is now my duty to go and sign a dispute at my bank and lose 2 hours of my time because of a mistake they did. SHAME || [1.0] [6 years ago on Zomato]: Worst service and worst management ever! They withdrew 740$ instead of 74$ from my bank card and now they can't do anything about it till next week. It is now my duty to go and sign a dispute at my bank and lose 2 hours of my time because of a mistake they did. SHAME || [5.0] [6 years ago on Facebook]: The food was good and it was enough. Good Libanees food. || [3.0] [6 years ago on Zomato]: Food is average. Friendly staff and it's a calm place usually Beautiful interior , decoration and seating A playground for kids is available || [5.0] [6 years ago on Zomato]: Clean, tasty food, great service, excellent hospitality, calm and quiet atmosphere Just perfect!! Its a place i would recommend all couples or families that are seeking for a quiet place and enjoy their food. || [4.0] [6 years ago on Zomato]: Went to a night dinner at nineteen restaurant, it was so classy & classic dining. 1) fattoush is perfect seasoned and yummy 2) 4 dishes including chicken and beef were perfectly cooked! Love it! || [5.0] [6 years ago on Zomato]: I passed by today and it was a quite good experience! Their food is awesome! Plus the service is excelent. Rabih treated us in a very good way! & manager Mohammed is so professional . Will definetely revisit soon!! || [5.0] [6 years ago on Zomato]: I love the food veeeeery delicious and the service is quick i really recommend this places for young people families friends all ages friendly staff and always smiling || [5.0] [6 years ago on Facebook]: From the first step you inter another world with the smooth rhythm of the piano to the welcoming of the waiters, food subject to high standers, salads are refreshing, soup, main course every little bite was a joy, portions are very generous, prices are reasonable, and never miss the chance to try the shisha, the absolute best! Very high recommendation for this place || [2.0] [6 years ago on Zomato]: The food is less than average. The ambience is null. I went in and the place was empty and slow service. The homos with meat was good. The nachos were average and the sage was tasteless || [5.0] [6 years ago on Facebook]: best resturant ever I love it || [5.0] [6 years ago on Zomato]: Very classy restaurant.. with wide menu variety. Been several times but i want to thank the owner for the free soup and the mediteranian dip It is a very recommended place with warm welcoming and chic decoration || [5.0] [6 years ago on Facebook]: Delicious food, excellent service, warm atmosphere || [4.5] [6 years ago on Zomato]: Lovely restaurant with nice interior design. Food is good nothing to.conplain about. Friendly and.professional staff, quick service, reasonable prices. Recommended. || [5.0] [6 years ago on Zomato]: What a classy and nice place. The food is delicious, service is very good, professional staff,waiters are always around the place. Arguileh taybe ???? || [3.0] [6 years ago on Zomato]: Based on one brekafast visit 3.5 rating Grilled halloumi in the pan perfected Foul and hummos, not bad Saj manakish so yum! Cheese salt on point Labneh zaatar good Prices are slightly above average, but portions are satisfying. Service kind of slow but staff are helpful and friendly || [5.0] [6 years ago on Zomato]: Cozy Place ,Best Staff specially Rabih and Moutaz , the food is so delicious we will come back again for sure ❤️ Service of nargilleh also is excellent???????? Best Regards, || [5.0] [6 years ago on Zomato]: What an amazing restaurant! I usually go there to spend the evening with my family, their is live piano music and the ambience is beautiful. The service is so professional and high quality. The food is also very tasty and the portions ARE BIG!!!!! for real!! I always order the 19 salad, it’s my favorite item. A mix of vegetables, cheese, nuts and fruits as mango apple orange!! Love it || [5.0] [6 years ago on Facebook]: A very wide range of items international and Lebanese cuisine. Highly recommended. || [5.0] [6 years ago on Facebook]: A very nice place good service and friendly staff. || [5.0] [6 years ago on Zomato]: Lovely restaurant with spectacular interior decor, feels like dinning in the garden , you can order your pizza heart shaped ,service is professional you are offered hot bread and soup highly recommend for a fancy date????????♥️ || [3.0] [6 years ago on Zomato]: Big variety menu the food not bad ambience good the services excellent we was there for dinner time staff so friendly and welcoming  the shisha was great || [4.0] [6 years ago on Zomato]: I visited nineteen with my friends , the welcoming was professional, i liked the variety in the menu sisha was good the place was very clean || [5.0] [6 years ago on Zomato]: 19 is a multifunctional place You can sit and have a cup of coffee, eat sushi and have seafood and Lebanese lunch/ dinner even you can celebrate some events The staff are hosting and the portions are great in relative to prices Specially the lintel soup and heart shaped breads served as a gift || [1.0] [6 years ago on Facebook]: Horrible, and embarrassing experience!, it may have been a good experience, if it wasn’t for our waitress throwing herself at me in front of my wife and trying to “discreetly” give me her number to drink afterwards looking for booze and a place to go to, as she said “party and have a good time”, as she already seemed to be inebriated already, if this girl “Sam” as she had written on the paper she gave me,,is the kind of representation your establishment chooses to represent your business, than I think it’s the wrong business to be in. || [5.0] [7 years ago on Facebook]: the place is nice but poor management",https://t.restaurantguru.com/19-Nineteen-Restaurant-Khalde
N/A,N/A,N/A,N/A,N/A,N/A,+9615807800,N/A,https://t.restaurantguru.com/19-Nineteen-Restaurant-Lebanon
2 friends snack by Shant & Armen,N/A,N/A,N/A,"Bourj hammoud, Beirut, Beirut Governorate, Lebanon, 0000",N/A,+96170955605,N/A,https://t.restaurantguru.com/2-friends-snack-by-Shant-and-Armen-Beirut-2
24 hours cafe,N/A,N/A,1,"Saida - Jezzine Rd, Sidon, South Governorate, Lebanon","Features, Outdoor seating, Cash only",+96171800824,"[5.0] [3 months ago on Google]: The coffee tastes delicious Food: 5 Service: 5 Atmosphere: 5 || [4.0] [7 years ago on Google]: Available Parking. Affordable prices. I liked the coffee (Cappuccino with Extra Shot). || [5.0] [7 years ago on Google]: Really love it has everything you need || [5.0] [8 years ago on Google]: Very nice coffee and hospitality || [3.0] [8 years ago on Google]: It is an okay cafe with a good service and good prices || [5.0] [8 years ago on Google]: Very good. || [5.0] [9 years ago on Facebook]: Good food, great customer service and best Arguileh , I totally recommend this place for arguileh and coffee lovers. || [5.0] [5 years ago on Google]: جيد || [5.0] [6 years ago on Google]: Waooooo || [4.0] [6 years ago on Google]: Nice one || [5.0] [7 years ago on Google]: ي عسى عيونكم مّ تشوف غير الفرح وعسّى الجنه داريِ وداركٌم وعسّى كُل آعوامكُم سعاده َوكُل عام وآنتم بخير || [5.0] [7 years ago on Google]: مكان جميل وهادئ || [1.0] [8 years ago on Google]: saida || [5.0] [8 years ago on Google]: اعدة حلوة وخدمة احلا || [4.0] [8 years ago on Google]: مشروبات ساخنة || [5.0] [8 years ago on Google]: مكان رائع يشعرك بالراحة || [5.0] [8 years ago on Google]: جميل",https://t.restaurantguru.com/24-Hours-Cafe-Sidon
27 Cafe Pub,1.9,Pizza,1,"Badaro, Beirut, Beirut Governorate, Lebanon, 1552","Features, Outdoor seating, Wi-Fi, Booking, Сredit cards accepted, Wheelchair accessible, Takeaway",+9611382202,"[5.0] [2 years ago on Google]: This place is very cozy and relaxing on Badaro Street. Their cocktails are great. I also like the music, especially Pink Floyd. I will probably visit again and again... This place is very cozy and comfortable on Badaro Street. Their cocktails are great. I also love music, especially Pink Floyd. I will probably visit again and again.. Food: 5 Service: 5 Atmosphere: 5 || [4.0] [3 years ago on Google]: The place is nice, they have an indoor and outdoor seating areas. The staff are friendly, however the service is a bit slow. || [5.0] [4 years ago on Facebook]: Nice place nice atmosphere but the waiter was very slow they should fix that..... might repeat.... || [3.0] [4 years ago on Google]: The ambience is nice.. the waiters need to pay attention to customers... sat 3 hours table remained as is without servicing or removing ashtrays... || [4.0] [4 years ago on Google]: Really chill place, happy hour prices are fair. Good alcohol and great ambiance. || [5.0] [6 years ago on Facebook]: Great Pub.. Friendly staff.. || [5.0] [6 years ago on Google]: a wonderful place to meet friends and coworkers || [4.0] [6 years ago on Google]: Love this place.Bit too loud, but such a fun a great ambience || [4.0] [6 years ago on Zomato]: Let me just say that this place is a gem. The amazing music makes it a unique place in Badaro. Service is quite fast comparing to other pubs. thumbs up ! || [4.0] [6 years ago on Google]: Best bar to chill out after a long day. || [5.0] [6 years ago on Google]: For me its my favorite bar in lebanon. Generous portion with a good quality alchohol. And cheap prices. Music is trendy and staff is extremely friendly and helpfull || [4.0] [6 years ago on Zomato]: Went to 27 after seeing its lovely seating in Badaro. First I absolutely loved the concept of the shop with the selection of music and decor. Had the burger, chicken taquitos, chicken quesadillas for food, the Winehouse rose and red, and Sunrise for drinks. The burger was really good, felt like I was eating my mother’s homemade burger but it can use a bit more wedges. The taquitos were also yumi but the sauce can be enhanced. Lastly the chicken quesadillas tasted like fajitas but they were really good. The drinks were delicious all of them, love the combinations of flavors you get with every glass. The service was really good our waiter, Eventhough was overwhelmed was very nice, but the as for making of our orders it was a bit slow. Nether-less it is definitely recommended would go back. || [5.0] [6 years ago on Google]: Good mood, fair prices || [5.0] [6 years ago on Google]: Excellent atmosphere ... Amazing food. I recommend it. || [4.0] [6 years ago on Google]: Lovely ambiance on badaro street. Usually not super crowded mid-week, which is great. Friendly staff and reasonable pricing. || [4.0] [6 years ago on Google]: Relaxing and tranquil || [5.0] [6 years ago on Google]: One of my favorites in Badaro! || [4.0] [6 years ago on Zomato]: 27 Cafe Pub got a strategic location in Badaro Main Street. The crowd is mainly foreigners who come to sip a glass of wine or a coffee or to drink a beer. It is a cozy simple place enjoyable after work or at happy hours. I recommend you to taste the 961 red ale lager beer. I recommend 27 cafe and bar to all those workers who would like to enjoy a drink after a long day of work. || [4.0] [6 years ago on Google]: Good everything || [1.0] [6 years ago on Google]: Theres always dogs between the tables!! Very bad!! || [4.0] [6 years ago on Google]: It was nice, cozy place in the middle of badaro street.I can say nothing about the drinks bcz I only ordered beer.But their food is really delicious, we ordered dynamite shrimps , mini burgers and salads and they were really delicious.I enjoyed it there,it's quiet and nice for a night out witj friends || [5.0] [6 years ago on Zomato]: Friendliest place in Badaro, very affordable and their 27 shrimps are to die for! Staff is amazing and you can hang out as long as you want no one will bother you and they have a fast wifi connection. || [5.0] [6 years ago on Google]: Very nice cozy place has a feeling of a cool summer afternoon especially the outside area the plants and the location are very strategically planned, the waiters are very friendly, quick on their feet and most helpful, the bartender is also very welcoming and friendly and the drinks came out fast. The drinks are really perfected and the quality and taste definitely show that; I've been there twice now and i usually visit from 5 till 7 (my free time) the place is not that crowded at that time. Im sure it would be different at night (will definitely try it someday) the nachos and the pizzas are really good and the prices are well thought of. I consider this definitely an upscale place || [5.0] [6 years ago on Google]: Great music, friendly staff, diverse good drinks. || [4.0] [6 years ago on Google]: Nice place gd atmosphere || [5.0] [6 years ago on Zomato]: Very cute/chill Café located in Badaro beirut. They make their own Tea flavors. Enjoyed my coffee before we hit the movies. Very good for meetings/ catching up with friends. Service is excellent and waiters are very attentive. || [3.0] [7 years ago on Zomato]: This pub/restau is a good one, I ordered the margherita pizza which was huge and very affordable in price. The cheese was put in a thick layer and the crust was between thin and medium. I love how big the portion was and I got it still warm, so the cheese was still a bit stringy which I like. They don’t have a big selection when it comes to desserts, so I picked the fondant au chocolat that was good as well but not very fresh, you could feel that it is assembled using ready made chocolate cake. I liked the vanilla ice-cream though, sweet and refreshing. I would recommend this bar if you want to spend a good evening and eat a tasty pizza. I will try other items on the menu if I go there again ???? || [4.0] [7 years ago on Zomato]: Good atmosphere. Crowded even on Mondays!! Fair prices during happy hour.. NB: there's a mistake in the photo of the bar menu, ""Straffe Hendrik Tripel 33CL"" is for 13000 L.L. and not 3000 L.L. || [5.0] [7 years ago on Facebook]: Great atmosphere and very welcoming staff! || [3.0] [7 years ago on Zomato]: 3.5 rating Cool place to chill at We went after work for a drink Very nice and.cozy indoor area, i dislike the outside seatings when having a drink Staff are great very fast service French fries super crunchy delicious Mini burgers love the bun so soft and a bit sweet,caramelized onions with mushroom bbq and cheese was good patty was over well done would have preferred if it was regular well done to maintain some juices Others had loaded nachos looked amazing with all that cheese but the jalapenos was not my thing due to allergies so ... hands off They got good alcohol no headache later Not a bad place for a drink and chilling out when in badaro Prices very reasonable",https://t.restaurantguru.com/27-Cafe-Pub-Beirut
N/A,N/A,N/A,N/A,N/A,N/A,+96179315183,N/A,https://t.restaurantguru.com/2a3de-Cafe-Sidon-3
Karmesh Broast,1.6,"American, ,, Fast food",1,"حي البراد, Sidon, South Governorate, Lebanon","Features, Delivery, Takeaway, Booking, Cash only, Outdoor seating",+96178891890,"[5.0] [2 months ago on Google]: Delicious chicken and chips . Fantastic staff! Highly recommend Food: 5 Service: 5 Atmosphere: 5 || [5.0] [3 months ago on Google]: Best of All Greatest taste Broasted is perfectly cooked Food: 5 Service: 5 Atmosphere: 5 || [5.0] [4 months ago on Google]: Best service ever the employee are so kind Food: 5 Service: 5 Atmosphere: 5 || [5.0] [4 months ago on Google]: Very clean and high quality chicken with an excellent flavour Food: 5 Service: 5 Atmosphere: 4 || [2.0] [4 months ago on Google]: Food taste good but it took to much time Food: 4 Service: 1 Atmosphere: 2 || [5.0] [4 months ago on Google]: one of the best food very crunchy very tasty anf thr customer service is amazing Food: 5 Service: 5 Atmosphere: 1 || [1.0] [5 months ago on Google]: Terrible terrible food. Ordered the Al Baik dupe (boneless chicken meal) through Toters. First issue is that I got the spicy boneless instead, not sure how they could mess up like that considering the spicy meal is an entirely different item on Toters. I also got the 7UP kinza even though the meal said kinza cola. Second issue is that the chicken was extremely extremely oily, disgustingly oily. Third issue is that I found a very small piece of aluminum foil like metal in one of the chicken pieces. Absolutely shocked how this was a supposedly viral meal and some “influencers” were saying it’s better than Al Baik. I mean come on. Just a money grab. || [5.0] [8 months ago on Google]: Best food , Best taste , High quality, Amazing offers all Day every Week only at Karmesh Broast . YOU'LL EAT AND REPEAT ;) Food: 5 Service: 5 Atmosphere: 5 || [5.0] [8 months ago on Google]: Good food Food: 5 Service: 5 Atmosphere: 5 || [5.0] [a year ago on Google]: Food: 5 Service: 5 Atmosphere: 5 || [1.0] [a year ago on Google]: In terms of food quality, the place has big potential as the crispy and the broasted were very good. The fries were also very good. But the staff need to have a thorough training in the area of hygiene especially towards the general public image of the restaurant. We went there and ordered a broasted meal and a sandwhich meal. Both the chef and the server were outside having smokes all throughout the time that we were waiting for our orders. (I have taken a photo but out of decency I will not post). Imagine what would that do to the image of the restaurant!! And right when the broasted was about to be done, the chef went inside to prepare my sandwhich, and the curious paranoid person that I am, I paid attention, he immediately went and started preparing the sandwhich without washing his hands nor WITHOUT ANY GLOVES. He simply held the submarine bread of my sandwhich and started making it. That is why I didn't even eat the bread. I only ate the chicken pieces inside. Now imagine my disappointment if they had dipped the chicken in the coating without any gloves also... That part I did not see. If i had witnessed the sight of both the chef and the server having a smoking party outside before we placed our order, I would have immediately left. And I did not want to make a scene or be that rude customer, I would simply refrain from eating there again. Hopefully this review will be an eye opener for management to take this issue seriously!! As just like I've said, their fried chicken was very good. Service: Dine in Meal type: Lunch Food: 2 Service: 3 Atmosphere: 3 || [5.0] [a year ago on Google]: The Best taste and Service.. Food: 5 Service: 5 Atmosphere: 5 || [5.0] [a year ago on Google]: Super ndif w aklo ra2e3 w l portion kbiri , i recommend it Food: 5 Service: 5 Atmosphere: 5 || [5.0] [a year ago on Google]: Service: Dine in Meal type: Lunch Recommended dishes: Potato || [5.0] [a year ago on Google]: zinger big time aweyye Food: 5 Service: 5 Atmosphere: 5 || [5.0] [a year ago on Google]: Food: 5 Service: 5 Atmosphere: 5 || [5.0] [a year ago on Google]: Best restaurants Best food || [5.0] [a year ago on Google]: The food came very fast and I got a whole farooj of fried chicken and chicken sandwich for only 15$! And the workers are very nice and friendly Service: Dine in Meal type: Lunch Food: 5 Service: 5 Atmosphere: 5 || [5.0] [2 years ago on Google]: Food: 5 Service: 5 Atmosphere: 5 || [5.0] [2 years ago on Google]: Food: 5 Service: 5 Atmosphere: 5 || [5.0] [2 years ago on Google]: Best quality and shawrma ever Meal type: Other Food: 5 Service: 5 Atmosphere: 5 Recommended dishes: Pesto || [5.0] [2 years ago on Google]: Best Restaurant Ever Service: Takeaway Meal type: Lunch Food: 5 Service: 5 Atmosphere: 5 || [5.0] [2 years ago on Google]: Food: 5 Service: 5 Atmosphere: 5 || [2.0] [2 years ago on Google]: Food: 2 Service: 1 Atmosphere: 1 || [4.0] [2 years ago on Google]: Food: 3 Service: 3 Atmosphere: 2 || [2.0] [2 years ago on Google]: Food: 2 Service: 2 Atmosphere: 2 || [5.0] [2 years ago on Google]: Food: 5 Service: 5 Atmosphere: 5 || [4.0] [2 years ago on Google]: The food was absolutely great. The service a bit slow tbh but for an overall experience it was very nice and will definitely be back for more. Service: Dine in Meal type: Lunch Food: 5 Service: 3 Atmosphere: 5 || [5.0] [2 years ago on Google]: Food: 5 Service: 5 Atmosphere: 5 || [4.0] [2 years ago on Google]: Service: Takeaway Meal type: Dinner Food: 4 Service: 4 Atmosphere: 3",https://t.restaurantguru.com/2armesh-Broast-Sidon
