name,rating,cuisines,price_range,location,features,contact_info,all_reviews,url
100 Hala - ١٠٠ هلا,N/A,Pizza,1,"Armenia Street, Near Bank of Beirut, Bourj Hammoud, Mount Lebanon Governorate, Lebanon","Features, Cash only, Delivery, Takeaway",+9611569915,"[5.0] [4 years ago on Zomato]: Whatever you oder you won't be dissapointed. Good costumer service, the vibe of the place makes you feel that you are eating your grandma's food. || [5.0] [6 years ago on Zomato]: It was just an AMAZING experience, super clean ,and delicious.It has new items to first discover as it is the only place selling them. Work is clean and they are respectable with their customers. || [5.0] [6 years ago on Zomato]: Amazing food!!! Quick service and very tasty!!! The pizza is truly delicious and everything is clean. I loved the sojok manoushe!! Will come again very soon || [3.0] [6 years ago on Zomato]: Based on one takeaway. 3.5 rating Mini bites, perfected. Pizza cheesy and generous with the toppings. Sfiha yum stuffing! Spinach pies also tasty treat, but slightly oily and egg-yolky. Dough is tasty and pillowy. Big pizza could be better in terms of base and crust. Sujuk and vegetarian just average. Pepperoni is tasty though. Prices are fair and service is quick might be the friendliest.",https://t.restaurantguru.com/100-Hala-100-hla-Bourj-Hammoud
101 Gourmet,1.7,Fast food,1,"VFVR+RP6, Beirut, Beirut Governorate, Lebanon","Features, Takeaway, Cash only, Delivery",+9611379792,"[1.0] [4 years ago on Zomato]: The baked potato arrived cold like ice cube no taste at all || [3.0] [4 years ago on Zomato]: I recall requesting chips but, didn’t get chips || [4.0] [4 years ago on Zomato]: generous portion, good quality, real mutella chocolate not like other knowm places which charge you for nutella but send another type || [5.0] [4 years ago on Zomato]: Great waffles. Fast delivery. Affordable price. Highly recommended. || [1.0] [4 years ago on Zomato]: arrived a mess and crust was burnt.  ordered the same the day before was fine but hardly any bananas or strawberries 3al ri7a.  order was also late. || [5.0] [4 years ago on Zomato]: Let me tell you smthn THIS WAS BUSSIN RESPECTFULLY AAAA ITS SO GOOD I STARTED DANCING WHILE EATING IT IT WAS A LITTLE MESSY BUT WHO CARES IT WAS SO GOOD I LOVE IT ???? || [5.0] [4 years ago on Zomato]: best crepe in lebanon and for good price , second time ordered , awal marra ejit ktiir taybe w melyene , tene we7de ejit ma3moule kif maken bass taybe , anyway i will stay with 5 stars , cs its so delicious ❤️?? , u can see the the difference between the first and the second order in pictures , i wish u would send it better next time thnx ?? || [5.0] [4 years ago on Zomato]: One of the best Lotus Spread Waffles I've ever tasted. the price compared to it's taste is really fair. The delivery was really fast, i only waited for 15 or 20 minutes and the delivery guy was so friendly. A must repeat!!?? || [1.0] [5 years ago on Zomato]: The operator said 30 minutes till the food arrives.. i waited 60 MINUTES.. and when i called the said we dont know the adress.. knowing that ive ordered more than 10 times to the same spot which is in climanceau and the phone operator was super rude || [4.0] [5 years ago on Zomato]: This crepe was really enjoyable nice for a cold weather I ordered half kinder and half lotus and it was great, not over filled but also not lacking it balances out || [5.0] [6 years ago on Zomato]: Very good hotdogs and very recommended for baked potatoes as well, better than any other i would say The number 1 place to order hotdogs, they are affordable and fast || [3.0] [6 years ago on Zomato]: Based on one takeout. Baked potato Cheesy on the top but a bit dry on the inside Potato pulp needed to be mashed with more butter and sour cream. Never tried their crepes and hotdog sandwiches as of yet, maybe sometime soon. Fast and friendly takeaway service. Pocket-friendly! || [5.0] [6 years ago on Zomato]: Passing by 101 Gourmet at sanayeh, beirut district our Overall Experience was perfect since they welcomed us with a smile and gave us the good image of this brand for the first time we ordered their special crepe as desserts and they were expected, Recomended for Crepe lovers, thank you Bob for this experience. || [3.0] [6 years ago on Zomato]: A very tiny place you can stop by to get a quick order the  guy working there is cool and friendly. Prices are fair but parking is not available all the time || [5.0] [6 years ago on Zomato]: I really love the way how they make the hotdog , all the ingredients are fresh and specially they have the most delicious cheddar cheese !! And the place is very nice ! || [4.0] [7 years ago on Zomato]: Today was the first time i tried a 101 gourmet hotdog (frankfurter) & it was delicious! Now i have a place from where i can order amazing hotdogs anytime! || [3.0] [7 years ago on Zomato]: I passed by late at night to get a crepe. The crepe texture was okay. The Nutella filling could have been more. Staff were nice and I didn’t wait long. Prices are slightly more expensive compared to others. Overall, the crepe is average. Would pass again to try the baked potato and hot dogs. || [4.0] [7 years ago on Zomato]: I wasnt a crepe lover until I ate from this place. It is a small place that serves variety of crepes. I tasted several flavors like: oreo nutella crepe, kinder crepe, lotus crepe... All were satisfying and delicious. I as well tasted their hot dogs and they are tasty too?? much recommended || [5.0] [7 years ago on Zomato]: I visited this place by coincidence.. I did not even know that it existed but the variety of chocolate that they have would make any chocolate lover loose his mind.. staff super friendly and attentive.. my kids made their own costume made crepes.. in the car the smell made all of us drool... once we got home we all agreed that it is one of the best crepes we had in ages.. Great and impressive job.. Hope they keep it up.. || [3.0] [7 years ago on Zomato]: I tried backed potato and hotdog 3aj3ouj it's so good and yummy the potato with chips and cheese I recommend I tried crepes before It's was fantastic || [5.0] [7 years ago on Google]: My favorite crepe spot, also they make a great hot dog and a filling baked potato. Friendly and helpful staff. || [5.0] [7 years ago on Google]: My fiance dragged me here to try the ""3aj3ouj."" I was... skeptical. But he usually knows his food so I trusted him and followed along. To my surprise, the 3aj3ouj is a frankfurter with God knows what kind of magical things inside that make it frankfurtly delicious. I mean I was planning on only eating 1, I ended up sharing half of another one too.I know I saw the guy prepare it with peppers and onions and barbecue sauce and some other ingredients, which sound weiiiird in a frankfurter, but it's the mix really that does the trick. It's too good. And for 7000LL? Boy oh boy. Just fantastic.We also had a double chocolate crepe with white Hershey's spread and peanut butter with crispy added. Yum.101 Gourmet is excellent value for the money, as long as you figure out a parking place. || [4.0] [7 years ago on Zomato]: I tried this place tonight. I had their famous baked potato and it was really good. From the first quarter you will be full but you want more as it is delicious and yummy! The staff are too friendly but i hoped they had extra space to sit. || [5.0] [7 years ago on Zomato]: Today i have tried l 3aj3ouj.it was as usual great but i recommend not putting the tomatoes and onions inside the hotdog and also to put the hotdog first then the fillings.but the taste in general is great.???????? || [5.0] [7 years ago on Zomato]: They have delicious hotdogs especially the one called 3aj3uj. I love their baked potato as well ???????????? i recommned this place. Try their crepe as well :) || [3.0] [7 years ago on Zomato]: My friend suggested this place so we gave it a try, we tried the Frankfurter it was good and the prices are fair, the 3 rating is just because I’m not a fan of hotdogs. Would recommend it for hotdog lovers. || [4.0] [7 years ago on Zomato]: Today i ordered baked potato from 101 Gourmet I enjoyed eating my order it was delicious and rich in ingredients Even the guy who took my order is professional and he made sure that i know what my order contains Recommended || [4.0] [7 years ago on Zomato]: 101 Gourmet exceeded my expectations. This is my new favorite post party stop and I recommend it. They served sweet and savory crepes, hotdogs and baked potatoes. The small shop is clean as well as the grill and the preparation area. I went there few times and the staff are always wearing hair nets and gloves. We ordered: - Baked potato - Frankfurter - Weli3 The potato and the hotdogs are fulfilling and they both look appetizing. The baked potato is superb. They add butter, mozzarella, cheddar cheese, corn, jalapeños, mushrooms with read beans then topped with Chips and BBQ sauce. As for the hotdog, the frankfurter is a classic hotdog sandwich. I really enjoyed it and barely could finish it. It contains lettuce, tomatoes, onions, corn and jalapeños topped with cheddar cheese and chips with 4 sauces which are Mayo, mustard, BBQ sauce and ketchup. If you don’t mind the spiciness, then I suggest getting the “Weli3” Hot dog it contains jalapeños and tabasco sauce. The prices are pocket friendly. As for the service, it was quick. The staff is friendly. With {uid:29204736} || [4.0] [7 years ago on Zomato]: I ordered crepes often at work, i really love this place cause the crepes are not too sweet to digest and the crepe itself is the right amount of crispy vs moist! Also, their potatoes are delicious, and hotdogs are the best ‘street hot dogs’ I’ve had! Fast delivery and fair prices, highly recommended! || [4.0] [7 years ago on Zomato]: Delivery order only Yuppie a place that opens and delivers after 1am ???????? i miss those places ... thank you for taking into consideration after midnight hunger Operator really good Service and delivery very accurate well packaged and hot Baked potato without jalapeños and beans Had butter corn mushroom mozzarella chips bbq and plenty of cheddar cheese on top was extremely delicious and well baked Sugar and butter crepe.... i would eat it at any time delicious! Buttery sweet ❤ Extremely affordable",https://t.restaurantguru.com/101-Gourmet-Beirut
11:11 Cofeeshop,4.9,N/A,N/A,"Naqabet Al-Ateba St, Tripoli, North Governorate, Lebanon","Features, No delivery, Outdoor seating, Takeaway",+96179155556,"[5.0] [2 months ago on Google]: Great warm atmosphere, both inside & outside. They have tables outside, under the shade of a series of trees that line the street. The inside is as pleasant, great arrangement of seating, split into groups of tables, chairs & couches, in various themes. A great experience & a ice relief from the grinding busy city life outside. Food: 5 Service: 4 Atmosphere: 5 Recommended dishes: Caramel Ice Latte || [4.0] [a year ago on Google]: Nice coffee shop with cute seating and very good service. The drinks are very tasty and well prepared, and the waiters were friendly. Good spot for friends/family gatherings or solo studying outings. The WiFi connection was very poor and smoking is sadly allowed indoor. Overall great experience! Meal type: Brunch Food: 5 Service: 5 Atmosphere: 4 || [5.0] [a year ago on Google]: Tasty coffee and nice atmosphere. Loved that they serve in glass cups we only get plastic or paper nowadays. Prices are good compared to others. Food: 5 Service: 4 Atmosphere: 5 || [4.0] [a year ago on Google]: 11:11 offers a welcoming atmosphere with friendly staff and excellent customer service. The ambiance is pleasant, complemented by good WiFi, although there are occasional issues with the AC being off during hot days. The bathrooms are well-maintained, though cleanliness could be more consistent. While the staff may occasionally mix up orders, overall, it's a decent spot for enjoying coffee and a relaxed environment. Food: 5 Service: 4 Atmosphere: 5 || [4.0] [a year ago on Google]: Nice coffee shop with cute seating and very good service. The drinks are very tasty and well prepared, and the waiters were friendly. Good spot for friends/family gatherings or solo studying outings. The WiFi connection was very poor and smoking is sadly allowed indoor. Overall great experience! Service: Dine in Meal type: Brunch Food: 5 Service: 5 Atmosphere: 4 || [1.0] [a year ago on Google]: 11:11 offers a pleasant experience with helpful and friendly staff who are a delight to interact with. The menu has a wide variety of beverages, including coffee, milkshakes, smoothies, and more, all of which are generally of good quality. The atmosphere is inviting, with a cozy and well-designed interior. However, there are times when the music is played too loudly, making conversation quite difficult, even with those at the same table. Additionally, the pricing has increased recently, making it less affordable compared to old visits Update: The electricity here is so bad, so if you're coming here with a charger, expect it to get damaged, especially if heavy duty. Service: Dine in Meal type: Other Food: 3 Service: 1 Atmosphere: 4 || [5.0] [a year ago on Google]: Amazing service and atmosphere, the cafe is spacious and well decorated, wifi is good, the AC is cool and nice, if only they can make the inside area non-smoking or at least part of it Meal type: Other Food: 5 Service: 5 Atmosphere: 4 || [3.0] [a year ago on Google]: Service: Dine in Meal type: Brunch Food: 2 Service: 1 Atmosphere: 1 || [5.0] [a year ago on Google]: Dislike the self service in my opinion don’t know about other Drinks are delicious but needs more adjustment , calm place recommended for students Meal type: Other Food: 3 Service: 3 Atmosphere: 5 || [5.0] [a year ago on Google]: The location of the café is very special. The furniture is comfortable for sitting and the service is very good Service: 5 Atmosphere: 5 || [4.0] [a year ago on Google]: Great find if you're looking for a cup of coffee, casual meeting, or working with your laptop. The place offers free ~23 Mbps download speed internet over 5Ghz, which is rare to find elsewhere. There are also some board games that you can use like chess, cards and others. Meal type: Other Food: 4 Service: 5 Atmosphere: 4 || [5.0] [a year ago on Google]: Food: 4 Service: 4 Atmosphere: 4 || [5.0] [a year ago on Google]: Food: 3 Service: 5 Atmosphere: 5 || [4.0] [2 years ago on Google]: Very cozy place. The staff are super friendly, and they serve a great coffee latte . I like how the place is full of students, teachers, and remote workers, serving a great, calm place to study or work remotely with good internet. Food: 4 Service: 4 Atmosphere: 4 || [5.0] [2 years ago on Google]: The most beautiful place Food: 5 Service: 5 Atmosphere: 5 || [5.0] [2 years ago on Google]: Service: Dine in Meal type: Other Food: 5 Service: 5 Atmosphere: 5 Parking space: Somewhat difficult to find parking Parking options: Free street parking || [5.0] [2 years ago on Google]: The place is quiet and the coffee is delicious || [5.0] [2 years ago on Google]: Service: Dine in Meal type: Other Parking space: Somewhat difficult to find parking Parking options: Free street parking || [5.0] [2 years ago on Google]: Great service and a constant smile, more progress and success || [5.0] [2 years ago on Google]: Service: Dine in Meal type: Other Parking space: Somewhat difficult to find parking Parking options: Free street parking || [5.0] [2 years ago on Google]: Food: 5 Service: 5 Atmosphere: 5 || [5.0] [2 years ago on Google]: Food: 5 Service: 5 Atmosphere: 5 || [5.0] [2 years ago on Google]: Food: 5 Service: 5 Atmosphere: 5 || [5.0] [2 years ago on Google]: The best .11 Food: 5 Service: 5 Atmosphere: 5 || [5.0] [2 years ago on Google]: Best team.11 Food: 5 Service: 5 Atmosphere: 5 || [5.0] [2 years ago on Google]: Best.11 Food: 5 Service: 5 Atmosphere: 5 || [5.0] [2 years ago on Google]: Best team.11 Food: 5 Service: 5 Atmosphere: 5 || [5.0] [2 years ago on Google]: Very yummy.11 Food: 5 Service: 5 Atmosphere: 5 || [5.0] [2 years ago on Google]: The best.11 Food: 5 Service: 5 Atmosphere: 5 || [5.0] [2 years ago on Google]: Best team 11. Food: 5 Service: 5 Atmosphere: 5",https://t.restaurantguru.com/1111-Make-a-wish-Tripoli-North
