name,rating,cuisines,price_range,location,features,contact_info,all_reviews,url
46 Restaurant,1.7,Lebanese,2,"FR35+PMP, Tripoli, North Governorate, Lebanon","Features, Takeaway, Booking, Not wheelchair accessible, Сredit cards accepted, Outdoor seating",+9616212223,"[4.0] [2 years ago on Google]: Service: Take out Meal type: Other Food: 3 Service: 5 Atmosphere: 5 Recommended dishes: Halawet Aljobn with Kashta Ice Cream, Graduation Cake || [5.0] [3 years ago on Google]: Pleasant atmosphere || [5.0] [3 years ago on Google]: Food: 5 Service: 5 Atmosphere: 5 || [5.0] [6 years ago on Zomato]: one of the oldest and most well respected places in mina, no one doesn't know this place, u want class ? look no further, this is the place for u to go. || [3.0] [6 years ago on Google]: Real dishes || [5.0] [6 years ago on Google]: All the platters here are amazingly great and delicious, with a huge variety of seafood, chicken & steak platters, and pastas. The atmosphere is great as well, very soothing and relaxing. The restaurant itself has a really significant history. Just slightly expensive. || [5.0] [6 years ago on Google]: Great atmosphere and relaxing colors surrounding and views, the service was great on top of tasty food, steaks and jumbo shrimps superb taste on top the delicious salads sauce, by the way the coffee that is served was great too, finally regarding the oriental halawet Aljoben filled with icecream, just try it and tell us your opinion || [4.0] [7 years ago on Zomato]: We went there on a saturday night and we had so much fun. The music was excellent. The food was delicious and the service was very good. Portion/price is fair. We will definitely try it again. || [4.0] [7 years ago on Google]: Good and nice place || [1.0] [7 years ago on Zomato]: Fellow males who would want to have any meal with a fellow male, 46 has rules and regulations against that; suddenly we’re in the gulf, or 1946 maybe?! Yesterday, at 10 pm, I arrived with a fellow male friend from Beirut to show him, 46, a great restaurant which I’ve had plenty of great meals at, and which has been recently refurbished by a dear friend and fellow designer. A middle aged man, in a grey knit sweater, with a full head of graying hair, whom I assume is the host, and not part of the waiting staff (since he wasn’t in the usual black waistcoat/white shirt uniform, greets us. I ask if the kitchen is still open. Host: how many people are you? Me: just us two. Host: sorry, we don’t allow two males without a female. Me: that’s a really horrible thing to say. I don’t understand. Host: yes, but sorry, those are the rules. Me: are you serious? Seriously, that a horrible thing to say to anyone. Host: yes, but sorry those are the rules. We left. It is beyond my understanding to see an institution like yours do something like that. I am more than happy to notify all my male friends of your rules as to spare your clientele the embarrassment and yours of course. || [4.0] [7 years ago on Zomato]: Nice cosy and pleasant restaurant.. the view over the sea is wide and calming .. the food is varied and tasty .. the seafood is exquisite and elegantly served .. the other plates are refined.. I recommend this restautant for a tranquil and peaceful meal. || [5.0] [7 years ago on Google]: The events there are extraordinary || [5.0] [7 years ago on Google]: Excellent food and entertainment || [5.0] [7 years ago on Google]: Handed down from one generation to another, great service and great food to say the least. || [5.0] [7 years ago on Zomato]: Surprisingly a great place in the heart of mina Tripoli. Serves sea food, everything was delicious. The ashta ice cream dessert is highly recommended. || [4.0] [7 years ago on Google]: Great atmosphere and singers. One of the very few places in Tripoli for a night out. || [2.5] [7 years ago on Zomato]: Strategic location at the corniche. Food is fine. However, an enhancement in the service with extensive hospitality instructions are needed straightaway! Notice in the pictures how the petit fours plate is served above the mezza plate and how the tabbouleh is served in a small plastic plate... || [5.0] [8 years ago on Google]: Lovely food and the staff is very friendly. Try the formula including entry salad main dish and desserts for 35$ || [5.0] [8 years ago on Google]: Good food and good service and a facinating location. || [3.0] [8 years ago on Google]: Lovely New year dancing evening || [5.0] [8 years ago on Google]: Joyfull Place || [4.0] [8 years ago on Google]: Delicious food is served here || [4.0] [6 years ago on Google]: Chargé d'histoire et excellente viande. || [4.0] [6 years ago on Google]: Very good || [5.0] [6 years ago on Google]: Nice food || [3.0] [6 years ago on Google]: Normal || [3.0] [6 years ago on Google]: يحتاج إلى المزيد من التحسينات || [N/A] [7 years ago on Foursquare]: Excellent food || [5.0] [7 years ago on Google]: رائع || [4.0] [7 years ago on Zomato]: المطعم ذو طابع عائلي / وهوقديم جداً في المدينة / وله عراقته /  كريم  /  والخدمة جيدة جداً  / ضيق بعض الشيء / الطعام جيد جداً / والأسعار مقبولة  ننصح به",https://t.restaurantguru.com/46-Tripoli-North
Goodies,N/A,"Lebanese, ,, Mediterranean",N/A,"Verdun Street, Beirut, Beirut Governorate, Lebanon, 113 5315",N/A,N/A,N/A,https://t.restaurantguru.com/5-Dots-Beirut-2
603,N/A,N/A,1,"gemayzeh, gouraud street, Beirut, Beirut Governorate, Lebanon, 1100",N/A,+9613634432,N/A,https://t.restaurantguru.com/603-Beirut
N/A,N/A,N/A,N/A,N/A,N/A,+96176629489,"[5.0] [10 months ago on Google]: Food: 5 Service: 5 Atmosphere: 5 || [5.0] [a year ago on Google]: Old & gold! I grew up in the Zahle area and made so many great memories in this bar. Now whenever visiting from the United States, we still love coming here. Great service, good drinks, lovely atmosphere. PS you can always pick your music, and leave a souvenir on the walls that you’ll find generations after! Service: 5 Atmosphere: 5 || [5.0] [2 years ago on Google]: Amazing vibe, cozy atmosphere Food: 5 Service: 5 Atmosphere: 5 || [4.0] [2 years ago on Google]: Service: 4 Atmosphere: 5 || [5.0] [2 years ago on Google]: The most Based pub in the New Middle East. Food: 5 Service: 5 Atmosphere: 5 || [5.0] [2 years ago on Google]: based place full of based people Service: 5 Atmosphere: 5 || [4.0] [2 years ago on Google]: Food: 3 Service: 4 Atmosphere: 3 || [5.0] [2 years ago on Google]: Service: 5 Atmosphere: 5 || [5.0] [2 years ago on Google]: One of the best places in zahle. This place is a must go if visiting zahle Food: 5 Service: 5 Atmosphere: 5 || [5.0] [2 years ago on Google]: Loved the cozy vibes and the soft rock music. The drinks were very good. I enjoyed my night. || [5.0] [3 years ago on Google]: Best place to grab a drink in Zahle || [5.0] [3 years ago on Google]: A great place to chill with amazing service , top quality drinks and an authentic ambiance || [4.0] [4 years ago on Google]: One of the oldest most classic bars in Zahle, almost everyone in the area knows 60's bar. Located at the heart of Zahle, in an alley (for some people this might sound creepy, but it is actually charming) It is cozy and has its own vibe, drinks are cheap and the staff are very friendly. Recommended during your next trip to Zahle || [5.0] [4 years ago on Google]: Wonderful service, amazing drinks, and great people. Absolutely love it || [5.0] [4 years ago on Google]: The oldest Pub in Zahle This is the place where you feel at home, surrounded by friend and family This place is a must if u are in the area Amazing Vibes!!!! || [5.0] [4 years ago on Google]: An amazing place to go chill with your friends and meet amazing people. Top drinks, top music, exceptional vibes... || [5.0] [9 years ago on Zomato]: One of the most enjoyable places in zahle! Tasty drinks, comfortable, and simply amazing! Perfect music to chill and have a drink after a long journey! || [2.0] [9 years ago on Zomato]: Tiny pub in the middle of Zahle. We used to go there on every possible occasion. Music used smooth and nice, drinks prices were cheap. However with the change of owners couple of years ago, we stopped liking this place much. || [3.5] [9 years ago on Zomato]: Style of music satisfying different than the other pubs in zahle unique one and good atmosphere acceptable drinks . You can try it and judge it || [3.5] [10 years ago on Zomato]: Cool & friendly folks, great selection of music covering hard and pop rock genres, pocket friendly. The downside is the rather loud volume which makes it harder to converse and the closely packed tables. || [4.5] [10 years ago on Zomato]: Best place to party in zahle... great ambiance,good choice of music. Best hurricane i have ever tasted. Although it is a small place it sure is a worm place to go drink. Do not hesitate to visit",https://t.restaurantguru.com/60s-Pub-Zahle
67 Cafe,2.8,N/A,N/A,"H99M+X77, Sidon, South Governorate, Lebanon","Features, Outdoor seating, Takeaway, Booking",+9617750774,"[5.0] [6 months ago on Google]: they gave us fade and the barber put some phonk song and gave me 6 7 change and MANGO MANGO MANGO BOII SO TUFF Food: 5 Service: 5 Atmosphere: 5 || [5.0] [6 months ago on Google]: Boy The Mango Dubai Chocolate Cake is just so Rizzling And the Dudeman keep saying 67 is so tuff.Don't forget to try the eeffoc because it can make you Doi Doi Doi by Kai cenat.The eggsuka made me W Speed.Meet Adrian because he will explain their friend group with Ohio Cornball .You'll also can Meet A barbershop that cost a quarter oh boys this so Tuff Food: 5 Service: 5 Atmosphere: 5 || [5.0] [7 months ago on Google]: Boiiii so tuff 67 mangos absolute cinema great service and 67!!!! Food: 5 Service: 5 Atmosphere: 5 || [5.0] [7 months ago on Google]: Wanted to order 6 maybe 7 mangos filled with mustard but some ketchup blud came in and said ""I'm just an eeffoc"" so I wanted to call the manager but he was unfortunately getting a haircut as some place called Adrian's Barbershop cuz it only cost a quarter. Overall not a tuff experience but I'm giving 5 stars because of the wonderful experience I got using the bathroom (photo included) Meal type: Lunch Food: 5 Service: 5 Atmosphere: 5 || [5.0] [7 months ago on Google]: this cafe is soooo tuff. they served me like 67 mangos with mustard and it was delicious!!!!! the owner adrian was so nice because he explained our friendgroup. i definitely recommend the 67 cafe!!!! it's just too tuff Food: 5 Service: 5 Atmosphere: 5 || [5.0] [7 months ago on Google]: This was the tuffest experience of my life our waiter was Adrian i ordered the mango juice and my brother ordered the watermelon with mustard and it was soooooo good really recommend people to come and try Food: 5 Service: 5 Atmosphere: 5 || [4.0] [7 months ago on Google]: Ts effoc shop costed a quarter, me and my friends really liked the sigma aura we spent about 6-7 hours in ys which Is funny because until ive had my Steven here i dont give a grippers Food: 4 Service: 3 Atmosphere: 4 || [4.0] [8 months ago on Google]: I can't recommend 67 Cafe enough, especially if you're looking for a place to work. It's become my favorite spot. The vibe is just right for productivity—cozy but not so quiet that you feel like you can't type. The Wi-Fi is super reliable, the chairs are actually comfortable, and the music is always a great playlist that's not distracting at all. On top of all that, the staff are genuinely awesome and the food and coffee are top-tier. It's the perfect mix of a great cafe and a productive office space. Service: Dine in Service: 5 Atmosphere: 5 || [5.0] [a year ago on Google]: A wonderful and quiet place. I love studying there sm , and the service is very good as well. Food: 5 Service: 5 Atmosphere: 5 || [1.0] [a year ago on Google]: The place disappoined us a lot as it showed high potential. The toilets were horrible, not clean, and mixed for all genders. There was 0 ventilation despite having a small fan. Ventilation is a must for a place like this that made us feel like a hookah lounge where our eyes even started hurting. We left the place and smelt like smoke. The place is not really clean, and the drinks are average or normal. It took a while for the waiter to understand our order, so I would say not professional as well. Service: Dine in Meal type: Other Food: 1 Service: 1 || [2.0] [a year ago on Google]: They didn't have change for a 100 dollars so they returned the bill and said that it's not their fault. They suggested that we go and get the change ourselves from the facing exchanger. Service: Dine in Meal type: Other Food: 3 Service: 1 Atmosphere: 4 || [2.0] [a year ago on Google]: The place atmosphere is great. On the other hand, the waitresses were very rude. After we finished, they told us that they didn't have change, and it's not their fault. Also, after a lot of arguing and them telling us they can't do nothing we were forced to go and get change ourselves. What a bad first experience. And I am sure that I will never go there again. Service: Dine in Meal type: Other Food: 2 Service: 1 Atmosphere: 4 || [5.0] [2 years ago on Google]: 67 frappe amazing Service: Dine in Meal type: Other Food: 5 Atmosphere: 5 || [4.0] [2 years ago on Google]: Food: 4 Service: 4 Atmosphere: 4 || [5.0] [2 years ago on Google]: Service: Take out Meal type: Brunch Food: 5 Service: 5 Atmosphere: 5 || [4.0] [2 years ago on Google]: Service: Dine in Meal type: Other Food: 4 Service: 5 Atmosphere: 4 Parking space: Somewhat difficult to find parking Parking options: Free parking lot || [5.0] [2 years ago on Google]: Amazing place with really alternative vibe around it, I was studying there everyday for 2 weeks and it was perfect atmosphere. It’s calm in the morning and evening and the prices are good (in comparison with other places where you feel ripped off) - the quality is also good and all the staff were professionally trained baristas that made coffee from the heart. Service: Dine in Meal type: Brunch || [5.0] [2 years ago on Google]: Excellent service and diversity of menu items; excellent venue for informal gatherings and meetings. Service: Dine in || [5.0] [2 years ago on Google]: Food: 5 Service: 5 Atmosphere: 5 || [3.0] [a year ago on Google]: not bad || [3.0] [2 years ago on Google]: معاملة جيدة،لكن لا يوجد مكان للوقوف أغلب الاحيان Food: 3 Service: 3 Atmosphere: 3",https://t.restaurantguru.com/67-cafe-Sidon
Bliss Cafe,N/A,"Lebanese, ,, Fast food, ,, Dessert",1,"بيروت 1102،, Beirut, Beirut Governorate, Lebanon","Features, Cash only",+9611807466,"[5.0] [9 months ago on Google]: The place is really nice and cozy, the owner and staff are very nice and welcoming, this place is suitable for those who like simple cozy places, I recommend it. Service: 5 Atmosphere: 5 || [2.5] [9 years ago on Zomato]: Forget about the old Bliss House as this place is bad now. My favorite the spicy chicken was full of mayonnaise  with  old bread , Polo pesto very dry and delivery took about an hour to get from Hamra to downtown. || [3.5] [9 years ago on Zomato]: A real factory Who remembers the old bliss house way of preparing and serving food at Bliss street and kaslik? Of course kaslik ourlet has closed but since then Bliss house's outlets have been transformed into real factories à la macdonalds style. The service has become a process imposing a tight structure to clients where one has to follow the OWPE rythm: order - wait - pick up - eat However the taste also has suffered alot. Back to when we were still students, at a point of time, we used to leave our studying desks and go under a rainy weather to grab a cajun chicken sandwich or their unforgettable fajita sandwich. Today, fajita at bliss house has a different ""mechanical"" taste, a taste of all dosed, all portionned, all structured, and subsequently all tasteless at the end. || [2.5] [9 years ago on Zomato]: Took away one philly steak sandwish and one fajita to share. I was pretty disappointed . The fajita used to be way better and the philly steak was very salty guess due to soya sauce or whatever sauce they add to it :( As for desserts,  we had the medium fruit cocktail which made up for the dinner we had ... since bliss was famous for their fajita sandwiches ... || [3.0] [9 years ago on Zomato]: Sadly I eat there because it's near my university and the 3 ratings is for the amazing chicken breast salad ! They actually include all the veggies in the photo and it's not just for advertising purposes. It's amazing and very healthy. Other than that the place is a dirty hole and lacks the slightest bit of hygiene! You can feel it's dirty when you go in and the grill has a unique smell, it's creepy! This branch lost it's ability to make clean sandwiches and they do give you an uneasy feeling. We tried their latest promo for 9 thou: 3 crispy stips, chicken sandwich, cheddar sip, coleslaw, fries and soft drink. The fries are ALWAYS over fried several times in this branch in not clean oil because they taste horrible. The strips, are not strips they are popcorn chicken!! 3ayb ! (Never order crispy meal) But the sandwich was actually fine. Seriously whoever is the owner, do your job!! || [2.5] [9 years ago on Zomato]: We ordered some nice juicy mayonnaise sandwiches with an omlet. Honestly I'm a big fan of greasy food, in fact I used to eat mayo out of a jar for crying out loud. But if you need that much mayo to make an omlet taste good then there's a problem. I enjoyed it but it's not worth it at all. || [2.5] [9 years ago on Zomato]: this outlet has changed a lot over the years used to be the best place to grab a good sized sub sandwich between classes like every other place prices increased...the sandwich size shrunk and the taste changed it's no longer rich in flavour and seasoning last Philadelphia I had was short on everything except grease. meat was dry even the cheese didn't help the edges empty..what happened to the meat falling off the sandwich with every bite and the juices..dunno...not my favourite branch || [3.0] [9 years ago on Zomato]: Bliss house was the to go to restaurant during the university years. They have a good selection of sandwiches but recently salads are your best option along with dessert and drinks. Sandwiches are too greasy nowadays. The Real Steak, one of my favorites, used to be filled with more meat. The club sandwich is good. || [2.5] [9 years ago on Zomato]: The place doesn't give you a very good impression when you first enter. My friend and I ordered the spicy chicken. I was okay but would not order it again. Their fries are really great. The ones who were making our sandwiches were not wearing gloves, so this is another negative thing about the place. || [3.0] [9 years ago on Zomato]: Prices are good. Meals are not bad. However, taste is not tempting. I tried almost everything in the menu and never felt like eating any of them again. But it is not the worst place to go to || [3.5] [10 years ago on Zomato]: This little place has alot to give i love their food their meals are fulfilling and always tasty not even once wrong order id love to go  always || [3.0] [10 years ago on Zomato]: Bliss house was the to go to restaurant during the university years. They have a good selection of sandwiches but recently salads are your best option along with dessert and drinks. Sandwiches are too greasy nowadays. The Real Steak, one of my favorites, used to be filled with more meat. The club sandwich is good. || [4.0] [10 years ago on Zomato]: Really like this resturant although I rarely eat there..try the Porcalino Burger. I the quality of the food doesn't justify the prices although they are still okay. || [4.0] [10 years ago on Zomato]: My childhood's best restaurant.. I love all their sandwiches The chocolat mousse The greek salad Juices are always fresh.. Staffs are good And the value of money is cheap || [2.5] [10 years ago on Zomato]: No! This place is practically abandoned few visit during lunch break but thats only because they have seats and tables! The cashier and the staff are very rude! Not friendly at all they serve you in a way as if you have no value! The food in this outlet is average to horrible! The only thing that is edible are their fries and they're not that good! I really dont recommend this place! It was better in the past! || [2.0] [10 years ago on Zomato]: Bliss house is convenient if you want to get a basket fries or a salad nothing fancy some people like it I personally didn't find anything special about it || [3.5] [11 years ago on Zomato]: As soon as i have my lunch break , i run down to the lower gate next to LAU, to get my burger !its really good !however, the service is normal, the staff is not really as helpful as i would like them to be ....the cleanliness of the place also average,,, not greatagain, it has Good Food the only reason i keep coming back",https://t.restaurantguru.com/7-Days-Express-Beirut-2
N/A,N/A,N/A,N/A,N/A,N/A,N/A,N/A,https://t.restaurantguru.com/727-Cafe-Hazmiyeh
7abayeb Café,N/A,N/A,N/A,"VG97+MFQ, Bourj Hammoud, Mount Lebanon Governorate, Lebanon","Features, Cash only",N/A,[5.0] [9 years ago on Google]: Lovely place that has a family vibe to it || [5.0] [7 years ago on Google]: جميل || [3.0] [8 years ago on Google]: مكان جميل جدا وراقي,https://t.restaurantguru.com/7abayeb-Cafe-Bourj-Hammoud
7ob Cafe,1.1,N/A,N/A,"H98G+F4P, Sidon, South Governorate, Lebanon",N/A,+9613220113,"[5.0] [6 years ago on Google]: great cafe || [5.0] [6 years ago on Google]: It's more as if ur home cafe amazing || [5.0] [6 years ago on Google]: Best cafe in townAll card games available || [5.0] [6 years ago on Google]: Great prices, great shisha, greatest man 7ob || [5.0] [6 years ago on Google]: Great service, great stuff || [5.0] [6 years ago on Google]: Best place chokonbooz. Fast service and great shisha || [5.0] [7 years ago on Google]: Cheap, popular and the best shisha in Lebanon || [5.0] [4 years ago on Google]: Excellent || [4.0] [6 years ago on Google]: Nice person || [5.0] [6 years ago on Google]: فضل من الله || [5.0] [6 years ago on Google]: Best Place ever! Very funny man Mr.Hob || [5.0] [6 years ago on Google]: Best shisha place in Saida || [1.0] [6 years ago on Google]: خدمة مميزة",https://t.restaurantguru.com/7ob-Cafe-Sidon
7oda cafe,N/A,N/A,N/A,"Houdacafe@outlook.com, Sidon, South Governorate, Lebanon, 0000",N/A,+96176722028,N/A,https://t.restaurantguru.com/7oda-cafe-Sidon
N/A,N/A,N/A,N/A,N/A,N/A,N/A,N/A,https://t.restaurantguru.com/9-Zahle
9:30,N/A,Grill,N/A,"Hamra, Beirut, Beirut Governorate, Lebanon, 961 1 747 930",N/A,+9611747930,N/A,https://t.restaurantguru.com/930-Beirut-2
961 Pizza,N/A,Pizza,N/A,"Le Royal Street, Beirut, Beirut Governorate, Lebanon",N/A,+9614541747,"[5.0] [8 years ago on Facebook]: As delicious as a pizza can get. Well balanced and high quality ingredients, one can immediatly taste the difference. Will definitly order again soon, thanks guys || [5.0] [8 years ago on Facebook]: Pizza war has started now...italians should feel worried ...best lebanese pizza !!! || [5.0] [8 years ago on Facebook]: Best taste || [5.0] [8 years ago on Facebook]: Best taste ever!!",https://t.restaurantguru.com/961-Pizza-Beirut-3
99 Lounge Bar,N/A,N/A,N/A,"BSL bank - Zahle branch, Barbara Street, behind, Zahlé, Beqaa Governorate, Lebanon",N/A,+96181654873,N/A,https://t.restaurantguru.com/99-Lounge-Bar-Zahle
A Burger Kiosk,N/A,Fast food,1,"Main Street, Next to Hourani Car Center, Hazmiyeh, Mount Lebanon Governorate, Lebanon","Features, Cash only",+9613725393,"[4.5] [8 years ago on Zomato]: Its a simple burger kiosk that serves a very special burger The beef classic is so yummy and I visited this kisok more than 5 times every time is a special visit. The chicken isnalso delicious but I usually prefer beef burgers.. the price is so affordable I recommend you to try it asap. || [4.5] [8 years ago on Zomato]: The setting is original, the food tastes particulary healthy and delicious. The meat is grilled on real wood which gives it a really good taste. I'd recommend this place to anyone, keep up the good work. || [5.0] [8 years ago on Zomato]: This a must go place the burgers the sell arw super delicious. Try it and you won't regret. The moistured grilled patty on the wood will make your day. || [5.0] [8 years ago on Zomato]: Ktir aweh Professional Inta m3lem Istez 10000/10 Perfect price Perfect service Perfect beef Perfect sauce Perfect fries Perfect burger Atyb burger || [5.0] [8 years ago on Zomato]: Best burger kiosk ever , the meat is moist and thick ... very recommended ,done on wood for an affordable price,  ,nice job guys  and i will always taste it smokey || [4.5] [8 years ago on Zomato]: All the products were fresh and the dishes had the warmth of home-made food. The chefs takes great care in selecting the best quality ingredients. The restaurant also caters for all tastes by providing the best type of chicken and beef of the region",https://t.restaurantguru.com/A-Burger-Kiosk-Beirut
