name,rating,cuisines,price_range,location,features,contact_info,all_reviews,url
N/A,N/A,N/A,N/A,N/A,N/A,+96171050599,"[5.0] [a year ago on Google]: Food: 5 Service: 5 Atmosphere: 5 || [5.0] [2 years ago on Google]: ASH was a great fine dining restaurant in Beirut, but it closed a while ago and now the place is called Gia La Cuccina that offers very nice and pleasant dining experience . || [5.0] [6 years ago on Zomato]: Great place for a romantic occasion. The ambiance and decoration is really nice and the concept is creative especially the ""Le petit chef"" (projection of animated cartoon on the table: you have to mention it while booking as the places are limited). We ordered the amazing smoked shrimp quinoa and the tomahawk steak (served in flames to your table). Chicken baklava was average. Overall the food is excellent and full of flavors but portions are a bit small. The service is good and the experience is nice and enjoyable. || [4.0] [6 years ago on Zomato]: The food is great. Despite the small quantity in the plates, we had much fun tasting the delicious food and were full at the end. The fish was very well cooked and the meat melted in the mouth. I just didn’t like the overall ambiance in the restaurant, I found it particularly cold ! || [5.0] [6 years ago on Zomato]: We loved ASH for its very nice  ambiance , delicious food and friendly staff . We had a birthday occasion and enjoyed dinner and the tasty Japanese cake. || [5.0] [6 years ago on Zomato]: We went on a Friday night and was surprised that a restaurant like this wasn’t full on a weekend. We started with the Duck pain perdu which was exquisite, the mix of flavors was great. This dish is a must try if you’re visiting ASH. Next we ordered the Salmon roll and the Beef teryaki. The beef teryaki was very tasty, I only felt that the sauce was a bit too salty for my taste. The salmon was also good but my least favorite between the 2 other dishes (the portion was also relatively small for this dish ). Waiters are very friendly and recommended tasty dishes as well. Will definitely come back again! || [3.0] [6 years ago on Zomato]: The ambiance is average! The waiters are not friendly at all! The food is very nice: Pain perdu of duck confits and fruits chutney 9/10 Tomahawk on the wood 9/10 Truffled mashed potato 10/10 Fries with rosemary 8/10 Tereyaki beef 5/10 First when we arrived we told the waiter that we have a zomato gold so he started to negligate us! And when we asked for the bill with a zomato gold discount the waiter made us wait 17 mins and he brought it without any discount! Soo we waited another 10 mins for the final bill with a zomato gold discount! || [1.0] [6 years ago on Zomato]: Worst experience ever!!! I do not recommend this place at all!!!! Unfriendly staff, the manager didn't even know how to explain the menu .... the service was super slow we waited for one hour and a half for two appetizers and two steaks. Also the portions are too small compared to the price that you pay, 350gr of tomahawk turned out to be 6 thin slices of meat. Honestly would never visit this place again ! || [1.0] [6 years ago on Zomato]: Portions are so small, staff are unfriendly and mean. We paid for a plate for 2 and we had the portion for 1. I don’t recommend this place at all. || [2.0] [6 years ago on Zomato]: We reserved weeks in advance - once we arrived the place was empty but the manager insisted that we sit next to the door and only moved us after we argued with him. No one explained the menu, no one asked us whether we enjoyed our plates (even simple concepts explain menus and ask how everything is out of common courtesy). It felt as if the staff was a bit stuck up which ruined the experience Food wise, it is great - especially this duck risotto (not sure what the actual name was) and crispy salmon. However, the sea bass was mushy — not too pleasant || [5.0] [6 years ago on Zomato]: You can feel it the chef’s passion! Amazing ! || [5.0] [6 years ago on Zomato]: Excellent food and a very professional, friendly, and attentive service. I asked for a romantic setting for a special occasion and they set up the table absolutely beautifully. Highly recommended place. || [5.0] [6 years ago on Zomato]: Great place in monot Achrafieh The food is more than great fresh and tasty Quinoa is the best one ever and the aged beef was so delicious Great job love this place || [4.0] [6 years ago on Zomato]: A nice place to visit , should try , for the appetizers i loved the chicken beklawa however the mozerella mille feuille was not that good , for the steaks we ordered the tomahawk and the tbone dry aged 35 days : it was good but i was expecting somthing wow || [5.0] [6 years ago on Zomato]: Great place for romantic dinner. Can make a very romantic setup among request. Amazing service, food and staff. Loved the experience overall || [2.0] [6 years ago on Zomato]: The food was delicious but extremely small portion. Also, we came to try the burger and the ribs, but wa we were very disappointed as both items were not available. Also, the chicken beklawa was not available. I asked for an extra bread basket, and a basket with 2 small breads came. The wine came after we finished the main dish and was not tasty. || [5.0] [6 years ago on Zomato]: I visited Ash on my birthday. I looved this calm & fine dining restaurant. The place is a hidden gem that you have to visit. A creative menu. The food is amazing, fresh and well presented. We ordered the smoked shrimps quinoa Salad (simply WOW). And all the other plates we ordered are delicious. || [4.0] [6 years ago on Zomato]: Good quality of food but service did not meet expectations at all. No introduction of the menu, no proper explanations, reacted impolite after asking questions, not showing any interest in making the visit to the restaurant a good experience. || [1.0] [6 years ago on Zomato]: Underrated meat! Tastes very weird. service is good. restaurant looks good. Not sure about the rest. But the restaurant design looks amazing. || [2.0] [6 years ago on Zomato]: This place is soooo overpriced, the pricing is fancy where the venue is not! the bathrooms are not the ambiance is not. The food is OKAY and very overpriced. We had Le petit chef set menu with the show on projection, the show is super childish but cute and the music is so annoying as that the show music will keep playing in the background the whole time, we paid around 300$ for two people, not worth it. || [4.0] [6 years ago on Zomato]: I consider our experience in ASH as bitter sweet. The food was amazing, taste and presentation, i would give it a 5. Our waiter guided us through our choices and we really enjoyed our dinner. The staff is very friendly and courteous but the service itself was below expectations. At the end the restaurant was full and we had to wait a lot to get the bill, which did not include the zomato gold offer, and then we waited again to have it fixed; and they removed the least expensive item which contradicts the zomato gold rules. At the end we waited for the change that never came and had to leave... Afterall, not only the food counts in such an experience.. || [5.0] [6 years ago on Zomato]: Loved this place..  funky, creative menu, happy waiters, nice classy crowd..  Chef specialty dessert not to miss..  the beef black angus, duck foie gras, beetroot goat salad we’re just yummyyy, what a great unique mix of ingredients...  will surely recommend this place and visit again and again.. || [5.0] [6 years ago on Zomato]: Best meat ever, the dry aged prime ribs were excellent, duck pain perdu, bao brisket, chicken beklawa everything was way over expectations! || [5.0] [6 years ago on Zomato]: Fabulous restaurant, great food and service and on top best chef in town! || [1.0] [6 years ago on Zomato]: I was really disappointed in this restaurant, although we were very excited to visit Ash, since it was Blu Salt. To be fair, it has a unique set up and very elegant. So we ordered 2 main courses, The waiter suggested the teriyaki steak with brie cheese so we ordered it and we chose the T-Bone. To start with the teriyaki steak was not that hot but it was good, but the major disappointment was in the T-bone which came almost frozen. So then they exchanged it and this time Eddy Diab-the Chef was the one who prepared it, it was good but i had better!! So when we finished and requested the check we told them that we had Zomato Gold, the Manager came and told us that the zomato gold can only be applied when we order a third plate or even not 2 main courses, noting that we asked them before visiting the resto and they clearly explained that Zomato can be applied on everything  except for the drinks. And the same moment he re-edited his sentence and told us that we should’ve told them we have zomato when we first came in for some activation process, which is absurd since we almost have visited all the restaurants found on zomato gold and neither one of them have told us so. Then he told us that he will check and see if he can do something, he came back and told us nothing can be done since we’ve taken 2 main courses. And that was it, we paid the check and left. We will never visit them again!! || [5.0] [6 years ago on Zomato]: Amazing food experience. The subtle mix of oriental & Occidental cuisine is just wonderful. Plus the high level & friendly service. The ""surprise du chef"" dessert is a must || [5.0] [6 years ago on Zomato]: Never have i experienced such lovely service. The waiter was great and when one person in our party did not enjoy her food (because she is picky not because the food wasn't good), Chef Eddy stepped in and made a custom dish for her that was to die for.???? Would love to see some pasta/veggie options for non-meat lovers but the steaks were phenomenal! || [4.0] [6 years ago on Zomato]: I fell in love with this place. The ambiance, the service, the food.. The waiter recommended the Lobster salad as a starter: it was okay, not my favorite. As main dishes, we ordered the Tomahawk and The dry aged burger || [5.0] [6 years ago on Zomato]: I have been there sometime ago and I can not believe I did not review the amazing experience I had there. The tomahawk was just amazing . A big thanks. The service is a 5 stars one. The Hygiene is above standard. The food is amazing. I had the best date ever. Highly recommended. || [5.0] [6 years ago on Zomato]: This restaurant is the very definition of fine dining. We’ve wanted to try this place out for a while and we were more than excited to find out that it has a Zomato Gold privilege. Their Zomato Gold has been modified though, such that for every main course, you get one appetizer for free. Nevertheless, the experience was great and the food was amazing. I recommend the Teriyaki beef melted in Brie cheese under wood. The ambience is also very nice and cozy, but I do believe it requires a stronger lighting. The prices are also quite expensive, but they match the quality offered. Highly recommended!",https://t.restaurantguru.com/ASH-Beirut
AT TRAINSTATION - OUTDOORNew,4.8,N/A,N/A,"VGXJ+2FJ, Khodor, Beirut, Beirut Governorate, Lebanon",N/A,+96176499444,[2.0] [7 months ago on Google]: Service: 4 Atmosphere: 3,https://t.restaurantguru.com/AT-TRAINSTATION-OUTDOOR-Beirut
N/A,N/A,N/A,N/A,N/A,N/A,+96181778213,[N/A] [Unknown date]: Meal type: Other,https://t.restaurantguru.com/ATYAB-BASTERMA-Zahle
AUB Cafeteria - Ada Dodge,N/A,N/A,N/A,"VFXJ+VPG, Beirut, Beirut Governorate, Lebanon","Features, Takeaway",+9611350000,"[1.0] [2 years ago on Google]: We really tried, but ánd the salad, ánd the sandwich ánd the chocolate cake were mediocre and that is saying it nice. Will not eat here again. Food: 1 Service: 4 Atmosphere: 3 || [3.0] [3 years ago on Google]: A plat du jour at an affordable price such as foul thay comes with three small bread pieces and oil. And a cold black coffee if you're late. || [5.0] [6 years ago on Google]: High quality food, superb service, varity of food, fresh ingrediants, always clean always serving high quality food for good and affordable prices, good place to eat with friends especially if you are a student that is looking for a cheap yummy food and a place to eat in while hanging out with your friends. I highly recommend to try the noodles and pizza as they are super yummy and at a very low cost. || [5.0] [6 years ago on Google]: Great place. Very nice memories || [4.0] [6 years ago on Google]: Good restaurant, fair pricing, nice menu list || [4.0] [6 years ago on Google]: Great food but the quantity is not sufficient. || [5.0] [6 years ago on Google]: Affordable || [4.0] [6 years ago on Google]: Amazing combination of good healthy food and good prices || [4.0] [7 years ago on Google]: Good quality and clean || [5.0] [7 years ago on Google]: Getting better and better in all aspects || [5.0] [7 years ago on Google]: Nice home-cooked meals. Different cuisines. Affordable || [5.0] [7 years ago on Google]: safe tasty food and affordable || [3.0] [7 years ago on Google]: Definitely not outstanding... But does the job: hungry before - not hungry after! || [5.0] [7 years ago on Google]: They have everything! At a great price too! || [3.0] [7 years ago on Google]: Average cafeteria food || [5.0] [7 years ago on Google]: Delicious",https://t.restaurantguru.com/AUB-Cafeteria-Ada-Dodge-Beirut
AUDI'S,N/A,N/A,N/A,"H969+3CQ, Sidon, South Governorate, Lebanon",N/A,N/A,N/A,https://t.restaurantguru.com/AUDIS-Sidon
AVO,N/A,N/A,N/A,"H94F+R5G, Sidon, South Governorate, Lebanon","Features, Outdoor seating",N/A,N/A,https://t.restaurantguru.com/AVO-Sidon
Aabas caffee,N/A,N/A,N/A,"VGQ3+GJR, Beirut, Beirut Governorate, Lebanon",N/A,+96176710795,[5.0] [5 years ago on Google]: Best cafe in beirut || [5.0] [6 years ago on Google]: Perfect coffee a7all 3allammm || [5.0] [7 years ago on Google]: Very nice place,https://t.restaurantguru.com/Aabas-caffee-Beirut
Aajinet Albeh God's Grace,N/A,N/A,N/A,"VGVR+G64, Bourj Hammoud, Mount Lebanon Governorate, Lebanon",N/A,N/A,N/A,https://t.restaurantguru.com/Aajinet-Albeh-Gods-Grace-Bourj-Hammoud
Aal Baher,3.4,"Seafood, ,, Mediterranean, ,, Vegetarian options",2,"Street 40, Byblos, Mount Lebanon Governorate, Lebanon","Features, Outdoor seating, Сredit cards accepted, No delivery, Takeaway, Parking, Booking, Wheelchair accessible, Wi-Fi",+9619541116,"[5.0] [3 months ago on Google]: Great food, very good service, nice view. All in all highly recommended. Food: 5 Service: 5 Atmosphere: 5 || [5.0] [5 months ago on Google]: Here’s a warm and casual Google review for مطعم البحر (Aal Baher): --- We had such a wonderful experience at Aal Baher (مطعم علبحر)! The food was absolutely delicious, everything was so fresh and full of flavor. The service was excellent, fast, and super friendly, and the owners were incredibly welcoming and kind. They truly make you feel at home. Highly recommend this place if you’re looking for great seafood and a cozy atmosphere by the sea! Meal type: Lunch Food: 5 Service: 5 Atmosphere: 5 || [5.0] [6 months ago on Google]: This establishment sets itself apart with its exceptional professionalism. The dishes were carefully crafted, and the staff ensured everything was perfect. Food: 5 Service: 5 Atmosphere: 5 Vegetarian options: ok Dietary restrictions: ok || [5.0] [6 months ago on Google]: Awesome Spot for Seafood Lovers! Had a great time at this seafood place! The service was super friendly and on point — the staff really made us feel welcome and taken care of from start to finish. Food: 5 Service: 5 Atmosphere: 5 || [5.0] [6 months ago on Google]: A very nice restaurant with great service and delicious food. Food: 5 Service: 5 Atmosphere: 5 || [3.0] [8 months ago on Google]: It is expensive for the amount of food. Yes, the view is nice, the service there is wonderful, and the food is delicious, but I do not understand this high price. Meal type: Lunch Food: 4 Service: 5 Atmosphere: 4 || [5.0] [8 months ago on Google]: From the moment we walked in, everything was perfect. The fish was incredibly fresh, cooked to perfection, and full of rich, delicious flavor. Every dish we tried — especially the grilled fish platter — was a true masterpiece. You can taste the quality in every bite! What made the experience even better was the amazing staff. George So welcoming, attentive, and genuinely passionate about what they do. They made us feel right at home and gave great recommendations that made our meal unforgettable. Beautiful ambiance, outstanding food, and top-notch service. Highly recommended for anyone who loves seafood and wants to enjoy a great time. Can’t wait to come back again soon! Food: 5 Service: 5 Atmosphere: 5 || [1.0] [10 months ago on Google]: I got severe food poisoning and went to the hospital after eating here last time. Highly expensive and not worth the price. Food: 1 Service: 3 Atmosphere: 3 || [1.0] [10 months ago on Google]: worst place and service was so bad they r not welcome at all like u enter get free food , i order mix barbecue they bring it not ready still fresh meat and chicken was half ready ask to change them they bring same plate with half portion and over burn || [2.0] [10 months ago on Google]: Disappointed Experience – Not Worth the Price Visited Aal Baher with my wife expecting a pleasant seafood meal by the sea, but unfortunately the experience was below expectations. The waiter was a bit pushy and insisted we order more items, which made us uncomfortable. We ended up with a bill of $156 for just two people, which is extremely overpriced considering the portions and overall service. The view is nice, and some dishes were decent, but nothing exceptional to justify the high cost. Overall, I wouldn’t recommend it for couples or anyone looking for a relaxing, respectful dining experience in Byblos Service: 1 Atmosphere: 3 || [2.0] [11 months ago on Google]: We heard good reviews before going. The view is very nice next to the beach, other than that it wasn’t a good experience. The food wasn’t great as was expected, the service was very bad. I called later to give feedback and instead of apologising I was told everyone goes where they like. ‍‍‍not recommended at all. Service: Dine in Meal type: Lunch Food: 2 Service: 1 Atmosphere: 3 || [5.0] [11 months ago on Google]: Is a seafood specialists restaurant in Jbeil (Byblos). It brings to you the freshest catches and a symphony of Lebanese delights, all while you indulge in the serenity of our sea-view location. Prices are related with the high quality of the offered sea food plates. Food: 5 Service: 5 Atmosphere: 5 || [1.0] [a year ago on Google]: Food: 2 Service: 3 Atmosphere: 2 || [5.0] [a year ago on Google]: Food: 5 Service: 5 Atmosphere: 5 || [5.0] [a year ago on Google]: Great place on the beach. Service excellent. Food: 5 Service: 5 Atmosphere: 5 || [3.0] [a year ago on Google]: Food was ok. The fresh fish & shrimps were tasty. Food: 3 Service: 5 Atmosphere: 4 || [5.0] [a year ago on Google]: Food: 5 Service: 5 Atmosphere: 5 Service: Dine in Meal type: Dinner || [5.0] [a year ago on Google]: Food: 5 Service: 5 Atmosphere: 5 || [5.0] [a year ago on Google]: Food: 5 Service: 5 Atmosphere: 5 Service: Dine in Meal type: Lunch || [3.0] [a year ago on Google]: Nice place sea view. Food: 4 Service: 4 Atmosphere: 5 Service: Dine in Meal type: Lunch || [5.0] [a year ago on Google]: Food: 5 Service: 5 Atmosphere: 5 || [1.0] [a year ago on Google]: Very expensive and overpriced. I Don't recommend it to any one. They are thieves. Service: Dine in Meal type: Lunch Recommended dishes: Fattoush Salad, Fried Fish and Chips || [5.0] [a year ago on Google]: Food: 5 Service: 5 Atmosphere: 5 || [5.0] [a year ago on Google]: Food: 5 Service: 5 Atmosphere: 5 Service: Dine in Meal type: Lunch Recommended dishes: Hummus, Fish Sultan Ibrahim, Figs Jam, Fried Sardine Parking options: Paid parking lot || [5.0] [a year ago on Google]: Food: 5 Service: 5 Atmosphere: 5 Service: Dine in Meal type: Dinner Recommended dishes: Hummus, Fattoush Salad, French Fries, Fried Fish and Chips, Sultan Fish, Fried Calamari || [4.0] [a year ago on Google]: Food: 5 Service: 5 Atmosphere: 4 || [5.0] [a year ago on Google]: Food: 5 Service: 5 Atmosphere: 5 || [3.0] [a year ago on Google]: Food: 3 Service: 5 Atmosphere: 5 Service: Dine in Meal type: Dinner Recommended dishes: Abu Sin Raw Fish Parking space: Plenty of parking Parking options: Free of charge parking lot || [5.0] [a year ago on Google]: Food: 5 Service: 5 Atmosphere: 4 || [5.0] [a year ago on Google]: Wonderful seafood experience. Aal Baher Restaurant, located in Jbeil, has garnered widespread attention and praise for its exceptional culinary offerings. Renowned for its authentic flavors and remarkable ambiance, this esteemed establishment has consistently impressed both locals and tourists alike. Boasting a diverse menu that showcases the finest Lebanese cuisine, Aal Baher Restaurant has undoubtedly secured its place among the top dining destinations in the region. Upon entering Aal Baher, patrons are greeted with a warm and inviting atmosphere, combining traditional elements with a touch of modern sophistication. The restaurant's tastefully designed interiors and welcoming staff create an ambiance that is as comfortable as it is elegant. With a commitment to impeccable service, guests can expect to be attended to with professionalism throughout their dining experience. The menu at Aal Baher is a true reflection of Lebanon's rich culinary heritage, celebrating a myriad of flavors that have been passed down through generations. From delectable mezzes to indulgent seafood platters and succulent grilled meats, Aal Baher offers a diverse selection to cater to every palate. Using only the freshest ingredients sourced from local markets, the talented chefs skillfully craft each dish to perfection, ensuring an unforgettable dining experience. Customers who have visited Aal Baher have consistently praised the quality and authenticity of the food. The dishes have been described as flavorful, artfully presented, and reminiscent of homemade delights. The restaurant's seafood specialties, in particular, have garnered rave reviews for their freshness and delicate flavors. Additionally, Aal Baher's commitment to accommodating dietary restrictions and preferences has been highly appreciated, as they offer vegetarian and gluten-free options that are equally delightful. The exemplary service at Aal Baher Restaurant has also left an impression on patrons, with guests regularly acknowledging the attentive and knowledgeable staff. The waitstaff's expertise in explaining the menu and suggesting suitable pairings adds to the overall dining experience, elevating it to a new level of satisfaction and enjoyment. In conclusion, Aal Baher Restaurant in Jbeil stands as a true gem in the culinary landscape of Lebanon. Combining a captivating ambiance, exceptional flavors, and impeccable service, it offers an unforgettable dining experience for individuals seeking the finest Lebanese cuisine. With its consistently positive reviews and loyal customer base, Aal Baher has rightfully earned its prestigious reputation and remains a must-visit destination for those seeking an extraordinary gastronomic journey. Food: 5 Service: 5 Atmosphere: 5",https://t.restaurantguru.com/Aal-Baher-Byblos
Aal Lebnene - عل لبناني,N/A,N/A,N/A,"VV2J+WRC, Zahlé, Beqaa Governorate, Lebanon",N/A,+9613111471,N/A,https://t.restaurantguru.com/Aal-Lebnene-al-lbnany-Zahle
N/A,N/A,N/A,N/A,N/A,N/A,+9613582525,"[5.0] [3 years ago on Facebook]: Thank you for the lovely lunch and wonderful service and view || [1.0] [6 years ago on Facebook]: So I go up with a group of 7 people and they refuse us entry because I had my dog with me, A 3KG TINY DOG, ON A LEASH, THAT DOESN’T EVEN BARK. I tried to explain to them the situation they laughed in my face and hung up on me. My dog that is beyond friendly and me would love to thank you for such a treatment. What a waste of time. It’s my fault for even trying to explain or getting a big group to your restaurant. Dog haters are the lowest form of humans. #boycott_aalbaher || [5.0] [6 years ago on Facebook]: great food experiences in jbeil || [5.0] [6 years ago on Facebook]: You can’t get a more spectacular view of the Mediterranean Sea than here! Besides that, the food is fresh and authentic. We had great service, and the prices are very reasonable. || [5.0] [5 years ago on Facebook]: Valet b nassb 3lek awwal ma tewsal baddo 5000 w iza 2lt lal reception btnachefa b wjjak chi fe5r 3an jad W talabiytak btetlba 4 5 marrat ta tewsal || [5.0] [7 years ago on Facebook]: Fantastická obsluha, výborné jeflo😘",https://t.restaurantguru.com/Aal-baher-Sea-food-restaurant-Byblos
