name,rating,cuisines,price_range,location,features,contact_info,all_reviews,url
Salle 1188 pour les conférences,2.0,French,3,"St. John Street, Byblos, Mount Lebanon Governorate, Lebanon","Features, Outdoor seating, Сredit cards accepted",+96170001188,"[5.0] [5 years ago on Zomato]: The experience was great definitely deserve the 5 stars!! We order a chicken breast platter : 9/10 Chicken pesto pasta : 9/10 The atmosphere is great we sit outdoor, their drinks are sweet, the service was goood could be better. Sure will visit again. || [5.0] [6 years ago on Google]: Food is great. Highly recommend it. || [4.0] [6 years ago on Zomato]: Charming ambiance and delicious food! Although the lebanese menu was still missing by the time we tried the restaurant! Can’t wait to go again! Pavet de Saumon and Blanc de Poulet are the best!! || [3.0] [6 years ago on Google]: Good restaurant, good food and average prices || [4.0] [6 years ago on Google]: Nice and cosy place better than the old one, but they just need a good music for the atmosphere. || [4.0] [6 years ago on Google]: Very nice place, especially at night but it's a little bit expensive for what they offer. || [4.0] [6 years ago on Zomato]: I have been wanting to try this place for a long time so last night we went there on our anniversary. The staff is really friendly and welcoming and the rooftop is also nice and big but for a special occasion i would recommend to go for the indoor restaurant not the rooftop as it is more romantic and cozy. We started with the Mozzarella Cerise and you can tell by the pic that its not worth 10$. the portion was really really small and it didn't taste well and it had barley a hint of pesto sauce, but things got better with oir main dish. I had the filet de boeuf abd let me tell you even though it looks small but a thick steak and cooked till perception and the sauce was awesome as well. My fiance had the Blanc de poulet and the portion was so huge she didnt even finish it and it was also cooked very very well and the sauce was also amazing. I totally recommend for a special occasion the indoor section and for a casual classy dinner the rooftop || [4.0] [6 years ago on Google]: This gem is located in the old souk of byblos, and is both a restaurant and a venue. Recommend visiting this place around sunset time. The roof terrace overlooks the venue underneath, so if you are visiting on a weekend, you could get to watch a wedding. In as much as food is concerned, we ordered the quinoa chicken salad, the fettucini con pollo, the linguini del mare, the salmon pizza and the confit de canard. All were exceptional except the latter. Good portion size and good service since the place was almost empty. || [4.0] [6 years ago on Google]: Food is very tasty but service on table is too bad || [3.0] [6 years ago on Zomato]: ????EXTREMELY AND SHOCKING SLOW SERVICE!!!!! Our food took about 2h to be delivered. ????The dishes were dirty already ???? The outdoor seating is empty (Only us in the whole restaurant ) ???? ???? ???? ???? The food is super average. ???? The wine and view are the best two things we had. ???? Very kind and helpful waitress (Only 1 waitress managing the whole place. Np manager, no any other staff) || [4.0] [6 years ago on Zomato]: Visited this place with my friends for dinner. We sit outdoor on the rooftop. The ambiance is lovely and the atmosphere is very chill. Tried their pizza and it was really tasty. We enjoyed our night there. The service was proffessional and the staff was friendly. Would love to try their indoor part next time. Recommended || [5.0] [6 years ago on Zomato]: Great place, the food is delicious and generous, calm place with soft music, staff is friendly. It is recommended for couples and romantic dinners || [4.0] [6 years ago on Zomato]: We had the bruschetta - goat cheese salad - gratin pomme dauphinois and a couple of drinks. The bartender was so nice and even came to our table as we couldn’t decide on what to drink. The other servers were good as well. The food was flavorful, I loved the bruschetta as the bread was toasted and came with a side sauce which is not the traditional way, the goat cheese salad was also great but they could have been way more generous with the cheese portion, and the gratin was amazingggg. Also the tiramisu was good. Will be visiting again for sure. || [5.0] [6 years ago on Zomato]: Perfect place for a romantic and peaceful dinner , where you can feel and smell the magic of Byblos near the historic fortress of Jbeil . The food , music and service are simply perfect! Highly recommended place !! || [5.0] [6 years ago on Zomato]: Beautiful setting. Lovely staff and service. Steak and saumon were delicious, creme brulée is very good. A beautiful experience that I will definitely repeat. || [4.0] [6 years ago on Zomato]: The rooftop is nice, on the gate of the old city. The service is great too. The food was good. I enjoyed the pizzas and the grilled salmon. However, i found the zucchini gratin and the Alfredo pasta very average. || [4.0] [6 years ago on Zomato]: A nice rooftop place in Jbeil Big roof , nice view Very friendly and helpful staff Good menu, with choices Big plates , good taste Affordable prices You have to try it || [2.0] [6 years ago on Zomato]: The place is nice but unfortunately the salads are very poor. I ordered quinoa shrimp salad. And the frozen lemonade is just ice and the prices are very high relative to what they are providing.... Honestly I wont go back there. || [4.0] [6 years ago on Zomato]: This place is great: -ambiance: 8/10 -pizza: 8/10 -pasta: 8/10 -risotto: 9/10 -tiramisu: 9/10 -crème brûlée: 6/10 I have to add something, that they respected the terms and conditions of “zomato gold” || [5.0] [6 years ago on Zomato]: We went there at 11:30 pm. The waiters were very welcoming and helped with the menu. We ordered pizza, risotto, gratin, & desert. Everything was extremely tasty and fresh. Great job. || [5.0] [6 years ago on Zomato]: We've been there for a romantic dinner, and we're in love with it. To start with the staff, very friendly and caring, Denise helped us and she's just adorable, and the service was fast. The rooftop and the music make it a relaxing, cozy place. We've ordered: Salade chèvre so yummmy, should be tried. Bruschetta and souche de saumon fresh and tasty. Blanc de poulet and pavé de saumon just well done, good portion . As for the price it's good, suitable for the quality and the overall experience. It is one of our favorite restaurants from now on. || [4.0] [6 years ago on Zomato]: Nice food amazing location & friendly staff go there at night the roof located in the best locations in jbeil and don’t forget to book your sky dinning ???????? || [3.0] [6 years ago on Zomato]: We sat on the terrace and every single order took time. Order came with mismatching ingredients as initially ordered. Yet, floor management held responsibility and applied direct swap! Fair Value / Price || [5.0] [6 years ago on Zomato]: This place is one of a kind!! Its location directly takes you to the times of Crusaders and Saladin ruling period. 1188 is the time when Byblos was captured by Saladin. Yet the restaurant food ambience and service quality there is unbeatable. 1188, today,  lets you forget the bad times that the city had and gives you a mood of medieval yet authentic gratitude. || [2.0] [6 years ago on Google]: Had a lunch inthere on a sunny sunday in the garden..... marvelous place but awfull service..... nice staff but 5 waiters for 85 persons to eat..... somebodies were finishing eating while others didn't begun yet. Waiters had experience in food services..... they were good for drinks only !!! Nice place & people but bad service || [4.0] [6 years ago on Zomato]: Lovely place, great interior Very nice staff The food is really good I love their goat cheese salad, as well as their fries with parmesan ! To die for!!!! The salmon were also very tasty || [3.0] [6 years ago on Zomato]: Good location with average food. There is 2 parts indoors and outdoors with completely different settings. The place was completely empty so the service was pretty fast. The items that I have tried: > Blanc de poulet: the presentation was average, the chicken alone had a dull taste and it was a bit overcooked, it was quite dry. I only enjoyed the chicken by dipping it in the sauce. Overall it was an average experience. || [5.0] [6 years ago on Zomato]: The food is extremely delicious. Portion is good for two person, and the taste is very pleasant! The price is good (many told me that it’s overpriced but it’s not true) We also ordered the shrimp salade, it’s extremely light and refreshing but lacked just a little bit of sauce. Overall the experience was amazing, good service, good music, amazing view, and friendly waitress. If you’re a zomato gold member, don’t hesitate to try it! A beautiful restaurant in the heart of the most beautiful city in Lebanon! || [2.0] [6 years ago on Zomato]: I simply gave it a 2 rating for the staff. The service was very slow! After ordering the bill and before paying we told the waiter we had gold members he insisted that nothing could be done, it happened several places before and it worked out but in this case not.we even asked for a manager he told us he is and he was obviously the waiter. That was very disrespectful. The food was okay but cold but the view is nice. || [4.0] [6 years ago on Zomato]: ???????????????? Very nice location A bit hidden place Love the outdoor and indoor decoration Food : quinoa salad was delicious ????I was a bit dissappointed with the Entrocote de boeuf , i was expecting to be more delicious",https://t.restaurantguru.com/1188-Byblos
1188,1.8,"French, ,, European, ,, Vegetarian options",3,"Saint John Street, Byblos, Mount Lebanon Governorate, Lebanon","Features, Outdoor seating, Booking",+96170666999,"[5.0] [8 years ago on Facebook]: 1188 is a cosy & charming restaurant located in the heart of Jbeil. The ambiance is nice and the food is super tasty! Very friendly staff. I highly recommend this place for every Jbeil visitor! || [5.0] [8 years ago on Facebook]: Amazing ambiance, great food, and great management! Such a generous and hospitable restaurant. Recommended for all! || [5.0] [8 years ago on Facebook]: Nice place good food , roof top summer time is good || [N/A] [8 years ago on Foursquare]: Great place friendly service and the food is wonderful salmons are so delicious and the steak is a must try || [5.0] [9 years ago on Facebook]: Great place. Amazing food. Wonderful experience. The food is the best I have had in a long time. || [N/A] [9 years ago on Foursquare]: Everything is good || [5.0] [9 years ago on Facebook]: Great place, great people and service, very welcoming and respectful, amazing food, all in all excellent!!! || [5.0] [9 years ago on Facebook]: Awesome ambiance, food, music, and people! Very elegant and chic and the staff are always smiling. || [N/A] [9 years ago on Foursquare]: Food was spot on! We were here for. Friends wedding & dinner the night before. Definitely a great spot to dine and the terrace is beautiful to sit on. || [5.0] [10 years ago on Facebook]: Wonderfull!! Great place, Great staff, Great food!! i love this place, should visit! || [N/A] [10 years ago on Foursquare]: Didn't like the place much, bathrooms were dirty and pizza wasn't tasty! Waiters are very friendly though",https://t.restaurantguru.com/1188-Byblos-2
16MM,4.5,"Dessert, ,, Salads",3,"Gouraud, Beirut, Beirut Governorate, Lebanon","Features, Cash only, No delivery, Outdoor seating, Parking, No booking, Wheelchair accessible",+96181440760,"[5.0] [a month ago on Google]: Amazing place to hang out with friends, the atmosphere is very fun, friendly and down to earth. I was surprised they have one of the best burgers I’ve ever had. Definitely a must try. Keep up the good work! Food: 5 Service: 5 Atmosphere: 5 || [5.0] [2 months ago on Google]: Loved the vibes, ambiance & most importantly the burger. It’s a muuust try. Best way to spend my evenings: Tasty cocktails, friendliest staff & great music! Food: 5 Service: 5 Atmosphere: 5 || [5.0] [2 months ago on Google]: Amazing burgers and great drinks! The food is freshly prepared in front of you, which is a really nice experience, and even though everything is cooked there, the smell is not bothering at all. The burgers are juicy and full of flavor, and the drinks are well balanced and refreshing. The music is really good without being too loud, so you can still enjoy conversations. The service is fast and professional, the staff are friendly, and the atmosphere is great. Definitely a place worth coming back to. Food: 5 Service: 5 Atmosphere: 5 || [5.0] [2 months ago on Google]: 16mm has been my go-to place for a while. The staff's friendliness, and cozy yet lively atmosphere make it feel like home. THEIR BURGER IS A MUST HAVE! My favorite thing? Pet friendly, and my baby is always very well taken care of Food: 5 Service: 5 Atmosphere: 5 || [4.0] [2 months ago on Google]: Really nice place, good music and they do movie night as well. Different seating options. However you cannot reserve, policy is first come first serve which can be inconvenient. Service: 5 Atmosphere: 4 || [5.0] [2 months ago on Google]: First time visiting 16MM. Such a nice place, atmosphere, and staff. Enjoyed our time there! Highly Recommended! Food: 5 Service: 5 Atmosphere: 5 || [5.0] [5 months ago on Google]: I’ve been coming here for a while now and it’s honestly become my go-to spot in Beirut. Every time I walk in, I feel at home. The staff are so warm and genuine, they really take care of you and make the whole experience special. The food and drinks are always amazing, but what I love most is the vibe, it’s welcoming, fun, and also feels like such a safe space. You can tell how much love and effort goes into everything they do. For me, this is the best bar in Beirut and I can’t recommend it enough! Food: 5 Service: 5 Atmosphere: 5 || [5.0] [10 months ago on Google]: Amazing cozy bar with the nicest, most welcoming staff! Billy, Bruno, Karl, and the wonderful female staff make it feel like home! I come to beirut often and will continue to stop by each time I am in town! Best arak also! Food: 5 Service: 5 Atmosphere: 5 || [1.0] [11 months ago on Google]: Didn’t enjoy the drink The bartenders weren’t attentive , although the place wasn’t crowded Service: 1 Atmosphere: 2 || [5.0] [a year ago on Google]: If you are around Gemmayze, whether you're a local or an expat, this is your place to be! Excellent food, outstanding cocktail mixes and by far one of the most welcoming and friendly atmospheres. Very highly recommended! Cheers to the amazing team & management! Food: 5 Service: 5 Atmosphere: 5 || [5.0] [a year ago on Google]: One of the best food, tastiest drinks and amazing staff Food: 5 Service: 5 Atmosphere: 5 || [5.0] [a year ago on Google]: The drinks, food, and vibe at 16mm are amazing, and the incredible people who work there make this place feel like home! Food: 5 Service: 5 Atmosphere: 5 || [5.0] [a year ago on Google]: I’ve been going to this place since it opened about 2-3 years ago, and it has consistently been one of my favorite spots to unwind. The staff are incredibly friendly and always make you feel welcome, which adds to the overall amazing vibes of the place. The atmosphere is perfect for chilling with friends—the music is at just the right volume, allowing you to have a conversation without shouting. It’s a refreshing change from other venues where the music can be overwhelming. One of the standout features, and something I truly admire, is the thoughtful touch of providing sanitary pads in the women’s restroom. It’s such a simple yet impactful gesture, and it’s the first place I’ve seen in Lebanon show this level of support for women. It really sets them apart and shows how much they care about their guests. Food: 5 Service: 5 Atmosphere: 5 || [5.0] [a year ago on Google]: La atención del chico del bar malísima Food: 5 Service: 1 Atmosphere: 5 || [5.0] [a year ago on Google]: Food: 5 Service: 5 Atmosphere: 5 || [4.0] [a year ago on Google]: friendly staff. music is loud || [1.0] [a year ago on Google]: Worse place ever in Gemmayze! The security or manager guy is super RUDE and impolite! No wonder why this place is always empty! Don’t go to this place if you are western or a group of 3 guys, they won’t let you in! Visiting from London , my friends and I, are so disgusted from this security guy/ the manager, and we would never go back to this place 16MM management , it is 2024 not 2004 you need to grow up with this doors attitude! Food: 1 Service: 1 Atmosphere: 1 || [1.0] [a year ago on Google]: Disgusting behaviour from the manager. 11.30pm Friday. Bar is empty. Refused entry to me and my three friends, on the grounds that we're all male. I wonder why that place is empty? Because they told all the males to go away. And in this city of single women, a bar with loads of men would be a magnet to women. The manager was rude, offensive, aggressive and a very bad representative for the owners of this place. I don't think westerners are welcome on this establishment Food: 1 Service: 1 Atmosphere: 1 || [5.0] [a year ago on Google]: Great food, drink... & movies! Food: 5 Service: 5 Atmosphere: 5 || [5.0] [2 years ago on Google]: I went to 16MM to get just one drink and I was planning to be there just for an hour. I ended up spending a bit more than two hours and drank three. They were really friendly and helpful, drinks were tasty and I tried to get the link for the playlist (I couldn't). That's all I have to say. When I look back and think about my trip to Beirut, I'll remember 16MM. Food: 5 Service: 5 Atmosphere: 5 || [5.0] [2 years ago on Google]: After a recent bad experience, 16mm management made sure to take the extra mile and provide us with the ""right"" 16mm vibes and overall experience. Keep it up and thank you ! Food: 4 Service: 5 Atmosphere: 4 || [1.0] [2 years ago on Google]: I went there with my friends who recommended the place yet all of us ended up leaving quite disappointed. We ordered three drinks and despite being different, they all came in highball glasses (moscow mule, too) . We asked for straws for such glasses, but weren't given any due to their eco-friendliness. The drinks tasted very regular and had a lot of icecubes. The nachos were just like the packet that anyone can get at home. The spinach and artichoke dip were the only thing that cheered us up. Food: 2 Service: 1 Atmosphere: 2 || [5.0] [2 years ago on Google]: Food: 5 Service: 5 Atmosphere: 5 || [5.0] [2 years ago on Google]: Great bar with even greater staff. Come here for fun! Food: 5 Service: 5 Atmosphere: 5 || [4.0] [2 years ago on Google]: Easy going, chill bar Service: 4 Atmosphere: 4 || [5.0] [2 years ago on Google]: As a regular and a chef with a passion for film, comic books, and music, 16MM has been my go-to spot since its opening in 2019. The welcoming staff, creative cocktails, and tasty bar food never disappoint. Not to mention the fantastic atmosphere on events night! Highly recommend! Food: 5 Service: 5 Atmosphere: 5 || [2.0] [2 years ago on Google]: Prices above average. Atmosphere okay at best. Very hot inside. Food: 3 Service: 3 Atmosphere: 3 || [5.0] [2 years ago on Google]: A lovely and welcoming atmosphere fit for all crowds accompanied with a very friendly staff, great service, and a very wide variety of personalized food and drink options. A must try! Food: 5 Service: 5 Atmosphere: 5 || [5.0] [2 years ago on Google]: Best place in town! Excellent cocktails, great music and amazing staff! Food: 5 Service: 5 Atmosphere: 5 || [5.0] [2 years ago on Google]: Best place in town Food: 5 Service: 5 Atmosphere: 5",https://t.restaurantguru.com/16-MM-Beirut
19 Restaurant-khalde,4.8,"Mediterranean, ,, Vegetarian options",2,"QFMG+RGC, Khalde, Mount Lebanon Governorate, Lebanon","Features, Сredit cards accepted, Delivery, Takeaway, Booking, Wheelchair accessible",+9615807800,"[5.0] [a year ago on Google]: We try to call more then 4-5 time to make reservation yeftaho khatt w ma hada be red iza men reservation mbalshe hek Service: 1 || [5.0] [a year ago on Google]: Food: 5 Service: 5 Atmosphere: 5 || [5.0] [a year ago on Google]: Service: Dine in Meal type: Lunch Food: 5 Service: 5 Atmosphere: 5 Parking space: Plenty of parking Parking options: Free of charge parking lot, Valet, Free of charge parking garage || [3.0] [2 years ago on Google]: Service top. Food not wow. Service: Dine in Meal type: Lunch Recommended dishes: Special 19 Lentil Soup Parking space: Plenty of parking Parking options: Free of charge parking lot || [5.0] [2 years ago on Google]: food was amazing and didnt take much time to get to the table and wht was even better than the food was the service and how respectful and dedicated the staff were to give us the best experience Service: Dine in Meal type: Lunch Food: 5 Service: 5 Atmosphere: 5 Recommended dishes: BBQ Chicken with BBQ Sauce and Louisiana Sauce, Special 19 Lentil Soup || [5.0] [2 years ago on Google]: Food is good and the waiters are so kind Meal type: Other Food: 5 Service: 5 Atmosphere: 5 || [1.0] [2 years ago on Google]: Sushi was bad Tried salmon sashimi - taste weird , warm and slimy Tuna sashimi - was off color, dry and tasted strange Too bad would have loved a good sushi place nearby Service: Dine in Meal type: Dinner Food: 1 Service: 4 Atmosphere: 3 || [5.0] [2 years ago on Google]: Very nice service and taste. Service: Dine in Meal type: Dinner Food: 5 Service: 5 Atmosphere: 5 || [5.0] [3 years ago on Google]: Excellent in every thing: welcoming, cuisine, alll is excellent. Food: 5 Service: 5 Atmosphere: 5 || [1.0] [3 years ago on Google]: Very high prices and the place is not good at all and dirty Food: 1 Service: 1 Atmosphere: 1 || [5.0] [3 years ago on Google]: Food: 4 Service: 3 Atmosphere: 5 || [5.0] [3 years ago on Google]: Very larg hall and a calm place if you like to eat peacefully..very polite staff Service: Dine in Meal type: Dinner || [4.0] [3 years ago on Google]: Complimentary lentil soup is the best, all there menu is amazing || [5.0] [4 years ago on Google]: Amazing place. Great gym. Highly recommended || [3.0] [4 years ago on Google]: Lovely place, good food quality. A bit over priced. || [1.0] [4 years ago on Google]: Alot of the food is served while still frozen from the inside, very poor and slow service even if the restaurant has no customers. || [5.0] [4 years ago on Google]: One of the best restaurants I've been into ! Food is amazing very very tasty, service is magnificent and this waiter Ahmed absolutely a great waiter.The atmosphere is pretty cozy , will definitely visit again || [4.0] [6 years ago on Google]: Not bad one time visit only || [1.0] [6 years ago on Google]: Worst service and worst management ever! They withdrew 740$ instead of 74$ from my bank card and now they can't do anything about it till next week. It is now my duty to go and sign a dispute at my bank and lose 2 hours of my time because of a mistake they did. SHAME || [5.0] [6 years ago on Google]: The place is very nice the staff is extremely friendly helpful and attentive.The service is great that's for sure and the food as well whether it is chicken or meet both tasted delicious and the welcome soup is amazing. They have sushi as well. You can order a nargila and it's OK There is also a play area called festival Fiesta on another floor if the kids are old enough they can go play on their own other wise you need to stay with them || [5.0] [6 years ago on Google]: Great restaurant! || [5.0] [6 years ago on Google]: Great ambiance, service, and Food! Amazing place. || [3.0] [6 years ago on Google]: Coffee is good but the sizes are small and way overpriced compared to other shops. || [5.0] [6 years ago on Google]: V.Good when it comes to meet & greet, fast service, good service, nice presentation, variety of plates & the ambiance!! keep it up 19 || [4.0] [6 years ago on Google]: Nice place. Nicely served plates || [5.0] [6 years ago on Google]: Wonderful place good service and testy food. I like it and i will visit again || [5.0] [7 years ago on Google]: A great restaurant with all services, food and place. || [3.0] [7 years ago on Google]: Nice decoreted rrsturent. And yammi food || [5.0] [7 years ago on Google]: Great food || [5.0] [7 years ago on Google]: Great place and great food, the number one destination if you are in the khaldi area",https://t.restaurantguru.com/19-Khalde
