city,location_id,address,restaurant_name,website,tripadvisor_url,rating,num_reviews,review_title,review_text,review_rating
Batroun Lebanon,23753247,"1106 Old Souk Road Old Souk, Batroun 0000 Lebanon",Elie's Yard,http://eliesyardbatroun.weebly.com,https://www.tripadvisor.com/Restaurant_Review-g1943861-d23753247-Reviews-Elie_s_Yard-Batroun_North_Governorate.html?m=66827,5.0,3,Very nice and friendly place,"We had breakfast twice here while staying in Batroun. The place is really laid back, with a yard with lemon trees and colorful tables, and also a veranda with sofas and low tables. The food is delicious and plenty, we were a group of six and ordered just different dishes to share. Elie and his family are very friendly and will answer every question you have. If we come to Batroun again we will definitely go back here!",5
Batroun Lebanon,23753247,"1106 Old Souk Road Old Souk, Batroun 0000 Lebanon",Elie's Yard,http://eliesyardbatroun.weebly.com,https://www.tripadvisor.com/Restaurant_Review-g1943861-d23753247-Reviews-Elie_s_Yard-Batroun_North_Governorate.html?m=66827,5.0,3,A hidden gem ,"We came for breakfast. Food was delicious, the service is amazing. The family running the place is very friendly. Would definitely visit this place again! ",5
Batroun Lebanon,26262454,"Yasamin By The Mediterranean, Batroun Lebanon",YAZZ Lounge & Garden,https://www.instagram.com/yazz.batroun/,https://www.tripadvisor.com/Restaurant_Review-g1943861-d26262454-Reviews-YAZZ_Lounge_Garden-Batroun_North_Governorate.html?m=66827,,0,,,
Batroun Lebanon,17679012,"Old Souks, Batroun Lebanon",Barrio 67,,https://www.tripadvisor.com/Restaurant_Review-g1943861-d17679012-Reviews-Barrio_67-Batroun_North_Governorate.html?m=66827,5.0,2,Short break in Batroun,"Great place to chillax and enjoy their excellent food and a Jameson on ice. Had lunch here on a wet Friday afternoon, the staff were very friendly",5
Batroun Lebanon,17679012,"Old Souks, Batroun Lebanon",Barrio 67,,https://www.tripadvisor.com/Restaurant_Review-g1943861-d17679012-Reviews-Barrio_67-Batroun_North_Governorate.html?m=66827,5.0,2,"Awesome food, great ambience - must visit in Batroun","It's a really cute and new spot in Batroun with an amazing fit out and awesome food. Very quirky! We had the Avocado and eggs on toast and the steak sandwich, both really good. Very clean. Highly recommend the visit. Also worth mentioning, great staff. Highly recommend. French Press coffee was amazing as well. ",5
Batroun Lebanon,26350197,"Batroun Old Souks, Batroun Lebanon",Ahwet Zeitouna Batroun,http://ahwetzeitouna.co,https://www.tripadvisor.com/Restaurant_Review-g1943861-d26350197-Reviews-Ahwet_Zeitouna_Batroun-Batroun_North_Governorate.html?m=66827,3.3,3,Fast service,"We were a big group of friends and family with kids.
Service was good and fast.
Atmosphere so nice, and food was good.
Recommend for big group",4
Batroun Lebanon,26350197,"Batroun Old Souks, Batroun Lebanon",Ahwet Zeitouna Batroun,http://ahwetzeitouna.co,https://www.tripadvisor.com/Restaurant_Review-g1943861-d26350197-Reviews-Ahwet_Zeitouna_Batroun-Batroun_North_Governorate.html?m=66827,3.3,3,Great athmosphere,"This is one of the most athmospheric and lively places to eat traditonal lebanese dishes and enjoy some shisha in Batroun.

Definitely recommend for a good time when you're in the area.",5
Batroun Lebanon,26350197,"Batroun Old Souks, Batroun Lebanon",Ahwet Zeitouna Batroun,http://ahwetzeitouna.co,https://www.tripadvisor.com/Restaurant_Review-g1943861-d26350197-Reviews-Ahwet_Zeitouna_Batroun-Batroun_North_Governorate.html?m=66827,3.3,3,Bad restaurant,"The meals are too small , dishes are not rich with good quantity 
Very expensive 
Very expensive 
Very expensive
It was the last time",1
Batroun Lebanon,2608428,"Batroun Highway Msaylha Fortress road, Batroun 961 Lebanon",Arnaoon Village,http://www.arnaoonvillage.com,https://www.tripadvisor.com/Restaurant_Review-g1943861-d2608428-Reviews-Arnaoon_Village-Batroun_North_Governorate.html?m=66827,4.5,230,Great experience,"We went for Christmas,  it is the third year in a row  , everything was magical the staff are so friendly like always, the shows are super nice. We have a great time.",5
Batroun Lebanon,2608428,"Batroun Highway Msaylha Fortress road, Batroun 961 Lebanon",Arnaoon Village,http://www.arnaoonvillage.com,https://www.tripadvisor.com/Restaurant_Review-g1943861-d2608428-Reviews-Arnaoon_Village-Batroun_North_Governorate.html?m=66827,4.5,230,Excellent,"Very nice day to spend with family 
Every thing was perfect ,from activities to food, the good ambiance.We had a very nice day.We highly recommend it",5
Batroun Lebanon,2608428,"Batroun Highway Msaylha Fortress road, Batroun 961 Lebanon",Arnaoon Village,http://www.arnaoonvillage.com,https://www.tripadvisor.com/Restaurant_Review-g1943861-d2608428-Reviews-Arnaoon_Village-Batroun_North_Governorate.html?m=66827,4.5,230,Baptism at arnaoun village,"We had a wonderful event yesterday at Arnaoun Village, and everything exceeded our expectations! The venue was absolutely charming and created the perfect atmosphere for our special occasion.

A heartfelt thank you to Miss Rasha, who was incredibly helpful, organized, and clear throughout the entire planning process. Her support truly made everything run smoothly.

The staff and waiters were very professional and attentive, always available with a smile and ready to help.",5
Batroun Lebanon,2608428,"Batroun Highway Msaylha Fortress road, Batroun 961 Lebanon",Arnaoon Village,http://www.arnaoonvillage.com,https://www.tripadvisor.com/Restaurant_Review-g1943861-d2608428-Reviews-Arnaoon_Village-Batroun_North_Governorate.html?m=66827,4.5,230,Everyone must go & try,"Everything was great from activities to food to stuff to music,we enjoyed every moment
1 cmnt u should add karting for adults",5
Batroun Lebanon,2608428,"Batroun Highway Msaylha Fortress road, Batroun 961 Lebanon",Arnaoon Village,http://www.arnaoonvillage.com,https://www.tripadvisor.com/Restaurant_Review-g1943861-d2608428-Reviews-Arnaoon_Village-Batroun_North_Governorate.html?m=66827,4.5,230,Best experience ever,"We were for a weekend guests house, it was the best weekend ever,best team,best food,best village and the best gathering",5
Batroun Lebanon,25273290,"Batroun Old Souks, Batroun Lebanon",Yasamin By The Mediterrenean,,https://www.tripadvisor.com/Restaurant_Review-g1943861-d25273290-Reviews-Yasamin_By_The_Mediterrenean-Batroun_North_Governorate.html?m=66827,,0,,,
